{"componentChunkName":"component---src-layouts-article-layout-tsx","path":"/components-standalone/schema","result":{"data":{"site":{"siteMetadata":{"docsLocation":"https://github.com/graphql-nexus/docs/tree/master/content"}},"mdx":{"fields":{"slug":"/06-components-standalone/01-schema"},"body":"function _extends() { _extends = Object.assign || function (target) { for (var i = 1; i < arguments.length; i++) { var source = arguments[i]; for (var key in source) { if (Object.prototype.hasOwnProperty.call(source, key)) { target[key] = source[key]; } } } return target; }; return _extends.apply(this, arguments); }\n\nfunction _objectWithoutProperties(source, excluded) { if (source == null) return {}; var target = _objectWithoutPropertiesLoose(source, excluded); var key, i; if (Object.getOwnPropertySymbols) { var sourceSymbolKeys = Object.getOwnPropertySymbols(source); for (i = 0; i < sourceSymbolKeys.length; i++) { key = sourceSymbolKeys[i]; if (excluded.indexOf(key) >= 0) continue; if (!Object.prototype.propertyIsEnumerable.call(source, key)) continue; target[key] = source[key]; } } return target; }\n\nfunction _objectWithoutPropertiesLoose(source, excluded) { if (source == null) return {}; var target = {}; var sourceKeys = Object.keys(source); var key, i; for (i = 0; i < sourceKeys.length; i++) { key = sourceKeys[i]; if (excluded.indexOf(key) >= 0) continue; target[key] = source[key]; } return target; }\n\n/* @jsx mdx */\nvar _frontmatter = {\n  \"title\": \"`@nexus/schema`\",\n  \"metaTitle\": \"@nexus/schema\"\n};\n\nvar makeShortcode = function makeShortcode(name) {\n  return function MDXDefaultShortcode(props) {\n    console.warn(\"Component \" + name + \" was not imported, exported, or provided by MDXProvider as global scope\");\n    return mdx(\"div\", props);\n  };\n};\n\nvar layoutProps = {\n  _frontmatter: _frontmatter\n};\nvar MDXLayout = \"wrapper\";\nreturn function MDXContent(_ref) {\n  var components = _ref.components,\n      props = _objectWithoutProperties(_ref, [\"components\"]);\n\n  return mdx(MDXLayout, _extends({}, layoutProps, props, {\n    components: components,\n    mdxType: \"MDXLayout\"\n  }), mdx(\"section\", null, mdx(\"h1\", _extends({\n    parentName: \"section\"\n  }, {\n    \"id\": \"nexusschema\",\n    \"style\": {\n      \"position\": \"relative\"\n    }\n  }), mdx(\"a\", _extends({\n    parentName: \"h1\"\n  }, {\n    \"href\": \"#nexusschema\",\n    \"aria-label\": \"nexusschema permalink\",\n    \"className\": \"title-link before\"\n  }), mdx(\"svg\", _extends({\n    parentName: \"a\"\n  }, {\n    \"width\": \"17\",\n    \"height\": \"18\",\n    \"viewBox\": \"0 0 17 18\",\n    \"fill\": \"none\",\n    \"xmlns\": \"http://www.w3.org/2000/svg\"\n  }), \"\\n      \", mdx(\"path\", _extends({\n    parentName: \"svg\"\n  }, {\n    \"d\": \"M1.5 6.33337H15.5\",\n    \"stroke\": \"#CBD5E0\",\n    \"strokeWidth\": \"2\",\n    \"strokeLineCap\": \"round\",\n    \"strokeLineJoin\": \"round\"\n  })), \"\\n      \", mdx(\"path\", _extends({\n    parentName: \"svg\"\n  }, {\n    \"d\": \"M1.5 11.6666H15.5\",\n    \"stroke\": \"#CBD5E0\",\n    \"strokeWidth\": \"2\",\n    \"strokeLineCap\": \"round\",\n    \"strokeLineJoin\": \"round\"\n  })), \"\\n      \", mdx(\"path\", _extends({\n    parentName: \"svg\"\n  }, {\n    \"d\": \"M6.75 1L5 17\",\n    \"stroke\": \"#CBD5E0\",\n    \"strokeWidth\": \"2\",\n    \"strokeLineCap\": \"round\",\n    \"strokeLineJoin\": \"round\"\n  })), \"\\n      \", mdx(\"path\", _extends({\n    parentName: \"svg\"\n  }, {\n    \"d\": \"M12 1L10.25 17\",\n    \"stroke\": \"#CBD5E0\",\n    \"strokeWidth\": \"2\",\n    \"strokeLineCap\": \"round\",\n    \"strokeLineJoin\": \"round\"\n  })), \"\\n      \")), mdx(\"inlineCode\", {\n    parentName: \"h1\"\n  }, \"@nexus/schema\")), mdx(\"pre\", {\n    parentName: \"section\"\n  }, mdx(\"code\", _extends({\n    parentName: \"pre\"\n  }, {\n    \"className\": \"language-cli\"\n  }), \"npm install @nexus/schema\\n\")), mdx(\"section\", {\n    parentName: \"section\"\n  }, mdx(\"h4\", _extends({\n    parentName: \"section\"\n  }, {\n    \"id\": \"why-nexus-docsify-ignore\",\n    \"style\": {\n      \"position\": \"relative\"\n    }\n  }), mdx(\"a\", _extends({\n    parentName: \"h4\"\n  }, {\n    \"href\": \"#why-nexus-docsify-ignore\",\n    \"aria-label\": \"why nexus docsify ignore permalink\",\n    \"className\": \"title-link before\"\n  }), mdx(\"svg\", _extends({\n    parentName: \"a\"\n  }, {\n    \"width\": \"17\",\n    \"height\": \"18\",\n    \"viewBox\": \"0 0 17 18\",\n    \"fill\": \"none\",\n    \"xmlns\": \"http://www.w3.org/2000/svg\"\n  }), \"\\n      \", mdx(\"path\", _extends({\n    parentName: \"svg\"\n  }, {\n    \"d\": \"M1.5 6.33337H15.5\",\n    \"stroke\": \"#CBD5E0\",\n    \"strokeWidth\": \"2\",\n    \"strokeLineCap\": \"round\",\n    \"strokeLineJoin\": \"round\"\n  })), \"\\n      \", mdx(\"path\", _extends({\n    parentName: \"svg\"\n  }, {\n    \"d\": \"M1.5 11.6666H15.5\",\n    \"stroke\": \"#CBD5E0\",\n    \"strokeWidth\": \"2\",\n    \"strokeLineCap\": \"round\",\n    \"strokeLineJoin\": \"round\"\n  })), \"\\n      \", mdx(\"path\", _extends({\n    parentName: \"svg\"\n  }, {\n    \"d\": \"M6.75 1L5 17\",\n    \"stroke\": \"#CBD5E0\",\n    \"strokeWidth\": \"2\",\n    \"strokeLineCap\": \"round\",\n    \"strokeLineJoin\": \"round\"\n  })), \"\\n      \", mdx(\"path\", _extends({\n    parentName: \"svg\"\n  }, {\n    \"d\": \"M12 1L10.25 17\",\n    \"stroke\": \"#CBD5E0\",\n    \"strokeWidth\": \"2\",\n    \"strokeLineCap\": \"round\",\n    \"strokeLineJoin\": \"round\"\n  })), \"\\n      \")), \"Why Nexus? {docsify-ignore}\"), mdx(\"p\", {\n    parentName: \"section\"\n  }, \"Words from the original author, Tim Griesser;\"), mdx(\"p\", {\n    parentName: \"section\"\n  }, \"Nexus Schema was born out of my experience building several production GraphQL APIs, in different languages and frameworks. The first with vanilla \", mdx(\"a\", _extends({\n    parentName: \"p\"\n  }, {\n    \"href\": \"https://github.com/graphql/graphql-js\"\n  }), \"graphql-js\"), \", another schema-first with \", mdx(\"a\", _extends({\n    parentName: \"p\"\n  }, {\n    \"href\": \"https://github.com/matthewmueller/graph.ql\"\n  }), \"graph.ql\"), \" and later \", mdx(\"a\", _extends({\n    parentName: \"p\"\n  }, {\n    \"href\": \"https://github.com/apollographql/graphql-tools\"\n  }), \"graphql-tools\"), \". Following that with \", mdx(\"a\", _extends({\n    parentName: \"p\"\n  }, {\n    \"href\": \"https://docs.graphene-python.org/en/latest/\"\n  }), \"graphene-python\"), \" and most recently with a bit of \", mdx(\"a\", _extends({\n    parentName: \"p\"\n  }, {\n    \"href\": \"http://graphql-ruby.org/\"\n  }), \"graphql-ruby\"), \".\"), mdx(\"p\", {\n    parentName: \"section\"\n  }, \"After working with the toolkits in other scripting languages, it felt like there was a gap in the JavaScript approaches. Schema-first development starts out great, by simply expressing your schema in the GraphQL Schema Definition Language (SDL) and providing resolvers matching to the types as needed you are up and running fast! No need for tons of requires or \\\"overhead\\\" to get a GraphQL server running.\"), mdx(\"p\", {\n    parentName: \"section\"\n  }, \"As your schema then grows to hundreds or thousands of types, manually curating these SDL fragments becomes tedious. Documentation changes can be tough. Modifying fields on interfaces can require manual changes to many implementing types, a process that can be quite error prone.\"), mdx(\"p\", {\n    parentName: \"section\"\n  }, mdx(\"em\", {\n    parentName: \"p\"\n  }, \"If only there were a way to combine the simplicity of schema-first development, with the long-term maintainability of a definition-first approach.\")), mdx(\"p\", {\n    parentName: \"section\"\n  }, \"GraphQL Nexus aims to fill that void, making the process as simple as possible while also making good use of the runtime to introduce powerful ways of composing types, introducing type or schema wide changes, and much more.\"), mdx(\"p\", {\n    parentName: \"section\"\n  }, \"The core idea of GraphQL Nexus draws from basing the schema off the SDL - keeping things declarative and simple to understand. It allows you to reference the type names as string literals rather than always need to import to reference types (you can do that too if you prefer).\"), mdx(\"p\", {\n    parentName: \"section\"\n  }, \"By combining automatic type generation with some of the more powerful features of TypeScript - type merging, conditional types, and type inference, we can know exactly which type names we are referring to and able to use throughout our code. We can know both the parameters and the return type of resolvers without providing any type annotation. It takes a little getting used to, but it ends up leading to a great feedback loop of the types annotating themselves.\")), mdx(\"section\", {\n    parentName: \"section\"\n  }, mdx(\"h2\", _extends({\n    parentName: \"section\"\n  }, {\n    \"id\": \"type-generation-details-docsify-ignore\",\n    \"style\": {\n      \"position\": \"relative\"\n    }\n  }), mdx(\"a\", _extends({\n    parentName: \"h2\"\n  }, {\n    \"href\": \"#type-generation-details-docsify-ignore\",\n    \"aria-label\": \"type generation details docsify ignore permalink\",\n    \"className\": \"title-link before\"\n  }), mdx(\"svg\", _extends({\n    parentName: \"a\"\n  }, {\n    \"width\": \"17\",\n    \"height\": \"18\",\n    \"viewBox\": \"0 0 17 18\",\n    \"fill\": \"none\",\n    \"xmlns\": \"http://www.w3.org/2000/svg\"\n  }), \"\\n      \", mdx(\"path\", _extends({\n    parentName: \"svg\"\n  }, {\n    \"d\": \"M1.5 6.33337H15.5\",\n    \"stroke\": \"#CBD5E0\",\n    \"strokeWidth\": \"2\",\n    \"strokeLineCap\": \"round\",\n    \"strokeLineJoin\": \"round\"\n  })), \"\\n      \", mdx(\"path\", _extends({\n    parentName: \"svg\"\n  }, {\n    \"d\": \"M1.5 11.6666H15.5\",\n    \"stroke\": \"#CBD5E0\",\n    \"strokeWidth\": \"2\",\n    \"strokeLineCap\": \"round\",\n    \"strokeLineJoin\": \"round\"\n  })), \"\\n      \", mdx(\"path\", _extends({\n    parentName: \"svg\"\n  }, {\n    \"d\": \"M6.75 1L5 17\",\n    \"stroke\": \"#CBD5E0\",\n    \"strokeWidth\": \"2\",\n    \"strokeLineCap\": \"round\",\n    \"strokeLineJoin\": \"round\"\n  })), \"\\n      \", mdx(\"path\", _extends({\n    parentName: \"svg\"\n  }, {\n    \"d\": \"M12 1L10.25 17\",\n    \"stroke\": \"#CBD5E0\",\n    \"strokeWidth\": \"2\",\n    \"strokeLineCap\": \"round\",\n    \"strokeLineJoin\": \"round\"\n  })), \"\\n      \")), \"Type Generation Details {docsify-ignore}\"), mdx(\"p\", {\n    parentName: \"section\"\n  }, \"This is the most important piece to understand to get the most out of Nexus. It is relevant to JavaScript as well as TypeScript users, as tools like VSCode and \", mdx(\"inlineCode\", {\n    parentName: \"p\"\n  }, \"// @ts-check\"), \" can utilize these types to aid in autocomplete or type-checking. A core goal of Nexus is to have the best possible type coverage with the least possible manual type annotation.\"), mdx(\"section\", {\n    parentName: \"section\"\n  }, mdx(\"h3\", _extends({\n    parentName: \"section\"\n  }, {\n    \"id\": \"overview-docsify-ignore\",\n    \"style\": {\n      \"position\": \"relative\"\n    }\n  }), mdx(\"a\", _extends({\n    parentName: \"h3\"\n  }, {\n    \"href\": \"#overview-docsify-ignore\",\n    \"aria-label\": \"overview docsify ignore permalink\",\n    \"className\": \"title-link before\"\n  }), mdx(\"svg\", _extends({\n    parentName: \"a\"\n  }, {\n    \"width\": \"17\",\n    \"height\": \"18\",\n    \"viewBox\": \"0 0 17 18\",\n    \"fill\": \"none\",\n    \"xmlns\": \"http://www.w3.org/2000/svg\"\n  }), \"\\n      \", mdx(\"path\", _extends({\n    parentName: \"svg\"\n  }, {\n    \"d\": \"M1.5 6.33337H15.5\",\n    \"stroke\": \"#CBD5E0\",\n    \"strokeWidth\": \"2\",\n    \"strokeLineCap\": \"round\",\n    \"strokeLineJoin\": \"round\"\n  })), \"\\n      \", mdx(\"path\", _extends({\n    parentName: \"svg\"\n  }, {\n    \"d\": \"M1.5 11.6666H15.5\",\n    \"stroke\": \"#CBD5E0\",\n    \"strokeWidth\": \"2\",\n    \"strokeLineCap\": \"round\",\n    \"strokeLineJoin\": \"round\"\n  })), \"\\n      \", mdx(\"path\", _extends({\n    parentName: \"svg\"\n  }, {\n    \"d\": \"M6.75 1L5 17\",\n    \"stroke\": \"#CBD5E0\",\n    \"strokeWidth\": \"2\",\n    \"strokeLineCap\": \"round\",\n    \"strokeLineJoin\": \"round\"\n  })), \"\\n      \", mdx(\"path\", _extends({\n    parentName: \"svg\"\n  }, {\n    \"d\": \"M12 1L10.25 17\",\n    \"stroke\": \"#CBD5E0\",\n    \"strokeWidth\": \"2\",\n    \"strokeLineCap\": \"round\",\n    \"strokeLineJoin\": \"round\"\n  })), \"\\n      \")), \"Overview {docsify-ignore}\"), mdx(\"p\", {\n    parentName: \"section\"\n  }, \"Nexus was designed with TypeScript in mind. In order to fully typecheck our GraphQL objects, we need to generate a number of types that combine the schema, any type or field configuration provided, and the GraphQL resolution algorithm to create as much type-safety as possible without any additional work importing and assigning types throughout the codebase.\")), mdx(\"section\", {\n    parentName: \"section\"\n  }, mdx(\"h3\", _extends({\n    parentName: \"section\"\n  }, {\n    \"id\": \"root-types-docsify-ignore\",\n    \"style\": {\n      \"position\": \"relative\"\n    }\n  }), mdx(\"a\", _extends({\n    parentName: \"h3\"\n  }, {\n    \"href\": \"#root-types-docsify-ignore\",\n    \"aria-label\": \"root types docsify ignore permalink\",\n    \"className\": \"title-link before\"\n  }), mdx(\"svg\", _extends({\n    parentName: \"a\"\n  }, {\n    \"width\": \"17\",\n    \"height\": \"18\",\n    \"viewBox\": \"0 0 17 18\",\n    \"fill\": \"none\",\n    \"xmlns\": \"http://www.w3.org/2000/svg\"\n  }), \"\\n      \", mdx(\"path\", _extends({\n    parentName: \"svg\"\n  }, {\n    \"d\": \"M1.5 6.33337H15.5\",\n    \"stroke\": \"#CBD5E0\",\n    \"strokeWidth\": \"2\",\n    \"strokeLineCap\": \"round\",\n    \"strokeLineJoin\": \"round\"\n  })), \"\\n      \", mdx(\"path\", _extends({\n    parentName: \"svg\"\n  }, {\n    \"d\": \"M1.5 11.6666H15.5\",\n    \"stroke\": \"#CBD5E0\",\n    \"strokeWidth\": \"2\",\n    \"strokeLineCap\": \"round\",\n    \"strokeLineJoin\": \"round\"\n  })), \"\\n      \", mdx(\"path\", _extends({\n    parentName: \"svg\"\n  }, {\n    \"d\": \"M6.75 1L5 17\",\n    \"stroke\": \"#CBD5E0\",\n    \"strokeWidth\": \"2\",\n    \"strokeLineCap\": \"round\",\n    \"strokeLineJoin\": \"round\"\n  })), \"\\n      \", mdx(\"path\", _extends({\n    parentName: \"svg\"\n  }, {\n    \"d\": \"M12 1L10.25 17\",\n    \"stroke\": \"#CBD5E0\",\n    \"strokeWidth\": \"2\",\n    \"strokeLineCap\": \"round\",\n    \"strokeLineJoin\": \"round\"\n  })), \"\\n      \")), \"Root Types {docsify-ignore}\"), mdx(\"p\", {\n    parentName: \"section\"\n  }, \"A \", mdx(\"strong\", {\n    parentName: \"p\"\n  }, \"root type\"), \" is a type representation of the value used to resolve the fields of an object type. It is the object that will be passed as the first argument of \", mdx(\"inlineCode\", {\n    parentName: \"p\"\n  }, \"resolve\"), \". It can be a plain JS object, a database model, a mongoose document, a JS class, anything that fulfills the contract defined by the GraphQL object type, based on the field definitions.\"), mdx(\"p\", {\n    parentName: \"section\"\n  }, \"Scalars can also have backing types, representing the value they are parsed into.\"), mdx(\"p\", {\n    parentName: \"section\"\n  }, \"Sometimes GraphQL types are passthrough, and don't have a dedicated type backing them. One such case would be in the \", mdx(\"inlineCode\", {\n    parentName: \"p\"\n  }, \"Edge\"), \" of a Relay style pagination. In this case, Nexus will generate a type-definition which makes assumptions of the necessary value to fulfill the contract. If this is incorrect, you can always provide a concrete type for the object.\")), mdx(\"section\", {\n    parentName: \"section\"\n  }, mdx(\"h3\", _extends({\n    parentName: \"section\"\n  }, {\n    \"id\": \"field-type-docsify-ignore\",\n    \"style\": {\n      \"position\": \"relative\"\n    }\n  }), mdx(\"a\", _extends({\n    parentName: \"h3\"\n  }, {\n    \"href\": \"#field-type-docsify-ignore\",\n    \"aria-label\": \"field type docsify ignore permalink\",\n    \"className\": \"title-link before\"\n  }), mdx(\"svg\", _extends({\n    parentName: \"a\"\n  }, {\n    \"width\": \"17\",\n    \"height\": \"18\",\n    \"viewBox\": \"0 0 17 18\",\n    \"fill\": \"none\",\n    \"xmlns\": \"http://www.w3.org/2000/svg\"\n  }), \"\\n      \", mdx(\"path\", _extends({\n    parentName: \"svg\"\n  }, {\n    \"d\": \"M1.5 6.33337H15.5\",\n    \"stroke\": \"#CBD5E0\",\n    \"strokeWidth\": \"2\",\n    \"strokeLineCap\": \"round\",\n    \"strokeLineJoin\": \"round\"\n  })), \"\\n      \", mdx(\"path\", _extends({\n    parentName: \"svg\"\n  }, {\n    \"d\": \"M1.5 11.6666H15.5\",\n    \"stroke\": \"#CBD5E0\",\n    \"strokeWidth\": \"2\",\n    \"strokeLineCap\": \"round\",\n    \"strokeLineJoin\": \"round\"\n  })), \"\\n      \", mdx(\"path\", _extends({\n    parentName: \"svg\"\n  }, {\n    \"d\": \"M6.75 1L5 17\",\n    \"stroke\": \"#CBD5E0\",\n    \"strokeWidth\": \"2\",\n    \"strokeLineCap\": \"round\",\n    \"strokeLineJoin\": \"round\"\n  })), \"\\n      \", mdx(\"path\", _extends({\n    parentName: \"svg\"\n  }, {\n    \"d\": \"M12 1L10.25 17\",\n    \"stroke\": \"#CBD5E0\",\n    \"strokeWidth\": \"2\",\n    \"strokeLineCap\": \"round\",\n    \"strokeLineJoin\": \"round\"\n  })), \"\\n      \")), \"Field Type {docsify-ignore}\"), mdx(\"p\", {\n    parentName: \"section\"\n  }, \"A \", mdx(\"strong\", {\n    parentName: \"p\"\n  }, \"field type\"), \" is the valid return value used to a field on an object type. In GraphQL, promises can be returned at every level of the type resolution, so we wrap the types in a \", mdx(\"inlineCode\", {\n    parentName: \"p\"\n  }, \"MaybePromiseDeep<T>\"), \" type to express this.\")), mdx(\"section\", {\n    parentName: \"section\"\n  }, mdx(\"h3\", _extends({\n    parentName: \"section\"\n  }, {\n    \"id\": \"configuring-our-types-docsify-ignore\",\n    \"style\": {\n      \"position\": \"relative\"\n    }\n  }), mdx(\"a\", _extends({\n    parentName: \"h3\"\n  }, {\n    \"href\": \"#configuring-our-types-docsify-ignore\",\n    \"aria-label\": \"configuring our types docsify ignore permalink\",\n    \"className\": \"title-link before\"\n  }), mdx(\"svg\", _extends({\n    parentName: \"a\"\n  }, {\n    \"width\": \"17\",\n    \"height\": \"18\",\n    \"viewBox\": \"0 0 17 18\",\n    \"fill\": \"none\",\n    \"xmlns\": \"http://www.w3.org/2000/svg\"\n  }), \"\\n      \", mdx(\"path\", _extends({\n    parentName: \"svg\"\n  }, {\n    \"d\": \"M1.5 6.33337H15.5\",\n    \"stroke\": \"#CBD5E0\",\n    \"strokeWidth\": \"2\",\n    \"strokeLineCap\": \"round\",\n    \"strokeLineJoin\": \"round\"\n  })), \"\\n      \", mdx(\"path\", _extends({\n    parentName: \"svg\"\n  }, {\n    \"d\": \"M1.5 11.6666H15.5\",\n    \"stroke\": \"#CBD5E0\",\n    \"strokeWidth\": \"2\",\n    \"strokeLineCap\": \"round\",\n    \"strokeLineJoin\": \"round\"\n  })), \"\\n      \", mdx(\"path\", _extends({\n    parentName: \"svg\"\n  }, {\n    \"d\": \"M6.75 1L5 17\",\n    \"stroke\": \"#CBD5E0\",\n    \"strokeWidth\": \"2\",\n    \"strokeLineCap\": \"round\",\n    \"strokeLineJoin\": \"round\"\n  })), \"\\n      \", mdx(\"path\", _extends({\n    parentName: \"svg\"\n  }, {\n    \"d\": \"M12 1L10.25 17\",\n    \"stroke\": \"#CBD5E0\",\n    \"strokeWidth\": \"2\",\n    \"strokeLineCap\": \"round\",\n    \"strokeLineJoin\": \"round\"\n  })), \"\\n      \")), \"Configuring our types {docsify-ignore}\"), mdx(\"p\", {\n    parentName: \"section\"\n  }, \"The \", mdx(\"a\", _extends({\n    parentName: \"p\"\n  }, {\n    \"href\": \"https://github.com/prisma-labs/nexus/blob/develop/examples/ghost/src/ghost-schema.ts\"\n  }), \"Ghost Example\"), \" is the best to look at for an example of how we're able to capture the types from existing runtime objects or definitions and merge them with our schema.\"), mdx(\"p\", {\n    parentName: \"section\"\n  }, \"The \", mdx(\"inlineCode\", {\n    parentName: \"p\"\n  }, \"makeSchema\"), \" takes several options which helps us find the types we need to import into our generated schema, and customize where these generated types are output.\")))));\n}\n;\nMDXContent.isMDXComponent = true;","parent":{"__typename":"File","relativePath":"06-components-standalone/01-schema.mdx"},"tableOfContents":{"items":[{"url":"#nexusschema","title":"@nexus/schema","items":[{"items":[{"items":[{"url":"#why-nexus-docsify-ignore","title":"Why Nexus? {docsify-ignore}"}]}]},{"url":"#type-generation-details-docsify-ignore","title":"Type Generation Details {docsify-ignore}","items":[{"url":"#overview-docsify-ignore","title":"Overview {docsify-ignore}"},{"url":"#root-types-docsify-ignore","title":"Root Types {docsify-ignore}"},{"url":"#field-type-docsify-ignore","title":"Field Type {docsify-ignore}"},{"url":"#configuring-our-types-docsify-ignore","title":"Configuring our types {docsify-ignore}"}]}]}]},"frontmatter":{"title":"`@nexus/schema`","metaTitle":"@nexus/schema","metaDescription":null}}},"pageContext":{"id":"c44e15bf-8f38-5bb9-9809-dac574a68026","seoTitle":"@nexus/schema","seoDescription":"`@nexus/schema`"}}}