{"componentChunkName":"component---src-layouts-article-layout-tsx","path":"/getting-started/welcome-to-nexus","result":{"data":{"site":{"siteMetadata":{"docsLocation":"https://github.com/graphql-nexus/docs/tree/master/content"}},"mdx":{"fields":{"slug":"/01-getting-started/01-welcome-to-nexus"},"body":"function _extends() { _extends = Object.assign || function (target) { for (var i = 1; i < arguments.length; i++) { var source = arguments[i]; for (var key in source) { if (Object.prototype.hasOwnProperty.call(source, key)) { target[key] = source[key]; } } } return target; }; return _extends.apply(this, arguments); }\n\nfunction _objectWithoutProperties(source, excluded) { if (source == null) return {}; var target = _objectWithoutPropertiesLoose(source, excluded); var key, i; if (Object.getOwnPropertySymbols) { var sourceSymbolKeys = Object.getOwnPropertySymbols(source); for (i = 0; i < sourceSymbolKeys.length; i++) { key = sourceSymbolKeys[i]; if (excluded.indexOf(key) >= 0) continue; if (!Object.prototype.propertyIsEnumerable.call(source, key)) continue; target[key] = source[key]; } } return target; }\n\nfunction _objectWithoutPropertiesLoose(source, excluded) { if (source == null) return {}; var target = {}; var sourceKeys = Object.keys(source); var key, i; for (i = 0; i < sourceKeys.length; i++) { key = sourceKeys[i]; if (excluded.indexOf(key) >= 0) continue; target[key] = source[key]; } return target; }\n\n/* @jsx mdx */\nvar _frontmatter = {\n  \"title\": \"Welcome to Nexus\",\n  \"metaTitle\": \"Welcome to Nexus\"\n};\n\nvar makeShortcode = function makeShortcode(name) {\n  return function MDXDefaultShortcode(props) {\n    console.warn(\"Component \" + name + \" was not imported, exported, or provided by MDXProvider as global scope\");\n    return mdx(\"div\", props);\n  };\n};\n\nvar layoutProps = {\n  _frontmatter: _frontmatter\n};\nvar MDXLayout = \"wrapper\";\nreturn function MDXContent(_ref) {\n  var components = _ref.components,\n      props = _objectWithoutProperties(_ref, [\"components\"]);\n\n  return mdx(MDXLayout, _extends({}, layoutProps, props, {\n    components: components,\n    mdxType: \"MDXLayout\"\n  }), mdx(\"section\", null, mdx(\"h2\", _extends({\n    parentName: \"section\"\n  }, {\n    \"id\": \"welcome-to-nexus\",\n    \"style\": {\n      \"position\": \"relative\"\n    }\n  }), mdx(\"a\", _extends({\n    parentName: \"h2\"\n  }, {\n    \"href\": \"#welcome-to-nexus\",\n    \"aria-label\": \"welcome to nexus permalink\",\n    \"className\": \"title-link before\"\n  }), mdx(\"svg\", _extends({\n    parentName: \"a\"\n  }, {\n    \"width\": \"17\",\n    \"height\": \"18\",\n    \"viewBox\": \"0 0 17 18\",\n    \"fill\": \"none\",\n    \"xmlns\": \"http://www.w3.org/2000/svg\"\n  }), \"\\n      \", mdx(\"path\", _extends({\n    parentName: \"svg\"\n  }, {\n    \"d\": \"M1.5 6.33337H15.5\",\n    \"stroke\": \"#CBD5E0\",\n    \"strokeWidth\": \"2\",\n    \"strokeLineCap\": \"round\",\n    \"strokeLineJoin\": \"round\"\n  })), \"\\n      \", mdx(\"path\", _extends({\n    parentName: \"svg\"\n  }, {\n    \"d\": \"M1.5 11.6666H15.5\",\n    \"stroke\": \"#CBD5E0\",\n    \"strokeWidth\": \"2\",\n    \"strokeLineCap\": \"round\",\n    \"strokeLineJoin\": \"round\"\n  })), \"\\n      \", mdx(\"path\", _extends({\n    parentName: \"svg\"\n  }, {\n    \"d\": \"M6.75 1L5 17\",\n    \"stroke\": \"#CBD5E0\",\n    \"strokeWidth\": \"2\",\n    \"strokeLineCap\": \"round\",\n    \"strokeLineJoin\": \"round\"\n  })), \"\\n      \", mdx(\"path\", _extends({\n    parentName: \"svg\"\n  }, {\n    \"d\": \"M12 1L10.25 17\",\n    \"stroke\": \"#CBD5E0\",\n    \"strokeWidth\": \"2\",\n    \"strokeLineCap\": \"round\",\n    \"strokeLineJoin\": \"round\"\n  })), \"\\n      \")), \"Welcome to Nexus\"), mdx(\"p\", {\n    parentName: \"section\"\n  }, \"Nexus is a Node.js code-first GraphQL framework. It has a clean simple intuitive declarative API built from the ground to support autocompletion, type-safety, great jsDoc, and more out of the box. It leverages the TypeScript compiler API and its own sophisticated development mode to give you next-geneation levels of type safety and productivity. Add a powerful plugin system into the mix and what you get is a tool with a very low floor yet practically limitless ceiling.\"), mdx(\"p\", {\n    parentName: \"section\"\n  }, \"Nexus is young, but its ready to grow with you. Dive in!\"), mdx(\"p\", {\n    parentName: \"section\"\n  }, mdx(\"a\", _extends({\n    parentName: \"p\"\n  }, {\n    \"href\": \"https://github.com/graphql-nexus/nexus/discussions\"\n  }), \"Discussions\"), \" // \", mdx(\"a\", _extends({\n    parentName: \"p\"\n  }, {\n    \"href\": \"https://github.com/graphql-nexus/nexus/issues\"\n  }), \"Issues\"), \" // \", mdx(\"a\", _extends({\n    parentName: \"p\"\n  }, {\n    \"href\": \"https://twitter.com/nexusgql\"\n  }), \"Tweets\"), \" // \", mdx(\"a\", _extends({\n    parentName: \"p\"\n  }, {\n    \"href\": \"https://github.com/graphql-nexus/nexus/releases\"\n  }), \"Changelog\"), \" (\", mdx(\"a\", _extends({\n    parentName: \"p\"\n  }, {\n    \"href\": \"https://github.com/graphql-nexus/nexus/releases/tag/next\"\n  }), \"canary\"), \") // \", mdx(\"a\", _extends({\n    parentName: \"p\"\n  }, {\n    \"href\": \"https://github.com/graphql-nexus/nexus\"\n  }), \"Repo\"))), mdx(\"section\", null, mdx(\"h2\", _extends({\n    parentName: \"section\"\n  }, {\n    \"id\": \"goals\",\n    \"style\": {\n      \"position\": \"relative\"\n    }\n  }), mdx(\"a\", _extends({\n    parentName: \"h2\"\n  }, {\n    \"href\": \"#goals\",\n    \"aria-label\": \"goals permalink\",\n    \"className\": \"title-link before\"\n  }), mdx(\"svg\", _extends({\n    parentName: \"a\"\n  }, {\n    \"width\": \"17\",\n    \"height\": \"18\",\n    \"viewBox\": \"0 0 17 18\",\n    \"fill\": \"none\",\n    \"xmlns\": \"http://www.w3.org/2000/svg\"\n  }), \"\\n      \", mdx(\"path\", _extends({\n    parentName: \"svg\"\n  }, {\n    \"d\": \"M1.5 6.33337H15.5\",\n    \"stroke\": \"#CBD5E0\",\n    \"strokeWidth\": \"2\",\n    \"strokeLineCap\": \"round\",\n    \"strokeLineJoin\": \"round\"\n  })), \"\\n      \", mdx(\"path\", _extends({\n    parentName: \"svg\"\n  }, {\n    \"d\": \"M1.5 11.6666H15.5\",\n    \"stroke\": \"#CBD5E0\",\n    \"strokeWidth\": \"2\",\n    \"strokeLineCap\": \"round\",\n    \"strokeLineJoin\": \"round\"\n  })), \"\\n      \", mdx(\"path\", _extends({\n    parentName: \"svg\"\n  }, {\n    \"d\": \"M6.75 1L5 17\",\n    \"stroke\": \"#CBD5E0\",\n    \"strokeWidth\": \"2\",\n    \"strokeLineCap\": \"round\",\n    \"strokeLineJoin\": \"round\"\n  })), \"\\n      \", mdx(\"path\", _extends({\n    parentName: \"svg\"\n  }, {\n    \"d\": \"M12 1L10.25 17\",\n    \"stroke\": \"#CBD5E0\",\n    \"strokeWidth\": \"2\",\n    \"strokeLineCap\": \"round\",\n    \"strokeLineJoin\": \"round\"\n  })), \"\\n      \")), \"Goals\"), mdx(\"ul\", {\n    parentName: \"section\"\n  }, mdx(\"li\", {\n    parentName: \"ul\"\n  }, \"It leverages TypeScript and its type system to unlock rich patterns that help you safely scale, maintain and test your GraphQL API.\"), mdx(\"li\", {\n    parentName: \"ul\"\n  }, \"The development server that's running as you build your API ensures that you always get auto-completion and error checks for the schema changes you just introduced.\"), mdx(\"li\", {\n    parentName: \"ul\"\n  }, \"Its API is designed with care to be as declarative as possible so that your schema stays readable despite being implemented with code.\"), mdx(\"li\", {\n    parentName: \"ul\"\n  }, \"Its unconventional plugin system also enables the creation of \\\"end-to-end plugins\\\" which enhance not only Nexus at runtime, but also the CLI and many framework workflows such as dev mode and testing.\"), mdx(\"li\", {\n    parentName: \"ul\"\n  }, \"On that matter, \", mdx(\"strong\", {\n    parentName: \"li\"\n  }, \"Nexus has an official Prisma plugin\"), \" that will help you wire your GraphQL API to a database. Prisma is an\\xA0\", mdx(\"a\", _extends({\n    parentName: \"li\"\n  }, {\n    \"href\": \"https://github.com/prisma/prisma\"\n  }), \"open source\"), \"\\xA0database toolkit that currently consists of an auto-generated type-safe query builder, declarative data model language, and experimental migration system.\"))), mdx(\"section\", null, mdx(\"h2\", _extends({\n    parentName: \"section\"\n  }, {\n    \"id\": \"highlights\",\n    \"style\": {\n      \"position\": \"relative\"\n    }\n  }), mdx(\"a\", _extends({\n    parentName: \"h2\"\n  }, {\n    \"href\": \"#highlights\",\n    \"aria-label\": \"highlights permalink\",\n    \"className\": \"title-link before\"\n  }), mdx(\"svg\", _extends({\n    parentName: \"a\"\n  }, {\n    \"width\": \"17\",\n    \"height\": \"18\",\n    \"viewBox\": \"0 0 17 18\",\n    \"fill\": \"none\",\n    \"xmlns\": \"http://www.w3.org/2000/svg\"\n  }), \"\\n      \", mdx(\"path\", _extends({\n    parentName: \"svg\"\n  }, {\n    \"d\": \"M1.5 6.33337H15.5\",\n    \"stroke\": \"#CBD5E0\",\n    \"strokeWidth\": \"2\",\n    \"strokeLineCap\": \"round\",\n    \"strokeLineJoin\": \"round\"\n  })), \"\\n      \", mdx(\"path\", _extends({\n    parentName: \"svg\"\n  }, {\n    \"d\": \"M1.5 11.6666H15.5\",\n    \"stroke\": \"#CBD5E0\",\n    \"strokeWidth\": \"2\",\n    \"strokeLineCap\": \"round\",\n    \"strokeLineJoin\": \"round\"\n  })), \"\\n      \", mdx(\"path\", _extends({\n    parentName: \"svg\"\n  }, {\n    \"d\": \"M6.75 1L5 17\",\n    \"stroke\": \"#CBD5E0\",\n    \"strokeWidth\": \"2\",\n    \"strokeLineCap\": \"round\",\n    \"strokeLineJoin\": \"round\"\n  })), \"\\n      \", mdx(\"path\", _extends({\n    parentName: \"svg\"\n  }, {\n    \"d\": \"M12 1L10.25 17\",\n    \"stroke\": \"#CBD5E0\",\n    \"strokeWidth\": \"2\",\n    \"strokeLineCap\": \"round\",\n    \"strokeLineJoin\": \"round\"\n  })), \"\\n      \")), \"Highlights\"), mdx(\"ul\", {\n    parentName: \"section\"\n  }, mdx(\"li\", {\n    parentName: \"ul\"\n  }, mdx(\"strong\", {\n    parentName: \"li\"\n  }, \"Type-safety by default\"), mdx(\"br\", {\n    parentName: \"li\"\n  }), \"Take advantage of TypeScript without the hassle of type annotations everywhere\"), mdx(\"li\", {\n    parentName: \"ul\"\n  }, mdx(\"strong\", {\n    parentName: \"li\"\n  }, \"GraphQL Server included\"), mdx(\"br\", {\n    parentName: \"li\"\n  }), \"We manage the GraphQL server for you while letting you control it\"), mdx(\"li\", {\n    parentName: \"ul\"\n  }, mdx(\"strong\", {\n    parentName: \"li\"\n  }, \"Bundled CLI for development workflows\"), mdx(\"br\", {\n    parentName: \"li\"\n  }), \"Develop, test and build your app using our CLI\"), mdx(\"li\", {\n    parentName: \"ul\"\n  }, mdx(\"strong\", {\n    parentName: \"li\"\n  }, \"Reusable modules\"), mdx(\"br\", {\n    parentName: \"li\"\n  }), \"Leverage your programming language to reuse parts of your GraphQL schema\"), mdx(\"li\", {\n    parentName: \"ul\"\n  }, mdx(\"strong\", {\n    parentName: \"li\"\n  }, \"Scalable\"), mdx(\"br\", {\n    parentName: \"li\"\n  }), \"Split your GraphQL schema by features to horizontally scale as your project grows\"), mdx(\"li\", {\n    parentName: \"ul\"\n  }, mdx(\"strong\", {\n    parentName: \"li\"\n  }, \"Testable\"), mdx(\"br\", {\n    parentName: \"li\"\n  }), \"Nexus includes tooling to run integration tests against your API\"), mdx(\"li\", {\n    parentName: \"ul\"\n  }, mdx(\"strong\", {\n    parentName: \"li\"\n  }, \"Zero config\"), mdx(\"br\", {\n    parentName: \"li\"\n  }), \"Smart conventions and delta-aware automation. Get up and running 60 seconds flat.\"), mdx(\"li\", {\n    parentName: \"ul\"\n  }, mdx(\"strong\", {\n    parentName: \"li\"\n  }, \"Batteries included (DB, rate limiting, relay connections, custom scalars, ...)\"), mdx(\"br\", {\n    parentName: \"li\"\n  }), \"We've got you covered beyond the to-do app\"), mdx(\"li\", {\n    parentName: \"ul\"\n  }, mdx(\"strong\", {\n    parentName: \"li\"\n  }, \"Readable\"), mdx(\"br\", {\n    parentName: \"li\"\n  }), \"Implement your schema with code, read it with the autogenerated GraphQL SDL file\"), mdx(\"li\", {\n    parentName: \"ul\"\n  }, mdx(\"strong\", {\n    parentName: \"li\"\n  }, \"Pluggable\"), mdx(\"br\", {\n    parentName: \"li\"\n  }), \"Enhance your experience with specialized plugins from the ecosystem or roll your own\"), mdx(\"li\", {\n    parentName: \"ul\"\n  }, mdx(\"strong\", {\n    parentName: \"li\"\n  }, \"No lock-in\"), mdx(\"br\", {\n    parentName: \"li\"\n  }), \"Buying into a framework can be scary. We've got the right escape hatches for you.\"))), mdx(\"section\", null, mdx(\"h2\", _extends({\n    parentName: \"section\"\n  }, {\n    \"id\": \"why\",\n    \"style\": {\n      \"position\": \"relative\"\n    }\n  }), mdx(\"a\", _extends({\n    parentName: \"h2\"\n  }, {\n    \"href\": \"#why\",\n    \"aria-label\": \"why permalink\",\n    \"className\": \"title-link before\"\n  }), mdx(\"svg\", _extends({\n    parentName: \"a\"\n  }, {\n    \"width\": \"17\",\n    \"height\": \"18\",\n    \"viewBox\": \"0 0 17 18\",\n    \"fill\": \"none\",\n    \"xmlns\": \"http://www.w3.org/2000/svg\"\n  }), \"\\n      \", mdx(\"path\", _extends({\n    parentName: \"svg\"\n  }, {\n    \"d\": \"M1.5 6.33337H15.5\",\n    \"stroke\": \"#CBD5E0\",\n    \"strokeWidth\": \"2\",\n    \"strokeLineCap\": \"round\",\n    \"strokeLineJoin\": \"round\"\n  })), \"\\n      \", mdx(\"path\", _extends({\n    parentName: \"svg\"\n  }, {\n    \"d\": \"M1.5 11.6666H15.5\",\n    \"stroke\": \"#CBD5E0\",\n    \"strokeWidth\": \"2\",\n    \"strokeLineCap\": \"round\",\n    \"strokeLineJoin\": \"round\"\n  })), \"\\n      \", mdx(\"path\", _extends({\n    parentName: \"svg\"\n  }, {\n    \"d\": \"M6.75 1L5 17\",\n    \"stroke\": \"#CBD5E0\",\n    \"strokeWidth\": \"2\",\n    \"strokeLineCap\": \"round\",\n    \"strokeLineJoin\": \"round\"\n  })), \"\\n      \", mdx(\"path\", _extends({\n    parentName: \"svg\"\n  }, {\n    \"d\": \"M12 1L10.25 17\",\n    \"stroke\": \"#CBD5E0\",\n    \"strokeWidth\": \"2\",\n    \"strokeLineCap\": \"round\",\n    \"strokeLineJoin\": \"round\"\n  })), \"\\n      \")), \"Why\"), mdx(\"p\", {\n    parentName: \"section\"\n  }, \"Nexus, the framework, is built on top of a great library called Nexus \", mdx(\"em\", {\n    parentName: \"p\"\n  }, \"Schema\"), \", built by \", mdx(\"a\", _extends({\n    parentName: \"p\"\n  }, {\n    \"href\": \"https://github.com/tgriesser\"\n  }), \"Tim Griesser\"), \".\"), mdx(\"p\", {\n    parentName: \"section\"\n  }, \"\\xAB Nexus Schema was born out of my experience building several production GraphQL APIs, in different languages and frameworks. The first with vanilla\\xA0\", mdx(\"a\", _extends({\n    parentName: \"p\"\n  }, {\n    \"href\": \"https://github.com/graphql/graphql-js\"\n  }), \"graphql-js\"), \", another schema-first with\\xA0\", mdx(\"a\", _extends({\n    parentName: \"p\"\n  }, {\n    \"href\": \"https://github.com/matthewmueller/graph.ql\"\n  }), \"graph.ql\"), \"\\xA0and later\\xA0\", mdx(\"a\", _extends({\n    parentName: \"p\"\n  }, {\n    \"href\": \"https://github.com/apollographql/graphql-tools\"\n  }), \"graphql-tools\"), \". Following that with\\xA0\", mdx(\"a\", _extends({\n    parentName: \"p\"\n  }, {\n    \"href\": \"https://docs.graphene-python.org/en/latest/\"\n  }), \"graphene-python\"), \"\\xA0and most recently with a bit of\\xA0\", mdx(\"a\", _extends({\n    parentName: \"p\"\n  }, {\n    \"href\": \"http://graphql-ruby.org/\"\n  }), \"graphql-ruby\"), \".\"), mdx(\"p\", {\n    parentName: \"section\"\n  }, \"After working with the toolkits in other scripting languages, it felt like there was a gap in the JavaScript approaches. Schema-first development starts out great, by simply expressing your schema in the GraphQL Schema Definition Language (SDL) and providing resolvers matching to the types as needed you are up and running fast! No need for tons of requires or \\\"overhead\\\" to get a GraphQL server running.\"), mdx(\"p\", {\n    parentName: \"section\"\n  }, \"As your schema then grows to hundreds or thousands of types, manually curating these SDL fragments becomes tedious. Documentation changes can be tough. Modifying fields on interfaces can require manual changes to many implementing types, a process that can be quite error prone.\"), mdx(\"p\", {\n    parentName: \"section\"\n  }, mdx(\"em\", {\n    parentName: \"p\"\n  }, \"If only there were a way to combine the simplicity of schema-first development, with the long-term maintainability of a definition-first approach.\")), mdx(\"p\", {\n    parentName: \"section\"\n  }, \"Nexus Schema aims to fill that void, making the process as simple as possible while also making good use of the runtime to introduce powerful ways of composing types, introducing type or schema wide changes, and much more.\"), mdx(\"p\", {\n    parentName: \"section\"\n  }, \"The core idea of Nexus Schema draws from basing the schema off the SDL - keeping things declarative and simple to understand. For example it allows you to reference the type names as string literals rather than always need to import to reference types (but, you can do that too if you prefer).\"), mdx(\"p\", {\n    parentName: \"section\"\n  }, \"By combining automatic type generation with some of the more powerful features of TypeScript - type merging, conditional types, and type inference, we can know exactly which type names we are referring to and able to use throughout our code. We can know both the parameters and the return type of resolvers without providing any type annotation. It takes a little getting used to, but it ends up leading to a great feedback loop of the types annotating themselves. \\xBB \\u2014 \", mdx(\"em\", {\n    parentName: \"p\"\n  }, \"Tim Griesser\")), mdx(\"p\", {\n    parentName: \"section\"\n  }, \"The complex mechanisms on which Nexus Schema relies turned out to produce a lot of friction to the daily workflows that people have to deal with when working with it.\"), mdx(\"p\", {\n    parentName: \"section\"\n  }, \"Nexus, the framework, is a natural continuation of that vision built by Tim Griesser which aims to make Nexus Schema more accessible to everyone by hiding some of the underlying complexity of the system and by trying to push users into the pit of success.\")), mdx(\"section\", null, mdx(\"h2\", _extends({\n    parentName: \"section\"\n  }, {\n    \"id\": \"pre-requisites\",\n    \"style\": {\n      \"position\": \"relative\"\n    }\n  }), mdx(\"a\", _extends({\n    parentName: \"h2\"\n  }, {\n    \"href\": \"#pre-requisites\",\n    \"aria-label\": \"pre requisites permalink\",\n    \"className\": \"title-link before\"\n  }), mdx(\"svg\", _extends({\n    parentName: \"a\"\n  }, {\n    \"width\": \"17\",\n    \"height\": \"18\",\n    \"viewBox\": \"0 0 17 18\",\n    \"fill\": \"none\",\n    \"xmlns\": \"http://www.w3.org/2000/svg\"\n  }), \"\\n      \", mdx(\"path\", _extends({\n    parentName: \"svg\"\n  }, {\n    \"d\": \"M1.5 6.33337H15.5\",\n    \"stroke\": \"#CBD5E0\",\n    \"strokeWidth\": \"2\",\n    \"strokeLineCap\": \"round\",\n    \"strokeLineJoin\": \"round\"\n  })), \"\\n      \", mdx(\"path\", _extends({\n    parentName: \"svg\"\n  }, {\n    \"d\": \"M1.5 11.6666H15.5\",\n    \"stroke\": \"#CBD5E0\",\n    \"strokeWidth\": \"2\",\n    \"strokeLineCap\": \"round\",\n    \"strokeLineJoin\": \"round\"\n  })), \"\\n      \", mdx(\"path\", _extends({\n    parentName: \"svg\"\n  }, {\n    \"d\": \"M6.75 1L5 17\",\n    \"stroke\": \"#CBD5E0\",\n    \"strokeWidth\": \"2\",\n    \"strokeLineCap\": \"round\",\n    \"strokeLineJoin\": \"round\"\n  })), \"\\n      \", mdx(\"path\", _extends({\n    parentName: \"svg\"\n  }, {\n    \"d\": \"M12 1L10.25 17\",\n    \"stroke\": \"#CBD5E0\",\n    \"strokeWidth\": \"2\",\n    \"strokeLineCap\": \"round\",\n    \"strokeLineJoin\": \"round\"\n  })), \"\\n      \")), \"Pre-requisites\"), mdx(\"p\", {\n    parentName: \"section\"\n  }, \"Having a decent understanding of GraphQL and a bit of familiarity with TypeScript may help you adopt Nexus. If you like to dive in and learn on the fly feel free to do so, but if you do want to build up some pre-requisite knowledge upfront then the following resources may be of interest.\"), mdx(\"p\", {\n    parentName: \"section\"\n  }, mdx(\"em\", {\n    parentName: \"p\"\n  }, \"GraphQL\")), mdx(\"ul\", {\n    parentName: \"section\"\n  }, mdx(\"li\", {\n    parentName: \"ul\"\n  }, mdx(\"a\", _extends({\n    parentName: \"li\"\n  }, {\n    \"href\": \"https://www.howtographql.com\"\n  }), \"How to GraphQL\")), mdx(\"li\", {\n    parentName: \"ul\"\n  }, mdx(\"a\", _extends({\n    parentName: \"li\"\n  }, {\n    \"href\": \"https://book.productionreadygraphql.com/\"\n  }), \"Production Ready GraphQL\")), mdx(\"li\", {\n    parentName: \"ul\"\n  }, mdx(\"a\", _extends({\n    parentName: \"li\"\n  }, {\n    \"href\": \"https://graphql.org\"\n  }), \"Official GraphQL website\"), \" (\", mdx(\"a\", _extends({\n    parentName: \"li\"\n  }, {\n    \"href\": \"https://graphql.org/community/\"\n  }), \"community resources\"), \")\")), mdx(\"p\", {\n    parentName: \"section\"\n  }, mdx(\"em\", {\n    parentName: \"p\"\n  }, \"TypeScript\")), mdx(\"ul\", {\n    parentName: \"section\"\n  }, mdx(\"li\", {\n    parentName: \"ul\"\n  }, mdx(\"a\", _extends({\n    parentName: \"li\"\n  }, {\n    \"href\": \"https://microsoft.github.io/TypeScript-New-Handbook/everything/\"\n  }), \"The New Handbook\")), mdx(\"li\", {\n    parentName: \"ul\"\n  }, mdx(\"a\", _extends({\n    parentName: \"li\"\n  }, {\n    \"href\": \"http://www.typescriptlang.org/play\"\n  }), \"The Interactive Playground\")), mdx(\"li\", {\n    parentName: \"ul\"\n  }, mdx(\"a\", _extends({\n    parentName: \"li\"\n  }, {\n    \"href\": \"https://mariusschulz.com/blog\"\n  }), \"Dozens of articles\"), \" by \", mdx(\"a\", _extends({\n    parentName: \"li\"\n  }, {\n    \"href\": \"https://github.com/mariusschulz\"\n  }), \"Marius Schulz\")), mdx(\"li\", {\n    parentName: \"ul\"\n  }, mdx(\"a\", _extends({\n    parentName: \"li\"\n  }, {\n    \"href\": \"https://2ality.com/index.html\"\n  }), \"Dozens of articles\"), \" by \", mdx(\"a\", _extends({\n    parentName: \"li\"\n  }, {\n    \"href\": \"https://github.com/rauschma\"\n  }), \"Dr. Axel Rauschmayer\")))), mdx(\"section\", null, mdx(\"h2\", _extends({\n    parentName: \"section\"\n  }, {\n    \"id\": \"diving-in\",\n    \"style\": {\n      \"position\": \"relative\"\n    }\n  }), mdx(\"a\", _extends({\n    parentName: \"h2\"\n  }, {\n    \"href\": \"#diving-in\",\n    \"aria-label\": \"diving in permalink\",\n    \"className\": \"title-link before\"\n  }), mdx(\"svg\", _extends({\n    parentName: \"a\"\n  }, {\n    \"width\": \"17\",\n    \"height\": \"18\",\n    \"viewBox\": \"0 0 17 18\",\n    \"fill\": \"none\",\n    \"xmlns\": \"http://www.w3.org/2000/svg\"\n  }), \"\\n      \", mdx(\"path\", _extends({\n    parentName: \"svg\"\n  }, {\n    \"d\": \"M1.5 6.33337H15.5\",\n    \"stroke\": \"#CBD5E0\",\n    \"strokeWidth\": \"2\",\n    \"strokeLineCap\": \"round\",\n    \"strokeLineJoin\": \"round\"\n  })), \"\\n      \", mdx(\"path\", _extends({\n    parentName: \"svg\"\n  }, {\n    \"d\": \"M1.5 11.6666H15.5\",\n    \"stroke\": \"#CBD5E0\",\n    \"strokeWidth\": \"2\",\n    \"strokeLineCap\": \"round\",\n    \"strokeLineJoin\": \"round\"\n  })), \"\\n      \", mdx(\"path\", _extends({\n    parentName: \"svg\"\n  }, {\n    \"d\": \"M6.75 1L5 17\",\n    \"stroke\": \"#CBD5E0\",\n    \"strokeWidth\": \"2\",\n    \"strokeLineCap\": \"round\",\n    \"strokeLineJoin\": \"round\"\n  })), \"\\n      \", mdx(\"path\", _extends({\n    parentName: \"svg\"\n  }, {\n    \"d\": \"M12 1L10.25 17\",\n    \"stroke\": \"#CBD5E0\",\n    \"strokeWidth\": \"2\",\n    \"strokeLineCap\": \"round\",\n    \"strokeLineJoin\": \"round\"\n  })), \"\\n      \")), \"Diving In\"), mdx(\"ul\", {\n    parentName: \"section\"\n  }, mdx(\"li\", {\n    parentName: \"ul\"\n  }, \"Go through the \", mdx(\"a\", _extends({\n    parentName: \"li\"\n  }, {\n    \"href\": \"/tutorial/introduction\"\n  }), \"tutorial\")), mdx(\"li\", {\n    parentName: \"ul\"\n  }, \"Explore the \", mdx(\"a\", _extends({\n    parentName: \"li\"\n  }, {\n    \"href\": \"https://github.com/graphql-nexus/examples\"\n  }), \"examples repo\")), mdx(\"li\", {\n    parentName: \"ul\"\n  }, \"Explore your own first app by running \", mdx(\"inlineCode\", {\n    parentName: \"li\"\n  }, \"npx nexus\")))));\n}\n;\nMDXContent.isMDXComponent = true;","parent":{"__typename":"File","relativePath":"01-getting-started/01-welcome-to-nexus.mdx"},"tableOfContents":{"items":[{"url":"#welcome-to-nexus","title":"Welcome to Nexus"},{"url":"#goals","title":"Goals"},{"url":"#highlights","title":"Highlights"},{"url":"#why","title":"Why"},{"url":"#pre-requisites","title":"Pre-requisites"},{"url":"#diving-in","title":"Diving In"}]},"frontmatter":{"title":"Welcome to Nexus","metaTitle":"Welcome to Nexus","metaDescription":null}}},"pageContext":{"id":"b8843465-49cf-52c3-9638-c22544a6f877","seoTitle":"Welcome to Nexus","seoDescription":"Welcome to Nexus"}}}