{"componentChunkName":"component---src-layouts-article-layout-tsx","path":"/meta/architecture","result":{"data":{"site":{"siteMetadata":{"docsLocation":"https://github.com/graphql-nexus/docs/tree/master/content"}},"mdx":{"fields":{"slug":"/05-meta/03-architecture"},"body":"function _extends() { _extends = Object.assign || function (target) { for (var i = 1; i < arguments.length; i++) { var source = arguments[i]; for (var key in source) { if (Object.prototype.hasOwnProperty.call(source, key)) { target[key] = source[key]; } } } return target; }; return _extends.apply(this, arguments); }\n\nfunction _objectWithoutProperties(source, excluded) { if (source == null) return {}; var target = _objectWithoutPropertiesLoose(source, excluded); var key, i; if (Object.getOwnPropertySymbols) { var sourceSymbolKeys = Object.getOwnPropertySymbols(source); for (i = 0; i < sourceSymbolKeys.length; i++) { key = sourceSymbolKeys[i]; if (excluded.indexOf(key) >= 0) continue; if (!Object.prototype.propertyIsEnumerable.call(source, key)) continue; target[key] = source[key]; } } return target; }\n\nfunction _objectWithoutPropertiesLoose(source, excluded) { if (source == null) return {}; var target = {}; var sourceKeys = Object.keys(source); var key, i; for (i = 0; i < sourceKeys.length; i++) { key = sourceKeys[i]; if (excluded.indexOf(key) >= 0) continue; target[key] = source[key]; } return target; }\n\n/* @jsx mdx */\nvar _frontmatter = {\n  \"title\": \"Architecture\",\n  \"metaTitle\": \"Architecture\"\n};\n\nvar makeShortcode = function makeShortcode(name) {\n  return function MDXDefaultShortcode(props) {\n    console.warn(\"Component \" + name + \" was not imported, exported, or provided by MDXProvider as global scope\");\n    return mdx(\"div\", props);\n  };\n};\n\nvar layoutProps = {\n  _frontmatter: _frontmatter\n};\nvar MDXLayout = \"wrapper\";\nreturn function MDXContent(_ref) {\n  var components = _ref.components,\n      props = _objectWithoutProperties(_ref, [\"components\"]);\n\n  return mdx(MDXLayout, _extends({}, layoutProps, props, {\n    components: components,\n    mdxType: \"MDXLayout\"\n  }), mdx(\"section\", null, mdx(\"h2\", _extends({\n    parentName: \"section\"\n  }, {\n    \"id\": \"reflection\",\n    \"style\": {\n      \"position\": \"relative\"\n    }\n  }), mdx(\"a\", _extends({\n    parentName: \"h2\"\n  }, {\n    \"href\": \"#reflection\",\n    \"aria-label\": \"reflection permalink\",\n    \"className\": \"title-link before\"\n  }), mdx(\"svg\", _extends({\n    parentName: \"a\"\n  }, {\n    \"width\": \"17\",\n    \"height\": \"18\",\n    \"viewBox\": \"0 0 17 18\",\n    \"fill\": \"none\",\n    \"xmlns\": \"http://www.w3.org/2000/svg\"\n  }), \"\\n      \", mdx(\"path\", _extends({\n    parentName: \"svg\"\n  }, {\n    \"d\": \"M1.5 6.33337H15.5\",\n    \"stroke\": \"#CBD5E0\",\n    \"strokeWidth\": \"2\",\n    \"strokeLineCap\": \"round\",\n    \"strokeLineJoin\": \"round\"\n  })), \"\\n      \", mdx(\"path\", _extends({\n    parentName: \"svg\"\n  }, {\n    \"d\": \"M1.5 11.6666H15.5\",\n    \"stroke\": \"#CBD5E0\",\n    \"strokeWidth\": \"2\",\n    \"strokeLineCap\": \"round\",\n    \"strokeLineJoin\": \"round\"\n  })), \"\\n      \", mdx(\"path\", _extends({\n    parentName: \"svg\"\n  }, {\n    \"d\": \"M6.75 1L5 17\",\n    \"stroke\": \"#CBD5E0\",\n    \"strokeWidth\": \"2\",\n    \"strokeLineCap\": \"round\",\n    \"strokeLineJoin\": \"round\"\n  })), \"\\n      \", mdx(\"path\", _extends({\n    parentName: \"svg\"\n  }, {\n    \"d\": \"M12 1L10.25 17\",\n    \"stroke\": \"#CBD5E0\",\n    \"strokeWidth\": \"2\",\n    \"strokeLineCap\": \"round\",\n    \"strokeLineJoin\": \"round\"\n  })), \"\\n      \")), \"Reflection\"), mdx(\"p\", {\n    parentName: \"section\"\n  }, \"todo\")), mdx(\"section\", null, mdx(\"h2\", _extends({\n    parentName: \"section\"\n  }, {\n    \"id\": \"assembly\",\n    \"style\": {\n      \"position\": \"relative\"\n    }\n  }), mdx(\"a\", _extends({\n    parentName: \"h2\"\n  }, {\n    \"href\": \"#assembly\",\n    \"aria-label\": \"assembly permalink\",\n    \"className\": \"title-link before\"\n  }), mdx(\"svg\", _extends({\n    parentName: \"a\"\n  }, {\n    \"width\": \"17\",\n    \"height\": \"18\",\n    \"viewBox\": \"0 0 17 18\",\n    \"fill\": \"none\",\n    \"xmlns\": \"http://www.w3.org/2000/svg\"\n  }), \"\\n      \", mdx(\"path\", _extends({\n    parentName: \"svg\"\n  }, {\n    \"d\": \"M1.5 6.33337H15.5\",\n    \"stroke\": \"#CBD5E0\",\n    \"strokeWidth\": \"2\",\n    \"strokeLineCap\": \"round\",\n    \"strokeLineJoin\": \"round\"\n  })), \"\\n      \", mdx(\"path\", _extends({\n    parentName: \"svg\"\n  }, {\n    \"d\": \"M1.5 11.6666H15.5\",\n    \"stroke\": \"#CBD5E0\",\n    \"strokeWidth\": \"2\",\n    \"strokeLineCap\": \"round\",\n    \"strokeLineJoin\": \"round\"\n  })), \"\\n      \", mdx(\"path\", _extends({\n    parentName: \"svg\"\n  }, {\n    \"d\": \"M6.75 1L5 17\",\n    \"stroke\": \"#CBD5E0\",\n    \"strokeWidth\": \"2\",\n    \"strokeLineCap\": \"round\",\n    \"strokeLineJoin\": \"round\"\n  })), \"\\n      \", mdx(\"path\", _extends({\n    parentName: \"svg\"\n  }, {\n    \"d\": \"M12 1L10.25 17\",\n    \"stroke\": \"#CBD5E0\",\n    \"strokeWidth\": \"2\",\n    \"strokeLineCap\": \"round\",\n    \"strokeLineJoin\": \"round\"\n  })), \"\\n      \")), \"Assembly\"), mdx(\"p\", {\n    parentName: \"section\"\n  }, \"todo\")), mdx(\"section\", null, mdx(\"h2\", _extends({\n    parentName: \"section\"\n  }, {\n    \"id\": \"plugins\",\n    \"style\": {\n      \"position\": \"relative\"\n    }\n  }), mdx(\"a\", _extends({\n    parentName: \"h2\"\n  }, {\n    \"href\": \"#plugins\",\n    \"aria-label\": \"plugins permalink\",\n    \"className\": \"title-link before\"\n  }), mdx(\"svg\", _extends({\n    parentName: \"a\"\n  }, {\n    \"width\": \"17\",\n    \"height\": \"18\",\n    \"viewBox\": \"0 0 17 18\",\n    \"fill\": \"none\",\n    \"xmlns\": \"http://www.w3.org/2000/svg\"\n  }), \"\\n      \", mdx(\"path\", _extends({\n    parentName: \"svg\"\n  }, {\n    \"d\": \"M1.5 6.33337H15.5\",\n    \"stroke\": \"#CBD5E0\",\n    \"strokeWidth\": \"2\",\n    \"strokeLineCap\": \"round\",\n    \"strokeLineJoin\": \"round\"\n  })), \"\\n      \", mdx(\"path\", _extends({\n    parentName: \"svg\"\n  }, {\n    \"d\": \"M1.5 11.6666H15.5\",\n    \"stroke\": \"#CBD5E0\",\n    \"strokeWidth\": \"2\",\n    \"strokeLineCap\": \"round\",\n    \"strokeLineJoin\": \"round\"\n  })), \"\\n      \", mdx(\"path\", _extends({\n    parentName: \"svg\"\n  }, {\n    \"d\": \"M6.75 1L5 17\",\n    \"stroke\": \"#CBD5E0\",\n    \"strokeWidth\": \"2\",\n    \"strokeLineCap\": \"round\",\n    \"strokeLineJoin\": \"round\"\n  })), \"\\n      \", mdx(\"path\", _extends({\n    parentName: \"svg\"\n  }, {\n    \"d\": \"M12 1L10.25 17\",\n    \"stroke\": \"#CBD5E0\",\n    \"strokeWidth\": \"2\",\n    \"strokeLineCap\": \"round\",\n    \"strokeLineJoin\": \"round\"\n  })), \"\\n      \")), \"Plugins\"), mdx(\"section\", {\n    parentName: \"section\"\n  }, mdx(\"h3\", _extends({\n    parentName: \"section\"\n  }, {\n    \"id\": \"diagrams\",\n    \"style\": {\n      \"position\": \"relative\"\n    }\n  }), mdx(\"a\", _extends({\n    parentName: \"h3\"\n  }, {\n    \"href\": \"#diagrams\",\n    \"aria-label\": \"diagrams permalink\",\n    \"className\": \"title-link before\"\n  }), mdx(\"svg\", _extends({\n    parentName: \"a\"\n  }, {\n    \"width\": \"17\",\n    \"height\": \"18\",\n    \"viewBox\": \"0 0 17 18\",\n    \"fill\": \"none\",\n    \"xmlns\": \"http://www.w3.org/2000/svg\"\n  }), \"\\n      \", mdx(\"path\", _extends({\n    parentName: \"svg\"\n  }, {\n    \"d\": \"M1.5 6.33337H15.5\",\n    \"stroke\": \"#CBD5E0\",\n    \"strokeWidth\": \"2\",\n    \"strokeLineCap\": \"round\",\n    \"strokeLineJoin\": \"round\"\n  })), \"\\n      \", mdx(\"path\", _extends({\n    parentName: \"svg\"\n  }, {\n    \"d\": \"M1.5 11.6666H15.5\",\n    \"stroke\": \"#CBD5E0\",\n    \"strokeWidth\": \"2\",\n    \"strokeLineCap\": \"round\",\n    \"strokeLineJoin\": \"round\"\n  })), \"\\n      \", mdx(\"path\", _extends({\n    parentName: \"svg\"\n  }, {\n    \"d\": \"M6.75 1L5 17\",\n    \"stroke\": \"#CBD5E0\",\n    \"strokeWidth\": \"2\",\n    \"strokeLineCap\": \"round\",\n    \"strokeLineJoin\": \"round\"\n  })), \"\\n      \", mdx(\"path\", _extends({\n    parentName: \"svg\"\n  }, {\n    \"d\": \"M12 1L10.25 17\",\n    \"stroke\": \"#CBD5E0\",\n    \"strokeWidth\": \"2\",\n    \"strokeLineCap\": \"round\",\n    \"strokeLineJoin\": \"round\"\n  })), \"\\n      \")), \"Diagrams\"), mdx(\"section\", {\n    parentName: \"section\"\n  }, mdx(\"h4\", _extends({\n    parentName: \"section\"\n  }, {\n    \"id\": \"plugin-tree-shaking\",\n    \"style\": {\n      \"position\": \"relative\"\n    }\n  }), mdx(\"a\", _extends({\n    parentName: \"h4\"\n  }, {\n    \"href\": \"#plugin-tree-shaking\",\n    \"aria-label\": \"plugin tree shaking permalink\",\n    \"className\": \"title-link before\"\n  }), mdx(\"svg\", _extends({\n    parentName: \"a\"\n  }, {\n    \"width\": \"17\",\n    \"height\": \"18\",\n    \"viewBox\": \"0 0 17 18\",\n    \"fill\": \"none\",\n    \"xmlns\": \"http://www.w3.org/2000/svg\"\n  }), \"\\n      \", mdx(\"path\", _extends({\n    parentName: \"svg\"\n  }, {\n    \"d\": \"M1.5 6.33337H15.5\",\n    \"stroke\": \"#CBD5E0\",\n    \"strokeWidth\": \"2\",\n    \"strokeLineCap\": \"round\",\n    \"strokeLineJoin\": \"round\"\n  })), \"\\n      \", mdx(\"path\", _extends({\n    parentName: \"svg\"\n  }, {\n    \"d\": \"M1.5 11.6666H15.5\",\n    \"stroke\": \"#CBD5E0\",\n    \"strokeWidth\": \"2\",\n    \"strokeLineCap\": \"round\",\n    \"strokeLineJoin\": \"round\"\n  })), \"\\n      \", mdx(\"path\", _extends({\n    parentName: \"svg\"\n  }, {\n    \"d\": \"M6.75 1L5 17\",\n    \"stroke\": \"#CBD5E0\",\n    \"strokeWidth\": \"2\",\n    \"strokeLineCap\": \"round\",\n    \"strokeLineJoin\": \"round\"\n  })), \"\\n      \", mdx(\"path\", _extends({\n    parentName: \"svg\"\n  }, {\n    \"d\": \"M12 1L10.25 17\",\n    \"stroke\": \"#CBD5E0\",\n    \"strokeWidth\": \"2\",\n    \"strokeLineCap\": \"round\",\n    \"strokeLineJoin\": \"round\"\n  })), \"\\n      \")), \"Plugin Tree Shaking\"), mdx(\"p\", {\n    parentName: \"section\"\n  }, mdx(\"img\", _extends({\n    parentName: \"p\"\n  }, {\n    \"src\": \"https://dsc.cloud/661643/plugin-tree-shaking.png\",\n    \"alt\": \"plugin-tree-shaking\"\n  }))))), mdx(\"section\", {\n    parentName: \"section\"\n  }, mdx(\"h3\", _extends({\n    parentName: \"section\"\n  }, {\n    \"id\": \"glossary\",\n    \"style\": {\n      \"position\": \"relative\"\n    }\n  }), mdx(\"a\", _extends({\n    parentName: \"h3\"\n  }, {\n    \"href\": \"#glossary\",\n    \"aria-label\": \"glossary permalink\",\n    \"className\": \"title-link before\"\n  }), mdx(\"svg\", _extends({\n    parentName: \"a\"\n  }, {\n    \"width\": \"17\",\n    \"height\": \"18\",\n    \"viewBox\": \"0 0 17 18\",\n    \"fill\": \"none\",\n    \"xmlns\": \"http://www.w3.org/2000/svg\"\n  }), \"\\n      \", mdx(\"path\", _extends({\n    parentName: \"svg\"\n  }, {\n    \"d\": \"M1.5 6.33337H15.5\",\n    \"stroke\": \"#CBD5E0\",\n    \"strokeWidth\": \"2\",\n    \"strokeLineCap\": \"round\",\n    \"strokeLineJoin\": \"round\"\n  })), \"\\n      \", mdx(\"path\", _extends({\n    parentName: \"svg\"\n  }, {\n    \"d\": \"M1.5 11.6666H15.5\",\n    \"stroke\": \"#CBD5E0\",\n    \"strokeWidth\": \"2\",\n    \"strokeLineCap\": \"round\",\n    \"strokeLineJoin\": \"round\"\n  })), \"\\n      \", mdx(\"path\", _extends({\n    parentName: \"svg\"\n  }, {\n    \"d\": \"M6.75 1L5 17\",\n    \"stroke\": \"#CBD5E0\",\n    \"strokeWidth\": \"2\",\n    \"strokeLineCap\": \"round\",\n    \"strokeLineJoin\": \"round\"\n  })), \"\\n      \", mdx(\"path\", _extends({\n    parentName: \"svg\"\n  }, {\n    \"d\": \"M12 1L10.25 17\",\n    \"stroke\": \"#CBD5E0\",\n    \"strokeWidth\": \"2\",\n    \"strokeLineCap\": \"round\",\n    \"strokeLineJoin\": \"round\"\n  })), \"\\n      \")), \"Glossary\"), mdx(\"section\", {\n    parentName: \"section\"\n  }, mdx(\"h4\", _extends({\n    parentName: \"section\"\n  }, {\n    \"id\": \"entrypoint\",\n    \"style\": {\n      \"position\": \"relative\"\n    }\n  }), mdx(\"a\", _extends({\n    parentName: \"h4\"\n  }, {\n    \"href\": \"#entrypoint\",\n    \"aria-label\": \"entrypoint permalink\",\n    \"className\": \"title-link before\"\n  }), mdx(\"svg\", _extends({\n    parentName: \"a\"\n  }, {\n    \"width\": \"17\",\n    \"height\": \"18\",\n    \"viewBox\": \"0 0 17 18\",\n    \"fill\": \"none\",\n    \"xmlns\": \"http://www.w3.org/2000/svg\"\n  }), \"\\n      \", mdx(\"path\", _extends({\n    parentName: \"svg\"\n  }, {\n    \"d\": \"M1.5 6.33337H15.5\",\n    \"stroke\": \"#CBD5E0\",\n    \"strokeWidth\": \"2\",\n    \"strokeLineCap\": \"round\",\n    \"strokeLineJoin\": \"round\"\n  })), \"\\n      \", mdx(\"path\", _extends({\n    parentName: \"svg\"\n  }, {\n    \"d\": \"M1.5 11.6666H15.5\",\n    \"stroke\": \"#CBD5E0\",\n    \"strokeWidth\": \"2\",\n    \"strokeLineCap\": \"round\",\n    \"strokeLineJoin\": \"round\"\n  })), \"\\n      \", mdx(\"path\", _extends({\n    parentName: \"svg\"\n  }, {\n    \"d\": \"M6.75 1L5 17\",\n    \"stroke\": \"#CBD5E0\",\n    \"strokeWidth\": \"2\",\n    \"strokeLineCap\": \"round\",\n    \"strokeLineJoin\": \"round\"\n  })), \"\\n      \", mdx(\"path\", _extends({\n    parentName: \"svg\"\n  }, {\n    \"d\": \"M12 1L10.25 17\",\n    \"stroke\": \"#CBD5E0\",\n    \"strokeWidth\": \"2\",\n    \"strokeLineCap\": \"round\",\n    \"strokeLineJoin\": \"round\"\n  })), \"\\n      \")), \"Entrypoint\"), mdx(\"p\", {\n    parentName: \"section\"\n  }, \"A plugin entrypoint is responsible for returning the plugin's manifest input. This is what users actually deal with at the app layer.\"), mdx(\"pre\", {\n    parentName: \"section\"\n  }, mdx(\"code\", _extends({\n    parentName: \"pre\"\n  }, {\n    \"className\": \"language-ts\"\n  }), \"import { prisma } from 'nexus-plugin-prisma'\\n//       ~~~~~~ <------------- The entrypoint, returns a manifest input\\nimport { use } from 'nexus'\\n\\nuse(prisma())\\n\"))), mdx(\"section\", {\n    parentName: \"section\"\n  }, mdx(\"h4\", _extends({\n    parentName: \"section\"\n  }, {\n    \"id\": \"manifest\",\n    \"style\": {\n      \"position\": \"relative\"\n    }\n  }), mdx(\"a\", _extends({\n    parentName: \"h4\"\n  }, {\n    \"href\": \"#manifest\",\n    \"aria-label\": \"manifest permalink\",\n    \"className\": \"title-link before\"\n  }), mdx(\"svg\", _extends({\n    parentName: \"a\"\n  }, {\n    \"width\": \"17\",\n    \"height\": \"18\",\n    \"viewBox\": \"0 0 17 18\",\n    \"fill\": \"none\",\n    \"xmlns\": \"http://www.w3.org/2000/svg\"\n  }), \"\\n      \", mdx(\"path\", _extends({\n    parentName: \"svg\"\n  }, {\n    \"d\": \"M1.5 6.33337H15.5\",\n    \"stroke\": \"#CBD5E0\",\n    \"strokeWidth\": \"2\",\n    \"strokeLineCap\": \"round\",\n    \"strokeLineJoin\": \"round\"\n  })), \"\\n      \", mdx(\"path\", _extends({\n    parentName: \"svg\"\n  }, {\n    \"d\": \"M1.5 11.6666H15.5\",\n    \"stroke\": \"#CBD5E0\",\n    \"strokeWidth\": \"2\",\n    \"strokeLineCap\": \"round\",\n    \"strokeLineJoin\": \"round\"\n  })), \"\\n      \", mdx(\"path\", _extends({\n    parentName: \"svg\"\n  }, {\n    \"d\": \"M6.75 1L5 17\",\n    \"stroke\": \"#CBD5E0\",\n    \"strokeWidth\": \"2\",\n    \"strokeLineCap\": \"round\",\n    \"strokeLineJoin\": \"round\"\n  })), \"\\n      \", mdx(\"path\", _extends({\n    parentName: \"svg\"\n  }, {\n    \"d\": \"M12 1L10.25 17\",\n    \"stroke\": \"#CBD5E0\",\n    \"strokeWidth\": \"2\",\n    \"strokeLineCap\": \"round\",\n    \"strokeLineJoin\": \"round\"\n  })), \"\\n      \")), \"Manifest\"), mdx(\"p\", {\n    parentName: \"section\"\n  }, \"A plugin manifest describes logistical information about a plugin like where its package file is located on disk, what versions of Nexus it is compatible with, and more.\"), mdx(\"p\", {\n    parentName: \"section\"\n  }, \"Plugin manifests are created by Nexus by processing the manifest inputs returned by plugin entrypoints.\"), mdx(\"pre\", {\n    parentName: \"section\"\n  }, mdx(\"code\", _extends({\n    parentName: \"pre\"\n  }, {\n    \"className\": \"language-ts\"\n  }), \"import { prisma } from 'nexus-plugin-prisma'\\n\\nconst prismaPluginManifestInput = prisma()\\n\")), mdx(\"p\", {\n    parentName: \"section\"\n  }, \"This lazy approach allows Nexus the flexibility it needs to provide features like automatic environment variable plugin settings injection and tree-shaking.\")), mdx(\"section\", {\n    parentName: \"section\"\n  }, mdx(\"h4\", _extends({\n    parentName: \"section\"\n  }, {\n    \"id\": \"manifest-input\",\n    \"style\": {\n      \"position\": \"relative\"\n    }\n  }), mdx(\"a\", _extends({\n    parentName: \"h4\"\n  }, {\n    \"href\": \"#manifest-input\",\n    \"aria-label\": \"manifest input permalink\",\n    \"className\": \"title-link before\"\n  }), mdx(\"svg\", _extends({\n    parentName: \"a\"\n  }, {\n    \"width\": \"17\",\n    \"height\": \"18\",\n    \"viewBox\": \"0 0 17 18\",\n    \"fill\": \"none\",\n    \"xmlns\": \"http://www.w3.org/2000/svg\"\n  }), \"\\n      \", mdx(\"path\", _extends({\n    parentName: \"svg\"\n  }, {\n    \"d\": \"M1.5 6.33337H15.5\",\n    \"stroke\": \"#CBD5E0\",\n    \"strokeWidth\": \"2\",\n    \"strokeLineCap\": \"round\",\n    \"strokeLineJoin\": \"round\"\n  })), \"\\n      \", mdx(\"path\", _extends({\n    parentName: \"svg\"\n  }, {\n    \"d\": \"M1.5 11.6666H15.5\",\n    \"stroke\": \"#CBD5E0\",\n    \"strokeWidth\": \"2\",\n    \"strokeLineCap\": \"round\",\n    \"strokeLineJoin\": \"round\"\n  })), \"\\n      \", mdx(\"path\", _extends({\n    parentName: \"svg\"\n  }, {\n    \"d\": \"M6.75 1L5 17\",\n    \"stroke\": \"#CBD5E0\",\n    \"strokeWidth\": \"2\",\n    \"strokeLineCap\": \"round\",\n    \"strokeLineJoin\": \"round\"\n  })), \"\\n      \", mdx(\"path\", _extends({\n    parentName: \"svg\"\n  }, {\n    \"d\": \"M12 1L10.25 17\",\n    \"stroke\": \"#CBD5E0\",\n    \"strokeWidth\": \"2\",\n    \"strokeLineCap\": \"round\",\n    \"strokeLineJoin\": \"round\"\n  })), \"\\n      \")), \"Manifest Input\"), mdx(\"p\", {\n    parentName: \"section\"\n  }, \"A manifest input is the view of manifests that plugin authors work with. It models the minimum information that Nexus needs to build the plugin manifest. It is also more human friendly, for example minimizing the number of required fields. Developer experience is not the primary motivation here however. We want Nexus to control as much as possible, so the less the human has to specify the more we achieve this goal. For example we ask for a path to package json rather than the contents of it. We want Nexus to be the one that reads it, when and how it wants.\")), mdx(\"section\", {\n    parentName: \"section\"\n  }, mdx(\"h4\", _extends({\n    parentName: \"section\"\n  }, {\n    \"id\": \"dimension\",\n    \"style\": {\n      \"position\": \"relative\"\n    }\n  }), mdx(\"a\", _extends({\n    parentName: \"h4\"\n  }, {\n    \"href\": \"#dimension\",\n    \"aria-label\": \"dimension permalink\",\n    \"className\": \"title-link before\"\n  }), mdx(\"svg\", _extends({\n    parentName: \"a\"\n  }, {\n    \"width\": \"17\",\n    \"height\": \"18\",\n    \"viewBox\": \"0 0 17 18\",\n    \"fill\": \"none\",\n    \"xmlns\": \"http://www.w3.org/2000/svg\"\n  }), \"\\n      \", mdx(\"path\", _extends({\n    parentName: \"svg\"\n  }, {\n    \"d\": \"M1.5 6.33337H15.5\",\n    \"stroke\": \"#CBD5E0\",\n    \"strokeWidth\": \"2\",\n    \"strokeLineCap\": \"round\",\n    \"strokeLineJoin\": \"round\"\n  })), \"\\n      \", mdx(\"path\", _extends({\n    parentName: \"svg\"\n  }, {\n    \"d\": \"M1.5 11.6666H15.5\",\n    \"stroke\": \"#CBD5E0\",\n    \"strokeWidth\": \"2\",\n    \"strokeLineCap\": \"round\",\n    \"strokeLineJoin\": \"round\"\n  })), \"\\n      \", mdx(\"path\", _extends({\n    parentName: \"svg\"\n  }, {\n    \"d\": \"M6.75 1L5 17\",\n    \"stroke\": \"#CBD5E0\",\n    \"strokeWidth\": \"2\",\n    \"strokeLineCap\": \"round\",\n    \"strokeLineJoin\": \"round\"\n  })), \"\\n      \", mdx(\"path\", _extends({\n    parentName: \"svg\"\n  }, {\n    \"d\": \"M12 1L10.25 17\",\n    \"stroke\": \"#CBD5E0\",\n    \"strokeWidth\": \"2\",\n    \"strokeLineCap\": \"round\",\n    \"strokeLineJoin\": \"round\"\n  })), \"\\n      \")), \"Dimension\"), mdx(\"p\", {\n    parentName: \"section\"\n  }, \"A plugin dimension represents a high-level area of plugin concern that are separated by module from other dimensions. In other words, each dimension has its own entrypoint. Nexus will directly import it. A dimension is found by Nexus from Nexus reading the Plugin manifest.\"), mdx(\"p\", {\n    parentName: \"section\"\n  }, \"There are three dimensions: worktime, testtime, and runtime. Worktime allows plugins to tap into the CLI, the builder, dev mode, and more. Testtime allows plugins to tap into features of the Nexus testing component. Runtime allows plugins to tap into the API.\"), mdx(\"p\", {\n    parentName: \"section\"\n  }, \"Directionally Nexus is on a good track, but there is work still left to do. The names are a bit confusing when you dig into the details, and the supposed separation between worktime/runtime has undesirable \\\"loopholes\\\" because of reflection. Details;\"), mdx(\"ol\", {\n    parentName: \"section\"\n  }, mdx(\"li\", {\n    parentName: \"ol\"\n  }, mdx(\"p\", {\n    parentName: \"li\"\n  }, \"Runtime dimension does not mean plugging exclusively into what is run in your production code. There are actually reasons to plug into the runtime for ostensibly worktime beneit... This is due to Nexus' so-called reflection system, wherein the app is run in the background during development for development purposes.\")), mdx(\"li\", {\n    parentName: \"ol\"\n  }, mdx(\"p\", {\n    parentName: \"li\"\n  }, \"The rationale for splitting worktime from runtime is clear, tree-shaking alone makes the case for it. However the separation between worktime and testing is less clear, perhaps nonsense, and so may be revisited in the future.\")), mdx(\"li\", {\n    parentName: \"ol\"\n  }, mdx(\"p\", {\n    parentName: \"li\"\n  }, \"We've talked about motivation for separating worktime from runtime, yet there are runtime parts for worktime (reflection). What this means is that expensive dependencies can make there way into the runtime dimension that a user should actually \", mdx(\"em\", {\n    parentName: \"p\"\n  }, \"not\"), \" be paying for in production runtime.\")))), mdx(\"section\", {\n    parentName: \"section\"\n  }, mdx(\"h4\", _extends({\n    parentName: \"section\"\n  }, {\n    \"id\": \"lens\",\n    \"style\": {\n      \"position\": \"relative\"\n    }\n  }), mdx(\"a\", _extends({\n    parentName: \"h4\"\n  }, {\n    \"href\": \"#lens\",\n    \"aria-label\": \"lens permalink\",\n    \"className\": \"title-link before\"\n  }), mdx(\"svg\", _extends({\n    parentName: \"a\"\n  }, {\n    \"width\": \"17\",\n    \"height\": \"18\",\n    \"viewBox\": \"0 0 17 18\",\n    \"fill\": \"none\",\n    \"xmlns\": \"http://www.w3.org/2000/svg\"\n  }), \"\\n      \", mdx(\"path\", _extends({\n    parentName: \"svg\"\n  }, {\n    \"d\": \"M1.5 6.33337H15.5\",\n    \"stroke\": \"#CBD5E0\",\n    \"strokeWidth\": \"2\",\n    \"strokeLineCap\": \"round\",\n    \"strokeLineJoin\": \"round\"\n  })), \"\\n      \", mdx(\"path\", _extends({\n    parentName: \"svg\"\n  }, {\n    \"d\": \"M1.5 11.6666H15.5\",\n    \"stroke\": \"#CBD5E0\",\n    \"strokeWidth\": \"2\",\n    \"strokeLineCap\": \"round\",\n    \"strokeLineJoin\": \"round\"\n  })), \"\\n      \", mdx(\"path\", _extends({\n    parentName: \"svg\"\n  }, {\n    \"d\": \"M6.75 1L5 17\",\n    \"stroke\": \"#CBD5E0\",\n    \"strokeWidth\": \"2\",\n    \"strokeLineCap\": \"round\",\n    \"strokeLineJoin\": \"round\"\n  })), \"\\n      \", mdx(\"path\", _extends({\n    parentName: \"svg\"\n  }, {\n    \"d\": \"M12 1L10.25 17\",\n    \"stroke\": \"#CBD5E0\",\n    \"strokeWidth\": \"2\",\n    \"strokeLineCap\": \"round\",\n    \"strokeLineJoin\": \"round\"\n  })), \"\\n      \")), \"Lens\"), mdx(\"p\", {\n    parentName: \"section\"\n  }, \"A plugin lens is just a specialized api into a subset of Nexus to hook into, extend, manipulate, and react to it during execution. The name \\\"lens\\\" is arbitrary. The choice comes from it being \\\"view\\\" into Nexus. Each dimension has its own specialized lens.\")), mdx(\"section\", {\n    parentName: \"section\"\n  }, mdx(\"h4\", _extends({\n    parentName: \"section\"\n  }, {\n    \"id\": \"dimension-entrypoint\",\n    \"style\": {\n      \"position\": \"relative\"\n    }\n  }), mdx(\"a\", _extends({\n    parentName: \"h4\"\n  }, {\n    \"href\": \"#dimension-entrypoint\",\n    \"aria-label\": \"dimension entrypoint permalink\",\n    \"className\": \"title-link before\"\n  }), mdx(\"svg\", _extends({\n    parentName: \"a\"\n  }, {\n    \"width\": \"17\",\n    \"height\": \"18\",\n    \"viewBox\": \"0 0 17 18\",\n    \"fill\": \"none\",\n    \"xmlns\": \"http://www.w3.org/2000/svg\"\n  }), \"\\n      \", mdx(\"path\", _extends({\n    parentName: \"svg\"\n  }, {\n    \"d\": \"M1.5 6.33337H15.5\",\n    \"stroke\": \"#CBD5E0\",\n    \"strokeWidth\": \"2\",\n    \"strokeLineCap\": \"round\",\n    \"strokeLineJoin\": \"round\"\n  })), \"\\n      \", mdx(\"path\", _extends({\n    parentName: \"svg\"\n  }, {\n    \"d\": \"M1.5 11.6666H15.5\",\n    \"stroke\": \"#CBD5E0\",\n    \"strokeWidth\": \"2\",\n    \"strokeLineCap\": \"round\",\n    \"strokeLineJoin\": \"round\"\n  })), \"\\n      \", mdx(\"path\", _extends({\n    parentName: \"svg\"\n  }, {\n    \"d\": \"M6.75 1L5 17\",\n    \"stroke\": \"#CBD5E0\",\n    \"strokeWidth\": \"2\",\n    \"strokeLineCap\": \"round\",\n    \"strokeLineJoin\": \"round\"\n  })), \"\\n      \", mdx(\"path\", _extends({\n    parentName: \"svg\"\n  }, {\n    \"d\": \"M12 1L10.25 17\",\n    \"stroke\": \"#CBD5E0\",\n    \"strokeWidth\": \"2\",\n    \"strokeLineCap\": \"round\",\n    \"strokeLineJoin\": \"round\"\n  })), \"\\n      \")), \"Dimension Entrypoint\"), mdx(\"p\", {\n    parentName: \"section\"\n  }, \"Just like the plugin has a top level entrypoint so to does each dimension within the plugin have its own entrypoint. These sub-entrypoints can be thought as sub-plugins, with the top-level plugin just being a grouping mechanism.\"))), mdx(\"section\", {\n    parentName: \"section\"\n  }, mdx(\"h3\", _extends({\n    parentName: \"section\"\n  }, {\n    \"id\": \"comparisons-to-other-systems\",\n    \"style\": {\n      \"position\": \"relative\"\n    }\n  }), mdx(\"a\", _extends({\n    parentName: \"h3\"\n  }, {\n    \"href\": \"#comparisons-to-other-systems\",\n    \"aria-label\": \"comparisons to other systems permalink\",\n    \"className\": \"title-link before\"\n  }), mdx(\"svg\", _extends({\n    parentName: \"a\"\n  }, {\n    \"width\": \"17\",\n    \"height\": \"18\",\n    \"viewBox\": \"0 0 17 18\",\n    \"fill\": \"none\",\n    \"xmlns\": \"http://www.w3.org/2000/svg\"\n  }), \"\\n      \", mdx(\"path\", _extends({\n    parentName: \"svg\"\n  }, {\n    \"d\": \"M1.5 6.33337H15.5\",\n    \"stroke\": \"#CBD5E0\",\n    \"strokeWidth\": \"2\",\n    \"strokeLineCap\": \"round\",\n    \"strokeLineJoin\": \"round\"\n  })), \"\\n      \", mdx(\"path\", _extends({\n    parentName: \"svg\"\n  }, {\n    \"d\": \"M1.5 11.6666H15.5\",\n    \"stroke\": \"#CBD5E0\",\n    \"strokeWidth\": \"2\",\n    \"strokeLineCap\": \"round\",\n    \"strokeLineJoin\": \"round\"\n  })), \"\\n      \", mdx(\"path\", _extends({\n    parentName: \"svg\"\n  }, {\n    \"d\": \"M6.75 1L5 17\",\n    \"stroke\": \"#CBD5E0\",\n    \"strokeWidth\": \"2\",\n    \"strokeLineCap\": \"round\",\n    \"strokeLineJoin\": \"round\"\n  })), \"\\n      \", mdx(\"path\", _extends({\n    parentName: \"svg\"\n  }, {\n    \"d\": \"M12 1L10.25 17\",\n    \"stroke\": \"#CBD5E0\",\n    \"strokeWidth\": \"2\",\n    \"strokeLineCap\": \"round\",\n    \"strokeLineJoin\": \"round\"\n  })), \"\\n      \")), \"Comparisons to Other Systems\"), mdx(\"section\", {\n    parentName: \"section\"\n  }, mdx(\"h4\", _extends({\n    parentName: \"section\"\n  }, {\n    \"id\": \"rollup\",\n    \"style\": {\n      \"position\": \"relative\"\n    }\n  }), mdx(\"a\", _extends({\n    parentName: \"h4\"\n  }, {\n    \"href\": \"#rollup\",\n    \"aria-label\": \"rollup permalink\",\n    \"className\": \"title-link before\"\n  }), mdx(\"svg\", _extends({\n    parentName: \"a\"\n  }, {\n    \"width\": \"17\",\n    \"height\": \"18\",\n    \"viewBox\": \"0 0 17 18\",\n    \"fill\": \"none\",\n    \"xmlns\": \"http://www.w3.org/2000/svg\"\n  }), \"\\n      \", mdx(\"path\", _extends({\n    parentName: \"svg\"\n  }, {\n    \"d\": \"M1.5 6.33337H15.5\",\n    \"stroke\": \"#CBD5E0\",\n    \"strokeWidth\": \"2\",\n    \"strokeLineCap\": \"round\",\n    \"strokeLineJoin\": \"round\"\n  })), \"\\n      \", mdx(\"path\", _extends({\n    parentName: \"svg\"\n  }, {\n    \"d\": \"M1.5 11.6666H15.5\",\n    \"stroke\": \"#CBD5E0\",\n    \"strokeWidth\": \"2\",\n    \"strokeLineCap\": \"round\",\n    \"strokeLineJoin\": \"round\"\n  })), \"\\n      \", mdx(\"path\", _extends({\n    parentName: \"svg\"\n  }, {\n    \"d\": \"M6.75 1L5 17\",\n    \"stroke\": \"#CBD5E0\",\n    \"strokeWidth\": \"2\",\n    \"strokeLineCap\": \"round\",\n    \"strokeLineJoin\": \"round\"\n  })), \"\\n      \", mdx(\"path\", _extends({\n    parentName: \"svg\"\n  }, {\n    \"d\": \"M12 1L10.25 17\",\n    \"stroke\": \"#CBD5E0\",\n    \"strokeWidth\": \"2\",\n    \"strokeLineCap\": \"round\",\n    \"strokeLineJoin\": \"round\"\n  })), \"\\n      \")), \"Rollup\"), mdx(\"ul\", {\n    parentName: \"section\"\n  }, mdx(\"li\", {\n    parentName: \"ul\"\n  }, \"Like Rollup plugins are prefixed with \", mdx(\"inlineCode\", {\n    parentName: \"li\"\n  }, \"<tool-name>-plugin-<plugin-name>\")), mdx(\"li\", {\n    parentName: \"ul\"\n  }, \"We have considered but so far not put first-party Nexus plugins under the pattern \", mdx(\"inlineCode\", {\n    parentName: \"li\"\n  }, \"@nexus/plugin-<plugin-name>\"), \". Rollup made this transition retroactively.\"), mdx(\"li\", {\n    parentName: \"ul\"\n  }, \"Rollup suggests plugins have a default export so that are much easier to use on the command line. Nexus suggests plugins also have default exports for similar system-usability reasons (not cli in Nexus' case, but other future features maybe like auto-use).\")))), mdx(\"section\", {\n    parentName: \"section\"\n  }, mdx(\"h3\", _extends({\n    parentName: \"section\"\n  }, {\n    \"id\": \"loading-flow\",\n    \"style\": {\n      \"position\": \"relative\"\n    }\n  }), mdx(\"a\", _extends({\n    parentName: \"h3\"\n  }, {\n    \"href\": \"#loading-flow\",\n    \"aria-label\": \"loading flow permalink\",\n    \"className\": \"title-link before\"\n  }), mdx(\"svg\", _extends({\n    parentName: \"a\"\n  }, {\n    \"width\": \"17\",\n    \"height\": \"18\",\n    \"viewBox\": \"0 0 17 18\",\n    \"fill\": \"none\",\n    \"xmlns\": \"http://www.w3.org/2000/svg\"\n  }), \"\\n      \", mdx(\"path\", _extends({\n    parentName: \"svg\"\n  }, {\n    \"d\": \"M1.5 6.33337H15.5\",\n    \"stroke\": \"#CBD5E0\",\n    \"strokeWidth\": \"2\",\n    \"strokeLineCap\": \"round\",\n    \"strokeLineJoin\": \"round\"\n  })), \"\\n      \", mdx(\"path\", _extends({\n    parentName: \"svg\"\n  }, {\n    \"d\": \"M1.5 11.6666H15.5\",\n    \"stroke\": \"#CBD5E0\",\n    \"strokeWidth\": \"2\",\n    \"strokeLineCap\": \"round\",\n    \"strokeLineJoin\": \"round\"\n  })), \"\\n      \", mdx(\"path\", _extends({\n    parentName: \"svg\"\n  }, {\n    \"d\": \"M6.75 1L5 17\",\n    \"stroke\": \"#CBD5E0\",\n    \"strokeWidth\": \"2\",\n    \"strokeLineCap\": \"round\",\n    \"strokeLineJoin\": \"round\"\n  })), \"\\n      \", mdx(\"path\", _extends({\n    parentName: \"svg\"\n  }, {\n    \"d\": \"M12 1L10.25 17\",\n    \"stroke\": \"#CBD5E0\",\n    \"strokeWidth\": \"2\",\n    \"strokeLineCap\": \"round\",\n    \"strokeLineJoin\": \"round\"\n  })), \"\\n      \")), \"Loading Flow\"), mdx(\"p\", {\n    parentName: \"section\"\n  }, \"todo\", mdx(\"br\", {\n    parentName: \"p\"\n  }), \"\\n\", \"what follows is a stub\"), mdx(\"ol\", {\n    parentName: \"section\"\n  }, mdx(\"li\", {\n    parentName: \"ol\"\n  }, \"capture the used plugins in the app\"), mdx(\"li\", {\n    parentName: \"ol\"\n  }, \"validate entrypoints\"), mdx(\"li\", {\n    parentName: \"ol\"\n  }, \"transform entrypoints into manifests\"), mdx(\"li\", {\n    parentName: \"ol\"\n  }, \"for each dimension (work, test, run) in the manifest\", mdx(\"ol\", {\n    parentName: \"li\"\n  }, mdx(\"li\", {\n    parentName: \"ol\"\n  }, \"import i\\nt\"), mdx(\"li\", {\n    parentName: \"ol\"\n  }, \"catch any import errors\"), mdx(\"li\", {\n    parentName: \"ol\"\n  }, \"validate imported value\"), mdx(\"li\", {\n    parentName: \"ol\"\n  }, \"load plugin\"), mdx(\"li\", {\n    parentName: \"ol\"\n  }, \"catch any load errors\")))))), mdx(\"section\", null, mdx(\"h2\", _extends({\n    parentName: \"section\"\n  }, {\n    \"id\": \"build-flow\",\n    \"style\": {\n      \"position\": \"relative\"\n    }\n  }), mdx(\"a\", _extends({\n    parentName: \"h2\"\n  }, {\n    \"href\": \"#build-flow\",\n    \"aria-label\": \"build flow permalink\",\n    \"className\": \"title-link before\"\n  }), mdx(\"svg\", _extends({\n    parentName: \"a\"\n  }, {\n    \"width\": \"17\",\n    \"height\": \"18\",\n    \"viewBox\": \"0 0 17 18\",\n    \"fill\": \"none\",\n    \"xmlns\": \"http://www.w3.org/2000/svg\"\n  }), \"\\n      \", mdx(\"path\", _extends({\n    parentName: \"svg\"\n  }, {\n    \"d\": \"M1.5 6.33337H15.5\",\n    \"stroke\": \"#CBD5E0\",\n    \"strokeWidth\": \"2\",\n    \"strokeLineCap\": \"round\",\n    \"strokeLineJoin\": \"round\"\n  })), \"\\n      \", mdx(\"path\", _extends({\n    parentName: \"svg\"\n  }, {\n    \"d\": \"M1.5 11.6666H15.5\",\n    \"stroke\": \"#CBD5E0\",\n    \"strokeWidth\": \"2\",\n    \"strokeLineCap\": \"round\",\n    \"strokeLineJoin\": \"round\"\n  })), \"\\n      \", mdx(\"path\", _extends({\n    parentName: \"svg\"\n  }, {\n    \"d\": \"M6.75 1L5 17\",\n    \"stroke\": \"#CBD5E0\",\n    \"strokeWidth\": \"2\",\n    \"strokeLineCap\": \"round\",\n    \"strokeLineJoin\": \"round\"\n  })), \"\\n      \", mdx(\"path\", _extends({\n    parentName: \"svg\"\n  }, {\n    \"d\": \"M12 1L10.25 17\",\n    \"stroke\": \"#CBD5E0\",\n    \"strokeWidth\": \"2\",\n    \"strokeLineCap\": \"round\",\n    \"strokeLineJoin\": \"round\"\n  })), \"\\n      \")), \"Build Flow\"), mdx(\"ol\", {\n    parentName: \"section\"\n  }, mdx(\"li\", {\n    parentName: \"ol\"\n  }, mdx(\"p\", {\n    parentName: \"li\"\n  }, \"The app layout is calculated\", mdx(\"br\", {\n    parentName: \"p\"\n  }), \"\\n\", \"We discover things like where the entrypoint is, if any, and where \", mdx(\"a\", _extends({\n    parentName: \"p\"\n  }, {\n    \"href\": \"/guides/project-layout?id=nexus-modules\"\n  }), \"Nexus modules\"), \" are, if any.\")), mdx(\"li\", {\n    parentName: \"ol\"\n  }, mdx(\"p\", {\n    parentName: \"li\"\n  }, \"Worktime plugins are loaded (see \", mdx(\"a\", _extends({\n    parentName: \"p\"\n  }, {\n    \"href\": \"#plugin-loading-flow\"\n  }), \"Plugin Loading Flow\"), \")\")), mdx(\"li\", {\n    parentName: \"ol\"\n  }, mdx(\"p\", {\n    parentName: \"li\"\n  }, \"Typegen is acquired\", mdx(\"br\", {\n    parentName: \"p\"\n  }), \"\\n\", \"This step is about processes that reflect upon the app's source code to extract type information that will be automatically used in other parts of the app. This approach is relatively novel among Node tools. There are dynamic and static processes. The static ones use the TypeScript compiler API while the dynamic ones literally run the app with node in a special reflective mode.\"), mdx(\"p\", {\n    parentName: \"li\"\n  }, \"Dynamic has the benefit of being able to produce types that IDE's can pick up for use in not just TypeScript but also JavaScript. It works for the schema typegen because the GraphQL Schema builders permit generating accurate derived TypeScript. Dynamic works regardless of the abstractions users through over them. On the downside, dynamic is riskier because runtime errors in the app can halt its completion. When the types to be generated are based upon arbitrary code, the task becomes one of effectively re-writing TypeScript and thus impractical.\"), mdx(\"p\", {\n    parentName: \"li\"\n  }, \"Static doesn't have to deal with the unpredictabilities of running an app and so has the benefit of being easier to reason about in a sense. It also has the benefit of extracting accurate type information using the native TS system whereas dynamic relies on building TS types from scratch. This makes static a fit for arbitrary code. On the downside, robust AST processing is hard work, and so, so far, static restricts how certain expressions can be written, otherwise AST traversal fails.\"), mdx(\"ol\", {\n    parentName: \"li\"\n  }, mdx(\"li\", {\n    parentName: \"ol\"\n  }, \"A start module is created in memory. It imports the entrypoint and all \", mdx(\"a\", _extends({\n    parentName: \"li\"\n  }, {\n    \"href\": \"/guides/project-layout?id=nexus-modules\"\n  }), \"Nexus modules\"), \". It registers an extension hook to transpile the TypeScript app on the fly as it is run. The transpilation uses the project's tsconfig but overrides target and module so that it is runnable by Node (10 and up). Specificaly es2015 target and commonjs module. For example if user had module of \", mdx(\"inlineCode\", {\n    parentName: \"li\"\n  }, \"esnext\"), \" the transpilation result would not be runnable by Node.\"), mdx(\"li\", {\n    parentName: \"ol\"\n  }, \"The start module is run in a sub-process for maximum isolation. (we're looking at running within workers \", mdx(\"a\", _extends({\n    parentName: \"li\"\n  }, {\n    \"href\": \"https://github.com/graphql-nexus/nexus/issues/752\"\n  }), \"#752\"), \")\"), mdx(\"li\", {\n    parentName: \"ol\"\n  }, \"In parallel, a TypeScript instance is created and the app source is statically analyzed to extract context types. This does not require running the app at all. TypeScript cache called tsbuildinfo is stored under \", mdx(\"inlineCode\", {\n    parentName: \"li\"\n  }, \"node_modules/.nexus\"), \".\"))), mdx(\"li\", {\n    parentName: \"ol\"\n  }, mdx(\"p\", {\n    parentName: \"li\"\n  }, \"A new TypeScript instance is created so that the types generated in the previous step are picked up by the checker. This should be faster because it reuses the TypeScript cache created in the previous step.\")), mdx(\"li\", {\n    parentName: \"ol\"\n  }, mdx(\"p\", {\n    parentName: \"li\"\n  }, \"The app is type checked\")), mdx(\"li\", {\n    parentName: \"ol\"\n  }, mdx(\"p\", {\n    parentName: \"li\"\n  }, \"The app is transpiled\")), mdx(\"li\", {\n    parentName: \"ol\"\n  }, mdx(\"p\", {\n    parentName: \"li\"\n  }, \"The app is emitted into \", mdx(\"inlineCode\", {\n    parentName: \"p\"\n  }, \".nexus/build\"), \". This convention keeps derived files in a well known generally ignored location.\")), mdx(\"li\", {\n    parentName: \"ol\"\n  }, mdx(\"p\", {\n    parentName: \"li\"\n  }, \"A production-oriented start module is generated differing in the following ways:\"), mdx(\"ul\", {\n    parentName: \"li\"\n  }, mdx(\"li\", {\n    parentName: \"ul\"\n  }, \"paths are relative\"), mdx(\"li\", {\n    parentName: \"ul\"\n  }, \"typescript not hooked into module extensions\"), mdx(\"li\", {\n    parentName: \"ul\"\n  }, \"plugins are imported for tree-shaking\"))))), mdx(\"section\", null, mdx(\"h2\", _extends({\n    parentName: \"section\"\n  }, {\n    \"id\": \"glossary-1\",\n    \"style\": {\n      \"position\": \"relative\"\n    }\n  }), mdx(\"a\", _extends({\n    parentName: \"h2\"\n  }, {\n    \"href\": \"#glossary-1\",\n    \"aria-label\": \"glossary 1 permalink\",\n    \"className\": \"title-link before\"\n  }), mdx(\"svg\", _extends({\n    parentName: \"a\"\n  }, {\n    \"width\": \"17\",\n    \"height\": \"18\",\n    \"viewBox\": \"0 0 17 18\",\n    \"fill\": \"none\",\n    \"xmlns\": \"http://www.w3.org/2000/svg\"\n  }), \"\\n      \", mdx(\"path\", _extends({\n    parentName: \"svg\"\n  }, {\n    \"d\": \"M1.5 6.33337H15.5\",\n    \"stroke\": \"#CBD5E0\",\n    \"strokeWidth\": \"2\",\n    \"strokeLineCap\": \"round\",\n    \"strokeLineJoin\": \"round\"\n  })), \"\\n      \", mdx(\"path\", _extends({\n    parentName: \"svg\"\n  }, {\n    \"d\": \"M1.5 11.6666H15.5\",\n    \"stroke\": \"#CBD5E0\",\n    \"strokeWidth\": \"2\",\n    \"strokeLineCap\": \"round\",\n    \"strokeLineJoin\": \"round\"\n  })), \"\\n      \", mdx(\"path\", _extends({\n    parentName: \"svg\"\n  }, {\n    \"d\": \"M6.75 1L5 17\",\n    \"stroke\": \"#CBD5E0\",\n    \"strokeWidth\": \"2\",\n    \"strokeLineCap\": \"round\",\n    \"strokeLineJoin\": \"round\"\n  })), \"\\n      \", mdx(\"path\", _extends({\n    parentName: \"svg\"\n  }, {\n    \"d\": \"M12 1L10.25 17\",\n    \"stroke\": \"#CBD5E0\",\n    \"strokeWidth\": \"2\",\n    \"strokeLineCap\": \"round\",\n    \"strokeLineJoin\": \"round\"\n  })), \"\\n      \")), \"Glossary\"), mdx(\"section\", {\n    parentName: \"section\"\n  }, mdx(\"h3\", _extends({\n    parentName: \"section\"\n  }, {\n    \"id\": \"assembly-1\",\n    \"style\": {\n      \"position\": \"relative\"\n    }\n  }), mdx(\"a\", _extends({\n    parentName: \"h3\"\n  }, {\n    \"href\": \"#assembly-1\",\n    \"aria-label\": \"assembly 1 permalink\",\n    \"className\": \"title-link before\"\n  }), mdx(\"svg\", _extends({\n    parentName: \"a\"\n  }, {\n    \"width\": \"17\",\n    \"height\": \"18\",\n    \"viewBox\": \"0 0 17 18\",\n    \"fill\": \"none\",\n    \"xmlns\": \"http://www.w3.org/2000/svg\"\n  }), \"\\n      \", mdx(\"path\", _extends({\n    parentName: \"svg\"\n  }, {\n    \"d\": \"M1.5 6.33337H15.5\",\n    \"stroke\": \"#CBD5E0\",\n    \"strokeWidth\": \"2\",\n    \"strokeLineCap\": \"round\",\n    \"strokeLineJoin\": \"round\"\n  })), \"\\n      \", mdx(\"path\", _extends({\n    parentName: \"svg\"\n  }, {\n    \"d\": \"M1.5 11.6666H15.5\",\n    \"stroke\": \"#CBD5E0\",\n    \"strokeWidth\": \"2\",\n    \"strokeLineCap\": \"round\",\n    \"strokeLineJoin\": \"round\"\n  })), \"\\n      \", mdx(\"path\", _extends({\n    parentName: \"svg\"\n  }, {\n    \"d\": \"M6.75 1L5 17\",\n    \"stroke\": \"#CBD5E0\",\n    \"strokeWidth\": \"2\",\n    \"strokeLineCap\": \"round\",\n    \"strokeLineJoin\": \"round\"\n  })), \"\\n      \", mdx(\"path\", _extends({\n    parentName: \"svg\"\n  }, {\n    \"d\": \"M12 1L10.25 17\",\n    \"stroke\": \"#CBD5E0\",\n    \"strokeWidth\": \"2\",\n    \"strokeLineCap\": \"round\",\n    \"strokeLineJoin\": \"round\"\n  })), \"\\n      \")), \"Assembly\"), mdx(\"p\", {\n    parentName: \"section\"\n  }, \"The process in which the app configuration (settings, schema type defs, used plugins, etc.) is processed into a runnable state. Nexus apps are only ever assembled once in their lifecycle.\")), mdx(\"section\", {\n    parentName: \"section\"\n  }, mdx(\"h3\", _extends({\n    parentName: \"section\"\n  }, {\n    \"id\": \"dynamic-reflection\",\n    \"style\": {\n      \"position\": \"relative\"\n    }\n  }), mdx(\"a\", _extends({\n    parentName: \"h3\"\n  }, {\n    \"href\": \"#dynamic-reflection\",\n    \"aria-label\": \"dynamic reflection permalink\",\n    \"className\": \"title-link before\"\n  }), mdx(\"svg\", _extends({\n    parentName: \"a\"\n  }, {\n    \"width\": \"17\",\n    \"height\": \"18\",\n    \"viewBox\": \"0 0 17 18\",\n    \"fill\": \"none\",\n    \"xmlns\": \"http://www.w3.org/2000/svg\"\n  }), \"\\n      \", mdx(\"path\", _extends({\n    parentName: \"svg\"\n  }, {\n    \"d\": \"M1.5 6.33337H15.5\",\n    \"stroke\": \"#CBD5E0\",\n    \"strokeWidth\": \"2\",\n    \"strokeLineCap\": \"round\",\n    \"strokeLineJoin\": \"round\"\n  })), \"\\n      \", mdx(\"path\", _extends({\n    parentName: \"svg\"\n  }, {\n    \"d\": \"M1.5 11.6666H15.5\",\n    \"stroke\": \"#CBD5E0\",\n    \"strokeWidth\": \"2\",\n    \"strokeLineCap\": \"round\",\n    \"strokeLineJoin\": \"round\"\n  })), \"\\n      \", mdx(\"path\", _extends({\n    parentName: \"svg\"\n  }, {\n    \"d\": \"M6.75 1L5 17\",\n    \"stroke\": \"#CBD5E0\",\n    \"strokeWidth\": \"2\",\n    \"strokeLineCap\": \"round\",\n    \"strokeLineJoin\": \"round\"\n  })), \"\\n      \", mdx(\"path\", _extends({\n    parentName: \"svg\"\n  }, {\n    \"d\": \"M12 1L10.25 17\",\n    \"stroke\": \"#CBD5E0\",\n    \"strokeWidth\": \"2\",\n    \"strokeLineCap\": \"round\",\n    \"strokeLineJoin\": \"round\"\n  })), \"\\n      \")), \"Dynamic Reflection\"), mdx(\"p\", {\n    parentName: \"section\"\n  }, \"The process in which the app is run in order to extract data out of it. The data in turn can be used for anything. For example typegen to provide better TypeScript types or GraphQL SDL generation.\")), mdx(\"section\", {\n    parentName: \"section\"\n  }, mdx(\"h3\", _extends({\n    parentName: \"section\"\n  }, {\n    \"id\": \"static-reflection\",\n    \"style\": {\n      \"position\": \"relative\"\n    }\n  }), mdx(\"a\", _extends({\n    parentName: \"h3\"\n  }, {\n    \"href\": \"#static-reflection\",\n    \"aria-label\": \"static reflection permalink\",\n    \"className\": \"title-link before\"\n  }), mdx(\"svg\", _extends({\n    parentName: \"a\"\n  }, {\n    \"width\": \"17\",\n    \"height\": \"18\",\n    \"viewBox\": \"0 0 17 18\",\n    \"fill\": \"none\",\n    \"xmlns\": \"http://www.w3.org/2000/svg\"\n  }), \"\\n      \", mdx(\"path\", _extends({\n    parentName: \"svg\"\n  }, {\n    \"d\": \"M1.5 6.33337H15.5\",\n    \"stroke\": \"#CBD5E0\",\n    \"strokeWidth\": \"2\",\n    \"strokeLineCap\": \"round\",\n    \"strokeLineJoin\": \"round\"\n  })), \"\\n      \", mdx(\"path\", _extends({\n    parentName: \"svg\"\n  }, {\n    \"d\": \"M1.5 11.6666H15.5\",\n    \"stroke\": \"#CBD5E0\",\n    \"strokeWidth\": \"2\",\n    \"strokeLineCap\": \"round\",\n    \"strokeLineJoin\": \"round\"\n  })), \"\\n      \", mdx(\"path\", _extends({\n    parentName: \"svg\"\n  }, {\n    \"d\": \"M6.75 1L5 17\",\n    \"stroke\": \"#CBD5E0\",\n    \"strokeWidth\": \"2\",\n    \"strokeLineCap\": \"round\",\n    \"strokeLineJoin\": \"round\"\n  })), \"\\n      \", mdx(\"path\", _extends({\n    parentName: \"svg\"\n  }, {\n    \"d\": \"M12 1L10.25 17\",\n    \"stroke\": \"#CBD5E0\",\n    \"strokeWidth\": \"2\",\n    \"strokeLineCap\": \"round\",\n    \"strokeLineJoin\": \"round\"\n  })), \"\\n      \")), \"Static Reflection\"), mdx(\"p\", {\n    parentName: \"section\"\n  }, \"The process in which the app is analyzed with the TS API to extract data out of it. The data in turn can be used for anything. For example typegen to provide better TypeScript types.\")), mdx(\"section\", {\n    parentName: \"section\"\n  }, mdx(\"h3\", _extends({\n    parentName: \"section\"\n  }, {\n    \"id\": \"reflection-1\",\n    \"style\": {\n      \"position\": \"relative\"\n    }\n  }), mdx(\"a\", _extends({\n    parentName: \"h3\"\n  }, {\n    \"href\": \"#reflection-1\",\n    \"aria-label\": \"reflection 1 permalink\",\n    \"className\": \"title-link before\"\n  }), mdx(\"svg\", _extends({\n    parentName: \"a\"\n  }, {\n    \"width\": \"17\",\n    \"height\": \"18\",\n    \"viewBox\": \"0 0 17 18\",\n    \"fill\": \"none\",\n    \"xmlns\": \"http://www.w3.org/2000/svg\"\n  }), \"\\n      \", mdx(\"path\", _extends({\n    parentName: \"svg\"\n  }, {\n    \"d\": \"M1.5 6.33337H15.5\",\n    \"stroke\": \"#CBD5E0\",\n    \"strokeWidth\": \"2\",\n    \"strokeLineCap\": \"round\",\n    \"strokeLineJoin\": \"round\"\n  })), \"\\n      \", mdx(\"path\", _extends({\n    parentName: \"svg\"\n  }, {\n    \"d\": \"M1.5 11.6666H15.5\",\n    \"stroke\": \"#CBD5E0\",\n    \"strokeWidth\": \"2\",\n    \"strokeLineCap\": \"round\",\n    \"strokeLineJoin\": \"round\"\n  })), \"\\n      \", mdx(\"path\", _extends({\n    parentName: \"svg\"\n  }, {\n    \"d\": \"M6.75 1L5 17\",\n    \"stroke\": \"#CBD5E0\",\n    \"strokeWidth\": \"2\",\n    \"strokeLineCap\": \"round\",\n    \"strokeLineJoin\": \"round\"\n  })), \"\\n      \", mdx(\"path\", _extends({\n    parentName: \"svg\"\n  }, {\n    \"d\": \"M12 1L10.25 17\",\n    \"stroke\": \"#CBD5E0\",\n    \"strokeWidth\": \"2\",\n    \"strokeLineCap\": \"round\",\n    \"strokeLineJoin\": \"round\"\n  })), \"\\n      \")), \"Reflection\"), mdx(\"p\", {\n    parentName: \"section\"\n  }, \"The general idea of the app source code or its state at runtime being analyzed to extract data.\"))));\n}\n;\nMDXContent.isMDXComponent = true;","parent":{"__typename":"File","relativePath":"05-meta/03-architecture.mdx"},"tableOfContents":{"items":[{"url":"#reflection","title":"Reflection"},{"url":"#assembly","title":"Assembly"},{"url":"#plugins","title":"Plugins","items":[{"url":"#diagrams","title":"Diagrams","items":[{"url":"#plugin-tree-shaking","title":"Plugin Tree Shaking"}]},{"url":"#glossary","title":"Glossary","items":[{"url":"#entrypoint","title":"Entrypoint"},{"url":"#manifest","title":"Manifest"},{"url":"#manifest-input","title":"Manifest Input"},{"url":"#dimension","title":"Dimension"},{"url":"#lens","title":"Lens"},{"url":"#dimension-entrypoint","title":"Dimension Entrypoint"}]},{"url":"#comparisons-to-other-systems","title":"Comparisons to Other Systems","items":[{"url":"#rollup","title":"Rollup"}]},{"url":"#loading-flow","title":"Loading Flow"}]},{"url":"#build-flow","title":"Build Flow"},{"url":"#glossary-1","title":"Glossary","items":[{"url":"#assembly-1","title":"Assembly"},{"url":"#dynamic-reflection","title":"Dynamic Reflection"},{"url":"#static-reflection","title":"Static Reflection"},{"url":"#reflection-1","title":"Reflection"}]}]},"frontmatter":{"title":"Architecture","metaTitle":"Architecture","metaDescription":null}}},"pageContext":{"id":"7fab57bd-bfe6-5594-84be-c859c8ead839","seoTitle":"Architecture","seoDescription":"Architecture"}}}