{"componentChunkName":"component---src-layouts-article-layout-tsx","path":"/guides/project-layout","result":{"data":{"site":{"siteMetadata":{"docsLocation":"https://github.com/graphql-nexus/docs/tree/master/content"}},"mdx":{"fields":{"slug":"/02-guides/06-project-layout"},"body":"function _extends() { _extends = Object.assign || function (target) { for (var i = 1; i < arguments.length; i++) { var source = arguments[i]; for (var key in source) { if (Object.prototype.hasOwnProperty.call(source, key)) { target[key] = source[key]; } } } return target; }; return _extends.apply(this, arguments); }\n\nfunction _objectWithoutProperties(source, excluded) { if (source == null) return {}; var target = _objectWithoutPropertiesLoose(source, excluded); var key, i; if (Object.getOwnPropertySymbols) { var sourceSymbolKeys = Object.getOwnPropertySymbols(source); for (i = 0; i < sourceSymbolKeys.length; i++) { key = sourceSymbolKeys[i]; if (excluded.indexOf(key) >= 0) continue; if (!Object.prototype.propertyIsEnumerable.call(source, key)) continue; target[key] = source[key]; } } return target; }\n\nfunction _objectWithoutPropertiesLoose(source, excluded) { if (source == null) return {}; var target = {}; var sourceKeys = Object.keys(source); var key, i; for (i = 0; i < sourceKeys.length; i++) { key = sourceKeys[i]; if (excluded.indexOf(key) >= 0) continue; target[key] = source[key]; } return target; }\n\n/* @jsx mdx */\nvar _frontmatter = {\n  \"title\": \"Project Layout\"\n};\n\nvar makeShortcode = function makeShortcode(name) {\n  return function MDXDefaultShortcode(props) {\n    console.warn(\"Component \" + name + \" was not imported, exported, or provided by MDXProvider as global scope\");\n    return mdx(\"div\", props);\n  };\n};\n\nvar layoutProps = {\n  _frontmatter: _frontmatter\n};\nvar MDXLayout = \"wrapper\";\nreturn function MDXContent(_ref) {\n  var components = _ref.components,\n      props = _objectWithoutProperties(_ref, [\"components\"]);\n\n  return mdx(MDXLayout, _extends({}, layoutProps, props, {\n    components: components,\n    mdxType: \"MDXLayout\"\n  }), mdx(\"section\", null, mdx(\"h2\", _extends({\n    parentName: \"section\"\n  }, {\n    \"id\": \"project-layout\",\n    \"style\": {\n      \"position\": \"relative\"\n    }\n  }), mdx(\"a\", _extends({\n    parentName: \"h2\"\n  }, {\n    \"href\": \"#project-layout\",\n    \"aria-label\": \"project layout permalink\",\n    \"className\": \"title-link before\"\n  }), mdx(\"svg\", _extends({\n    parentName: \"a\"\n  }, {\n    \"width\": \"17\",\n    \"height\": \"18\",\n    \"viewBox\": \"0 0 17 18\",\n    \"fill\": \"none\",\n    \"xmlns\": \"http://www.w3.org/2000/svg\"\n  }), \"\\n      \", mdx(\"path\", _extends({\n    parentName: \"svg\"\n  }, {\n    \"d\": \"M1.5 6.33337H15.5\",\n    \"stroke\": \"#CBD5E0\",\n    \"strokeWidth\": \"2\",\n    \"strokeLineCap\": \"round\",\n    \"strokeLineJoin\": \"round\"\n  })), \"\\n      \", mdx(\"path\", _extends({\n    parentName: \"svg\"\n  }, {\n    \"d\": \"M1.5 11.6666H15.5\",\n    \"stroke\": \"#CBD5E0\",\n    \"strokeWidth\": \"2\",\n    \"strokeLineCap\": \"round\",\n    \"strokeLineJoin\": \"round\"\n  })), \"\\n      \", mdx(\"path\", _extends({\n    parentName: \"svg\"\n  }, {\n    \"d\": \"M6.75 1L5 17\",\n    \"stroke\": \"#CBD5E0\",\n    \"strokeWidth\": \"2\",\n    \"strokeLineCap\": \"round\",\n    \"strokeLineJoin\": \"round\"\n  })), \"\\n      \", mdx(\"path\", _extends({\n    parentName: \"svg\"\n  }, {\n    \"d\": \"M12 1L10.25 17\",\n    \"stroke\": \"#CBD5E0\",\n    \"strokeWidth\": \"2\",\n    \"strokeLineCap\": \"round\",\n    \"strokeLineJoin\": \"round\"\n  })), \"\\n      \")), \"Project Layout\")), mdx(\"section\", null, mdx(\"h2\", _extends({\n    parentName: \"section\"\n  }, {\n    \"id\": \"working-with-tsconfigjson\",\n    \"style\": {\n      \"position\": \"relative\"\n    }\n  }), mdx(\"a\", _extends({\n    parentName: \"h2\"\n  }, {\n    \"href\": \"#working-with-tsconfigjson\",\n    \"aria-label\": \"working with tsconfigjson permalink\",\n    \"className\": \"title-link before\"\n  }), mdx(\"svg\", _extends({\n    parentName: \"a\"\n  }, {\n    \"width\": \"17\",\n    \"height\": \"18\",\n    \"viewBox\": \"0 0 17 18\",\n    \"fill\": \"none\",\n    \"xmlns\": \"http://www.w3.org/2000/svg\"\n  }), \"\\n      \", mdx(\"path\", _extends({\n    parentName: \"svg\"\n  }, {\n    \"d\": \"M1.5 6.33337H15.5\",\n    \"stroke\": \"#CBD5E0\",\n    \"strokeWidth\": \"2\",\n    \"strokeLineCap\": \"round\",\n    \"strokeLineJoin\": \"round\"\n  })), \"\\n      \", mdx(\"path\", _extends({\n    parentName: \"svg\"\n  }, {\n    \"d\": \"M1.5 11.6666H15.5\",\n    \"stroke\": \"#CBD5E0\",\n    \"strokeWidth\": \"2\",\n    \"strokeLineCap\": \"round\",\n    \"strokeLineJoin\": \"round\"\n  })), \"\\n      \", mdx(\"path\", _extends({\n    parentName: \"svg\"\n  }, {\n    \"d\": \"M6.75 1L5 17\",\n    \"stroke\": \"#CBD5E0\",\n    \"strokeWidth\": \"2\",\n    \"strokeLineCap\": \"round\",\n    \"strokeLineJoin\": \"round\"\n  })), \"\\n      \", mdx(\"path\", _extends({\n    parentName: \"svg\"\n  }, {\n    \"d\": \"M12 1L10.25 17\",\n    \"stroke\": \"#CBD5E0\",\n    \"strokeWidth\": \"2\",\n    \"strokeLineCap\": \"round\",\n    \"strokeLineJoin\": \"round\"\n  })), \"\\n      \")), \"Working With tsconfig.json\"), mdx(\"ul\", {\n    parentName: \"section\"\n  }, mdx(\"li\", {\n    parentName: \"ul\"\n  }, \"Nexus honours settings within \", mdx(\"inlineCode\", {\n    parentName: \"li\"\n  }, \"tsconfig.json\"), \".\"), mdx(\"li\", {\n    parentName: \"ul\"\n  }, \"This ensures that Nexus and your IDE perform identical static analysis.\"), mdx(\"li\", {\n    parentName: \"ul\"\n  }, \"If no \", mdx(\"inlineCode\", {\n    parentName: \"li\"\n  }, \"tsconfig.json\"), \" is present then Nexus will scaffold one for you.\"), mdx(\"li\", {\n    parentName: \"ul\"\n  }, \"Nexus interacts with \", mdx(\"inlineCode\", {\n    parentName: \"li\"\n  }, \"tsconfig.json\"), \" in the following ways.\")), mdx(\"section\", {\n    parentName: \"section\"\n  }, mdx(\"h3\", _extends({\n    parentName: \"section\"\n  }, {\n    \"id\": \"project-root\",\n    \"style\": {\n      \"position\": \"relative\"\n    }\n  }), mdx(\"a\", _extends({\n    parentName: \"h3\"\n  }, {\n    \"href\": \"#project-root\",\n    \"aria-label\": \"project root permalink\",\n    \"className\": \"title-link before\"\n  }), mdx(\"svg\", _extends({\n    parentName: \"a\"\n  }, {\n    \"width\": \"17\",\n    \"height\": \"18\",\n    \"viewBox\": \"0 0 17 18\",\n    \"fill\": \"none\",\n    \"xmlns\": \"http://www.w3.org/2000/svg\"\n  }), \"\\n      \", mdx(\"path\", _extends({\n    parentName: \"svg\"\n  }, {\n    \"d\": \"M1.5 6.33337H15.5\",\n    \"stroke\": \"#CBD5E0\",\n    \"strokeWidth\": \"2\",\n    \"strokeLineCap\": \"round\",\n    \"strokeLineJoin\": \"round\"\n  })), \"\\n      \", mdx(\"path\", _extends({\n    parentName: \"svg\"\n  }, {\n    \"d\": \"M1.5 11.6666H15.5\",\n    \"stroke\": \"#CBD5E0\",\n    \"strokeWidth\": \"2\",\n    \"strokeLineCap\": \"round\",\n    \"strokeLineJoin\": \"round\"\n  })), \"\\n      \", mdx(\"path\", _extends({\n    parentName: \"svg\"\n  }, {\n    \"d\": \"M6.75 1L5 17\",\n    \"stroke\": \"#CBD5E0\",\n    \"strokeWidth\": \"2\",\n    \"strokeLineCap\": \"round\",\n    \"strokeLineJoin\": \"round\"\n  })), \"\\n      \", mdx(\"path\", _extends({\n    parentName: \"svg\"\n  }, {\n    \"d\": \"M12 1L10.25 17\",\n    \"stroke\": \"#CBD5E0\",\n    \"strokeWidth\": \"2\",\n    \"strokeLineCap\": \"round\",\n    \"strokeLineJoin\": \"round\"\n  })), \"\\n      \")), \"Project Root\"), mdx(\"ul\", {\n    parentName: \"section\"\n  }, mdx(\"li\", {\n    parentName: \"ul\"\n  }, \"Project Root is the CWD (current working directory) for all CLI invocatons.\"), mdx(\"li\", {\n    parentName: \"ul\"\n  }, \"Nexus (\", mdx(\"a\", _extends({\n    parentName: \"li\"\n  }, {\n    \"href\": \"https://vscode.readthedocs.io/en/latest/languages/typescript/#typescript-files-and-projects\"\n  }), \"like VSCode\"), \") considers the folder containing a \", mdx(\"inlineCode\", {\n    parentName: \"li\"\n  }, \"tsconfig.json\"), \" to be the project root.\"))), mdx(\"section\", {\n    parentName: \"section\"\n  }, mdx(\"h3\", _extends({\n    parentName: \"section\"\n  }, {\n    \"id\": \"source-root\",\n    \"style\": {\n      \"position\": \"relative\"\n    }\n  }), mdx(\"a\", _extends({\n    parentName: \"h3\"\n  }, {\n    \"href\": \"#source-root\",\n    \"aria-label\": \"source root permalink\",\n    \"className\": \"title-link before\"\n  }), mdx(\"svg\", _extends({\n    parentName: \"a\"\n  }, {\n    \"width\": \"17\",\n    \"height\": \"18\",\n    \"viewBox\": \"0 0 17 18\",\n    \"fill\": \"none\",\n    \"xmlns\": \"http://www.w3.org/2000/svg\"\n  }), \"\\n      \", mdx(\"path\", _extends({\n    parentName: \"svg\"\n  }, {\n    \"d\": \"M1.5 6.33337H15.5\",\n    \"stroke\": \"#CBD5E0\",\n    \"strokeWidth\": \"2\",\n    \"strokeLineCap\": \"round\",\n    \"strokeLineJoin\": \"round\"\n  })), \"\\n      \", mdx(\"path\", _extends({\n    parentName: \"svg\"\n  }, {\n    \"d\": \"M1.5 11.6666H15.5\",\n    \"stroke\": \"#CBD5E0\",\n    \"strokeWidth\": \"2\",\n    \"strokeLineCap\": \"round\",\n    \"strokeLineJoin\": \"round\"\n  })), \"\\n      \", mdx(\"path\", _extends({\n    parentName: \"svg\"\n  }, {\n    \"d\": \"M6.75 1L5 17\",\n    \"stroke\": \"#CBD5E0\",\n    \"strokeWidth\": \"2\",\n    \"strokeLineCap\": \"round\",\n    \"strokeLineJoin\": \"round\"\n  })), \"\\n      \", mdx(\"path\", _extends({\n    parentName: \"svg\"\n  }, {\n    \"d\": \"M12 1L10.25 17\",\n    \"stroke\": \"#CBD5E0\",\n    \"strokeWidth\": \"2\",\n    \"strokeLineCap\": \"round\",\n    \"strokeLineJoin\": \"round\"\n  })), \"\\n      \")), \"Source Root\"), mdx(\"ul\", {\n    parentName: \"section\"\n  }, mdx(\"li\", {\n    parentName: \"ul\"\n  }, \"Source Root is the base from which your source code layout starts. So, all of your app code must live within the source root. Your JavaScript build output layout will mirror it.\"), mdx(\"li\", {\n    parentName: \"ul\"\n  }, \"Source Root is defined by setting \", mdx(\"inlineCode\", {\n    parentName: \"li\"\n  }, \"compilerOptions.rootDir\"), \" and adding its value also to the \", mdx(\"inlineCode\", {\n    parentName: \"li\"\n  }, \"includes\"), \" array. For detail into why it works like this see \", mdx(\"a\", _extends({\n    parentName: \"li\"\n  }, {\n    \"href\": \"https://github.com/microsoft/TypeScript/issues/9858#issuecomment-533287263\"\n  }), \"microsoft/TypeScript#9858\"), \" and this \", mdx(\"a\", _extends({\n    parentName: \"li\"\n  }, {\n    \"href\": \"https://stackoverflow.com/questions/57333825/can-you-pull-in-excludes-includes-options-in-typescript-compiler-api\"\n  }), \"StackOverflow answer\"), \".\"), mdx(\"li\", {\n    parentName: \"ul\"\n  }, \"If you do not specify it then Nexus will scaffold its value for you. It will default to being the same directory as where \", mdx(\"inlineCode\", {\n    parentName: \"li\"\n  }, \"tsconfig.json\"), \" resides. In other words, project root. This default mirrors \", mdx(\"inlineCode\", {\n    parentName: \"li\"\n  }, \"tsc\"), \" default behaviour. The \", mdx(\"inlineCode\", {\n    parentName: \"li\"\n  }, \"includes\"), \" array will be scaffolded as well.\"), mdx(\"li\", {\n    parentName: \"ul\"\n  }, \"Nexus requires that the \", mdx(\"inlineCode\", {\n    parentName: \"li\"\n  }, \"includes\"), \" array does not contain modules outside the source root. This mirrors \", mdx(\"inlineCode\", {\n    parentName: \"li\"\n  }, \"tsc\"), \".\"))), mdx(\"section\", {\n    parentName: \"section\"\n  }, mdx(\"h3\", _extends({\n    parentName: \"section\"\n  }, {\n    \"id\": \"out-root\",\n    \"style\": {\n      \"position\": \"relative\"\n    }\n  }), mdx(\"a\", _extends({\n    parentName: \"h3\"\n  }, {\n    \"href\": \"#out-root\",\n    \"aria-label\": \"out root permalink\",\n    \"className\": \"title-link before\"\n  }), mdx(\"svg\", _extends({\n    parentName: \"a\"\n  }, {\n    \"width\": \"17\",\n    \"height\": \"18\",\n    \"viewBox\": \"0 0 17 18\",\n    \"fill\": \"none\",\n    \"xmlns\": \"http://www.w3.org/2000/svg\"\n  }), \"\\n      \", mdx(\"path\", _extends({\n    parentName: \"svg\"\n  }, {\n    \"d\": \"M1.5 6.33337H15.5\",\n    \"stroke\": \"#CBD5E0\",\n    \"strokeWidth\": \"2\",\n    \"strokeLineCap\": \"round\",\n    \"strokeLineJoin\": \"round\"\n  })), \"\\n      \", mdx(\"path\", _extends({\n    parentName: \"svg\"\n  }, {\n    \"d\": \"M1.5 11.6666H15.5\",\n    \"stroke\": \"#CBD5E0\",\n    \"strokeWidth\": \"2\",\n    \"strokeLineCap\": \"round\",\n    \"strokeLineJoin\": \"round\"\n  })), \"\\n      \", mdx(\"path\", _extends({\n    parentName: \"svg\"\n  }, {\n    \"d\": \"M6.75 1L5 17\",\n    \"stroke\": \"#CBD5E0\",\n    \"strokeWidth\": \"2\",\n    \"strokeLineCap\": \"round\",\n    \"strokeLineJoin\": \"round\"\n  })), \"\\n      \", mdx(\"path\", _extends({\n    parentName: \"svg\"\n  }, {\n    \"d\": \"M12 1L10.25 17\",\n    \"stroke\": \"#CBD5E0\",\n    \"strokeWidth\": \"2\",\n    \"strokeLineCap\": \"round\",\n    \"strokeLineJoin\": \"round\"\n  })), \"\\n      \")), \"Out Root\"), mdx(\"ul\", {\n    parentName: \"section\"\n  }, mdx(\"li\", {\n    parentName: \"ul\"\n  }, \"Out Root is the place where the transpiled TypeScript (to JavaScript) modules will be emitted to. The folder structure mimicks that of the source root.\"), mdx(\"li\", {\n    parentName: \"ul\"\n  }, \"Out Root is defined by setting \", mdx(\"inlineCode\", {\n    parentName: \"li\"\n  }, \"compilerOptions.outDir\"), \".\"), mdx(\"li\", {\n    parentName: \"ul\"\n  }, \"If you do not specify it then Nexus will default to \", mdx(\"inlineCode\", {\n    parentName: \"li\"\n  }, \".nexus/build\"), \". Unlike with \", mdx(\"inlineCode\", {\n    parentName: \"li\"\n  }, \"rootDir\"), \" Nexus will not scaffold the default into your \", mdx(\"inlineCode\", {\n    parentName: \"li\"\n  }, \"tsconfig.json\"), \" because its presence has no impact upon VSCode.\"), mdx(\"li\", {\n    parentName: \"ul\"\n  }, \"You can override its value interactively with \", mdx(\"inlineCode\", {\n    parentName: \"li\"\n  }, \"nexus build --out\"), \".\"))), mdx(\"section\", {\n    parentName: \"section\"\n  }, mdx(\"h3\", _extends({\n    parentName: \"section\"\n  }, {\n    \"id\": \"check-only-builds\",\n    \"style\": {\n      \"position\": \"relative\"\n    }\n  }), mdx(\"a\", _extends({\n    parentName: \"h3\"\n  }, {\n    \"href\": \"#check-only-builds\",\n    \"aria-label\": \"check only builds permalink\",\n    \"className\": \"title-link before\"\n  }), mdx(\"svg\", _extends({\n    parentName: \"a\"\n  }, {\n    \"width\": \"17\",\n    \"height\": \"18\",\n    \"viewBox\": \"0 0 17 18\",\n    \"fill\": \"none\",\n    \"xmlns\": \"http://www.w3.org/2000/svg\"\n  }), \"\\n      \", mdx(\"path\", _extends({\n    parentName: \"svg\"\n  }, {\n    \"d\": \"M1.5 6.33337H15.5\",\n    \"stroke\": \"#CBD5E0\",\n    \"strokeWidth\": \"2\",\n    \"strokeLineCap\": \"round\",\n    \"strokeLineJoin\": \"round\"\n  })), \"\\n      \", mdx(\"path\", _extends({\n    parentName: \"svg\"\n  }, {\n    \"d\": \"M1.5 11.6666H15.5\",\n    \"stroke\": \"#CBD5E0\",\n    \"strokeWidth\": \"2\",\n    \"strokeLineCap\": \"round\",\n    \"strokeLineJoin\": \"round\"\n  })), \"\\n      \", mdx(\"path\", _extends({\n    parentName: \"svg\"\n  }, {\n    \"d\": \"M6.75 1L5 17\",\n    \"stroke\": \"#CBD5E0\",\n    \"strokeWidth\": \"2\",\n    \"strokeLineCap\": \"round\",\n    \"strokeLineJoin\": \"round\"\n  })), \"\\n      \", mdx(\"path\", _extends({\n    parentName: \"svg\"\n  }, {\n    \"d\": \"M12 1L10.25 17\",\n    \"stroke\": \"#CBD5E0\",\n    \"strokeWidth\": \"2\",\n    \"strokeLineCap\": \"round\",\n    \"strokeLineJoin\": \"round\"\n  })), \"\\n      \")), \"Check-Only Builds\"), mdx(\"p\", {\n    parentName: \"section\"\n  }, \"if \", mdx(\"inlineCode\", {\n    parentName: \"p\"\n  }, \"compilerOptions.noEmit\"), \" is set to \", mdx(\"inlineCode\", {\n    parentName: \"p\"\n  }, \"true\"), \" then Nexus will not output the build. This makes \", mdx(\"inlineCode\", {\n    parentName: \"p\"\n  }, \"nexus build\"), \" effectively a checker. This option usually \", mdx(\"a\", _extends({\n    parentName: \"p\"\n  }, {\n    \"href\": \"https://github.com/graphql-nexus/nexus/issues/702\"\n  }), \"represents user error\"), \" so by default Nexus will warn when this option is used. In the future (\", mdx(\"a\", _extends({\n    parentName: \"p\"\n  }, {\n    \"href\": \"https://github.com/graphql-nexus/nexus/issues/800\"\n  }), \"#800\"), \") there will be ways to disable this the warning if it is really your intent.\")), mdx(\"section\", {\n    parentName: \"section\"\n  }, mdx(\"h3\", _extends({\n    parentName: \"section\"\n  }, {\n    \"id\": \"typescript-language-service-plugin\",\n    \"style\": {\n      \"position\": \"relative\"\n    }\n  }), mdx(\"a\", _extends({\n    parentName: \"h3\"\n  }, {\n    \"href\": \"#typescript-language-service-plugin\",\n    \"aria-label\": \"typescript language service plugin permalink\",\n    \"className\": \"title-link before\"\n  }), mdx(\"svg\", _extends({\n    parentName: \"a\"\n  }, {\n    \"width\": \"17\",\n    \"height\": \"18\",\n    \"viewBox\": \"0 0 17 18\",\n    \"fill\": \"none\",\n    \"xmlns\": \"http://www.w3.org/2000/svg\"\n  }), \"\\n      \", mdx(\"path\", _extends({\n    parentName: \"svg\"\n  }, {\n    \"d\": \"M1.5 6.33337H15.5\",\n    \"stroke\": \"#CBD5E0\",\n    \"strokeWidth\": \"2\",\n    \"strokeLineCap\": \"round\",\n    \"strokeLineJoin\": \"round\"\n  })), \"\\n      \", mdx(\"path\", _extends({\n    parentName: \"svg\"\n  }, {\n    \"d\": \"M1.5 11.6666H15.5\",\n    \"stroke\": \"#CBD5E0\",\n    \"strokeWidth\": \"2\",\n    \"strokeLineCap\": \"round\",\n    \"strokeLineJoin\": \"round\"\n  })), \"\\n      \", mdx(\"path\", _extends({\n    parentName: \"svg\"\n  }, {\n    \"d\": \"M6.75 1L5 17\",\n    \"stroke\": \"#CBD5E0\",\n    \"strokeWidth\": \"2\",\n    \"strokeLineCap\": \"round\",\n    \"strokeLineJoin\": \"round\"\n  })), \"\\n      \", mdx(\"path\", _extends({\n    parentName: \"svg\"\n  }, {\n    \"d\": \"M12 1L10.25 17\",\n    \"stroke\": \"#CBD5E0\",\n    \"strokeWidth\": \"2\",\n    \"strokeLineCap\": \"round\",\n    \"strokeLineJoin\": \"round\"\n  })), \"\\n      \")), \"TypeScript Language Service Plugin\"), mdx(\"p\", {\n    parentName: \"section\"\n  }, \"Nexus ships with a TypeScript Language Service Plugin. It currently helps with improved autocomplete experience. In the future it will do more. Nexus will check that you are using it correctly in dev mode. You can see an example of its effect below.\"), mdx(\"p\", {\n    parentName: \"section\"\n  }, \"Autocomplete without Nexus TS LSP:\"), mdx(\"p\", {\n    parentName: \"section\"\n  }, mdx(\"img\", _extends({\n    parentName: \"p\"\n  }, {\n    \"src\": \"https://user-images.githubusercontent.com/284476/82776800-1bbe0e00-9e1a-11ea-83a1-eb175b11a2ca.png\",\n    \"alt\": null\n  }))), mdx(\"p\", {\n    parentName: \"section\"\n  }, \"Autocomplete with Nexus TS LSP:\"), mdx(\"p\", {\n    parentName: \"section\"\n  }, mdx(\"img\", _extends({\n    parentName: \"p\"\n  }, {\n    \"src\": \"https://user-images.githubusercontent.com/284476/82776802-1cef3b00-9e1a-11ea-88c3-065869407380.png\",\n    \"alt\": null\n  }))))), mdx(\"section\", null, mdx(\"h2\", _extends({\n    parentName: \"section\"\n  }, {\n    \"id\": \"conventions\",\n    \"style\": {\n      \"position\": \"relative\"\n    }\n  }), mdx(\"a\", _extends({\n    parentName: \"h2\"\n  }, {\n    \"href\": \"#conventions\",\n    \"aria-label\": \"conventions permalink\",\n    \"className\": \"title-link before\"\n  }), mdx(\"svg\", _extends({\n    parentName: \"a\"\n  }, {\n    \"width\": \"17\",\n    \"height\": \"18\",\n    \"viewBox\": \"0 0 17 18\",\n    \"fill\": \"none\",\n    \"xmlns\": \"http://www.w3.org/2000/svg\"\n  }), \"\\n      \", mdx(\"path\", _extends({\n    parentName: \"svg\"\n  }, {\n    \"d\": \"M1.5 6.33337H15.5\",\n    \"stroke\": \"#CBD5E0\",\n    \"strokeWidth\": \"2\",\n    \"strokeLineCap\": \"round\",\n    \"strokeLineJoin\": \"round\"\n  })), \"\\n      \", mdx(\"path\", _extends({\n    parentName: \"svg\"\n  }, {\n    \"d\": \"M1.5 11.6666H15.5\",\n    \"stroke\": \"#CBD5E0\",\n    \"strokeWidth\": \"2\",\n    \"strokeLineCap\": \"round\",\n    \"strokeLineJoin\": \"round\"\n  })), \"\\n      \", mdx(\"path\", _extends({\n    parentName: \"svg\"\n  }, {\n    \"d\": \"M6.75 1L5 17\",\n    \"stroke\": \"#CBD5E0\",\n    \"strokeWidth\": \"2\",\n    \"strokeLineCap\": \"round\",\n    \"strokeLineJoin\": \"round\"\n  })), \"\\n      \", mdx(\"path\", _extends({\n    parentName: \"svg\"\n  }, {\n    \"d\": \"M12 1L10.25 17\",\n    \"stroke\": \"#CBD5E0\",\n    \"strokeWidth\": \"2\",\n    \"strokeLineCap\": \"round\",\n    \"strokeLineJoin\": \"round\"\n  })), \"\\n      \")), \"Conventions\"), mdx(\"p\", {\n    parentName: \"section\"\n  }, \"Nexus imposes a few requirements about how you structure your codebase.\"), mdx(\"section\", {\n    parentName: \"section\"\n  }, mdx(\"h3\", _extends({\n    parentName: \"section\"\n  }, {\n    \"id\": \"nexus-modules\",\n    \"style\": {\n      \"position\": \"relative\"\n    }\n  }), mdx(\"a\", _extends({\n    parentName: \"h3\"\n  }, {\n    \"href\": \"#nexus-modules\",\n    \"aria-label\": \"nexus modules permalink\",\n    \"className\": \"title-link before\"\n  }), mdx(\"svg\", _extends({\n    parentName: \"a\"\n  }, {\n    \"width\": \"17\",\n    \"height\": \"18\",\n    \"viewBox\": \"0 0 17 18\",\n    \"fill\": \"none\",\n    \"xmlns\": \"http://www.w3.org/2000/svg\"\n  }), \"\\n      \", mdx(\"path\", _extends({\n    parentName: \"svg\"\n  }, {\n    \"d\": \"M1.5 6.33337H15.5\",\n    \"stroke\": \"#CBD5E0\",\n    \"strokeWidth\": \"2\",\n    \"strokeLineCap\": \"round\",\n    \"strokeLineJoin\": \"round\"\n  })), \"\\n      \", mdx(\"path\", _extends({\n    parentName: \"svg\"\n  }, {\n    \"d\": \"M1.5 11.6666H15.5\",\n    \"stroke\": \"#CBD5E0\",\n    \"strokeWidth\": \"2\",\n    \"strokeLineCap\": \"round\",\n    \"strokeLineJoin\": \"round\"\n  })), \"\\n      \", mdx(\"path\", _extends({\n    parentName: \"svg\"\n  }, {\n    \"d\": \"M6.75 1L5 17\",\n    \"stroke\": \"#CBD5E0\",\n    \"strokeWidth\": \"2\",\n    \"strokeLineCap\": \"round\",\n    \"strokeLineJoin\": \"round\"\n  })), \"\\n      \", mdx(\"path\", _extends({\n    parentName: \"svg\"\n  }, {\n    \"d\": \"M12 1L10.25 17\",\n    \"stroke\": \"#CBD5E0\",\n    \"strokeWidth\": \"2\",\n    \"strokeLineCap\": \"round\",\n    \"strokeLineJoin\": \"round\"\n  })), \"\\n      \")), \"Nexus module(s)\"), mdx(\"section\", {\n    parentName: \"section\"\n  }, mdx(\"h4\", _extends({\n    parentName: \"section\"\n  }, {\n    \"id\": \"pattern\",\n    \"style\": {\n      \"position\": \"relative\"\n    }\n  }), mdx(\"a\", _extends({\n    parentName: \"h4\"\n  }, {\n    \"href\": \"#pattern\",\n    \"aria-label\": \"pattern permalink\",\n    \"className\": \"title-link before\"\n  }), mdx(\"svg\", _extends({\n    parentName: \"a\"\n  }, {\n    \"width\": \"17\",\n    \"height\": \"18\",\n    \"viewBox\": \"0 0 17 18\",\n    \"fill\": \"none\",\n    \"xmlns\": \"http://www.w3.org/2000/svg\"\n  }), \"\\n      \", mdx(\"path\", _extends({\n    parentName: \"svg\"\n  }, {\n    \"d\": \"M1.5 6.33337H15.5\",\n    \"stroke\": \"#CBD5E0\",\n    \"strokeWidth\": \"2\",\n    \"strokeLineCap\": \"round\",\n    \"strokeLineJoin\": \"round\"\n  })), \"\\n      \", mdx(\"path\", _extends({\n    parentName: \"svg\"\n  }, {\n    \"d\": \"M1.5 11.6666H15.5\",\n    \"stroke\": \"#CBD5E0\",\n    \"strokeWidth\": \"2\",\n    \"strokeLineCap\": \"round\",\n    \"strokeLineJoin\": \"round\"\n  })), \"\\n      \", mdx(\"path\", _extends({\n    parentName: \"svg\"\n  }, {\n    \"d\": \"M6.75 1L5 17\",\n    \"stroke\": \"#CBD5E0\",\n    \"strokeWidth\": \"2\",\n    \"strokeLineCap\": \"round\",\n    \"strokeLineJoin\": \"round\"\n  })), \"\\n      \", mdx(\"path\", _extends({\n    parentName: \"svg\"\n  }, {\n    \"d\": \"M12 1L10.25 17\",\n    \"stroke\": \"#CBD5E0\",\n    \"strokeWidth\": \"2\",\n    \"strokeLineCap\": \"round\",\n    \"strokeLineJoin\": \"round\"\n  })), \"\\n      \")), \"Pattern\"), mdx(\"p\", {\n    parentName: \"section\"\n  }, \"A file importing \", mdx(\"inlineCode\", {\n    parentName: \"p\"\n  }, \"nexus\"), \". eg: \", mdx(\"inlineCode\", {\n    parentName: \"p\"\n  }, \"import { schema } from 'nexus'\"))), mdx(\"section\", {\n    parentName: \"section\"\n  }, mdx(\"h4\", _extends({\n    parentName: \"section\"\n  }, {\n    \"id\": \"about\",\n    \"style\": {\n      \"position\": \"relative\"\n    }\n  }), mdx(\"a\", _extends({\n    parentName: \"h4\"\n  }, {\n    \"href\": \"#about\",\n    \"aria-label\": \"about permalink\",\n    \"className\": \"title-link before\"\n  }), mdx(\"svg\", _extends({\n    parentName: \"a\"\n  }, {\n    \"width\": \"17\",\n    \"height\": \"18\",\n    \"viewBox\": \"0 0 17 18\",\n    \"fill\": \"none\",\n    \"xmlns\": \"http://www.w3.org/2000/svg\"\n  }), \"\\n      \", mdx(\"path\", _extends({\n    parentName: \"svg\"\n  }, {\n    \"d\": \"M1.5 6.33337H15.5\",\n    \"stroke\": \"#CBD5E0\",\n    \"strokeWidth\": \"2\",\n    \"strokeLineCap\": \"round\",\n    \"strokeLineJoin\": \"round\"\n  })), \"\\n      \", mdx(\"path\", _extends({\n    parentName: \"svg\"\n  }, {\n    \"d\": \"M1.5 11.6666H15.5\",\n    \"stroke\": \"#CBD5E0\",\n    \"strokeWidth\": \"2\",\n    \"strokeLineCap\": \"round\",\n    \"strokeLineJoin\": \"round\"\n  })), \"\\n      \", mdx(\"path\", _extends({\n    parentName: \"svg\"\n  }, {\n    \"d\": \"M6.75 1L5 17\",\n    \"stroke\": \"#CBD5E0\",\n    \"strokeWidth\": \"2\",\n    \"strokeLineCap\": \"round\",\n    \"strokeLineJoin\": \"round\"\n  })), \"\\n      \", mdx(\"path\", _extends({\n    parentName: \"svg\"\n  }, {\n    \"d\": \"M12 1L10.25 17\",\n    \"stroke\": \"#CBD5E0\",\n    \"strokeWidth\": \"2\",\n    \"strokeLineCap\": \"round\",\n    \"strokeLineJoin\": \"round\"\n  })), \"\\n      \")), \"About\"), mdx(\"p\", {\n    parentName: \"section\"\n  }, \"Nexus looks for modules that import \", mdx(\"inlineCode\", {\n    parentName: \"p\"\n  }, \"nexus\"), \" and uses codegen to statically import them before the server starts.\"), mdx(\"p\", {\n    parentName: \"section\"\n  }, \"Beware if you have module-level side-effects coming from something else than Nexus, as these side-effects will always be run when your app starts.\"), mdx(\"blockquote\", {\n    parentName: \"section\"\n  }, mdx(\"p\", {\n    parentName: \"blockquote\"\n  }, \"*\", \"Note: \", mdx(\"inlineCode\", {\n    parentName: \"p\"\n  }, \"require\"), \" is not supported.\")))), mdx(\"section\", {\n    parentName: \"section\"\n  }, mdx(\"h3\", _extends({\n    parentName: \"section\"\n  }, {\n    \"id\": \"entrypoint\",\n    \"style\": {\n      \"position\": \"relative\"\n    }\n  }), mdx(\"a\", _extends({\n    parentName: \"h3\"\n  }, {\n    \"href\": \"#entrypoint\",\n    \"aria-label\": \"entrypoint permalink\",\n    \"className\": \"title-link before\"\n  }), mdx(\"svg\", _extends({\n    parentName: \"a\"\n  }, {\n    \"width\": \"17\",\n    \"height\": \"18\",\n    \"viewBox\": \"0 0 17 18\",\n    \"fill\": \"none\",\n    \"xmlns\": \"http://www.w3.org/2000/svg\"\n  }), \"\\n      \", mdx(\"path\", _extends({\n    parentName: \"svg\"\n  }, {\n    \"d\": \"M1.5 6.33337H15.5\",\n    \"stroke\": \"#CBD5E0\",\n    \"strokeWidth\": \"2\",\n    \"strokeLineCap\": \"round\",\n    \"strokeLineJoin\": \"round\"\n  })), \"\\n      \", mdx(\"path\", _extends({\n    parentName: \"svg\"\n  }, {\n    \"d\": \"M1.5 11.6666H15.5\",\n    \"stroke\": \"#CBD5E0\",\n    \"strokeWidth\": \"2\",\n    \"strokeLineCap\": \"round\",\n    \"strokeLineJoin\": \"round\"\n  })), \"\\n      \", mdx(\"path\", _extends({\n    parentName: \"svg\"\n  }, {\n    \"d\": \"M6.75 1L5 17\",\n    \"stroke\": \"#CBD5E0\",\n    \"strokeWidth\": \"2\",\n    \"strokeLineCap\": \"round\",\n    \"strokeLineJoin\": \"round\"\n  })), \"\\n      \", mdx(\"path\", _extends({\n    parentName: \"svg\"\n  }, {\n    \"d\": \"M12 1L10.25 17\",\n    \"stroke\": \"#CBD5E0\",\n    \"strokeWidth\": \"2\",\n    \"strokeLineCap\": \"round\",\n    \"strokeLineJoin\": \"round\"\n  })), \"\\n      \")), \"Entrypoint\"), mdx(\"section\", {\n    parentName: \"section\"\n  }, mdx(\"h4\", _extends({\n    parentName: \"section\"\n  }, {\n    \"id\": \"pattern-1\",\n    \"style\": {\n      \"position\": \"relative\"\n    }\n  }), mdx(\"a\", _extends({\n    parentName: \"h4\"\n  }, {\n    \"href\": \"#pattern-1\",\n    \"aria-label\": \"pattern 1 permalink\",\n    \"className\": \"title-link before\"\n  }), mdx(\"svg\", _extends({\n    parentName: \"a\"\n  }, {\n    \"width\": \"17\",\n    \"height\": \"18\",\n    \"viewBox\": \"0 0 17 18\",\n    \"fill\": \"none\",\n    \"xmlns\": \"http://www.w3.org/2000/svg\"\n  }), \"\\n      \", mdx(\"path\", _extends({\n    parentName: \"svg\"\n  }, {\n    \"d\": \"M1.5 6.33337H15.5\",\n    \"stroke\": \"#CBD5E0\",\n    \"strokeWidth\": \"2\",\n    \"strokeLineCap\": \"round\",\n    \"strokeLineJoin\": \"round\"\n  })), \"\\n      \", mdx(\"path\", _extends({\n    parentName: \"svg\"\n  }, {\n    \"d\": \"M1.5 11.6666H15.5\",\n    \"stroke\": \"#CBD5E0\",\n    \"strokeWidth\": \"2\",\n    \"strokeLineCap\": \"round\",\n    \"strokeLineJoin\": \"round\"\n  })), \"\\n      \", mdx(\"path\", _extends({\n    parentName: \"svg\"\n  }, {\n    \"d\": \"M6.75 1L5 17\",\n    \"stroke\": \"#CBD5E0\",\n    \"strokeWidth\": \"2\",\n    \"strokeLineCap\": \"round\",\n    \"strokeLineJoin\": \"round\"\n  })), \"\\n      \", mdx(\"path\", _extends({\n    parentName: \"svg\"\n  }, {\n    \"d\": \"M12 1L10.25 17\",\n    \"stroke\": \"#CBD5E0\",\n    \"strokeWidth\": \"2\",\n    \"strokeLineCap\": \"round\",\n    \"strokeLineJoin\": \"round\"\n  })), \"\\n      \")), \"Pattern\"), mdx(\"p\", {\n    parentName: \"section\"\n  }, \"A module, anywhere in your source directory, named \", mdx(\"inlineCode\", {\n    parentName: \"p\"\n  }, \"app.ts\"), \".\"), mdx(\"p\", {\n    parentName: \"section\"\n  }, \"A custom entrypoint can also be configured using the \", mdx(\"inlineCode\", {\n    parentName: \"p\"\n  }, \"--entrypoint\"), \" or \", mdx(\"inlineCode\", {\n    parentName: \"p\"\n  }, \"-e\"), \" CLI option on \", mdx(\"inlineCode\", {\n    parentName: \"p\"\n  }, \"nexus build\"), \" and \", mdx(\"inlineCode\", {\n    parentName: \"p\"\n  }, \"nexus dev\"), \".\")), mdx(\"section\", {\n    parentName: \"section\"\n  }, mdx(\"h4\", _extends({\n    parentName: \"section\"\n  }, {\n    \"id\": \"about-1\",\n    \"style\": {\n      \"position\": \"relative\"\n    }\n  }), mdx(\"a\", _extends({\n    parentName: \"h4\"\n  }, {\n    \"href\": \"#about-1\",\n    \"aria-label\": \"about 1 permalink\",\n    \"className\": \"title-link before\"\n  }), mdx(\"svg\", _extends({\n    parentName: \"a\"\n  }, {\n    \"width\": \"17\",\n    \"height\": \"18\",\n    \"viewBox\": \"0 0 17 18\",\n    \"fill\": \"none\",\n    \"xmlns\": \"http://www.w3.org/2000/svg\"\n  }), \"\\n      \", mdx(\"path\", _extends({\n    parentName: \"svg\"\n  }, {\n    \"d\": \"M1.5 6.33337H15.5\",\n    \"stroke\": \"#CBD5E0\",\n    \"strokeWidth\": \"2\",\n    \"strokeLineCap\": \"round\",\n    \"strokeLineJoin\": \"round\"\n  })), \"\\n      \", mdx(\"path\", _extends({\n    parentName: \"svg\"\n  }, {\n    \"d\": \"M1.5 11.6666H15.5\",\n    \"stroke\": \"#CBD5E0\",\n    \"strokeWidth\": \"2\",\n    \"strokeLineCap\": \"round\",\n    \"strokeLineJoin\": \"round\"\n  })), \"\\n      \", mdx(\"path\", _extends({\n    parentName: \"svg\"\n  }, {\n    \"d\": \"M6.75 1L5 17\",\n    \"stroke\": \"#CBD5E0\",\n    \"strokeWidth\": \"2\",\n    \"strokeLineCap\": \"round\",\n    \"strokeLineJoin\": \"round\"\n  })), \"\\n      \", mdx(\"path\", _extends({\n    parentName: \"svg\"\n  }, {\n    \"d\": \"M12 1L10.25 17\",\n    \"stroke\": \"#CBD5E0\",\n    \"strokeWidth\": \"2\",\n    \"strokeLineCap\": \"round\",\n    \"strokeLineJoin\": \"round\"\n  })), \"\\n      \")), \"About\"), mdx(\"p\", {\n    parentName: \"section\"\n  }, \"This convention is optional if Nexus modules are present, required otherwise.\")))));\n}\n;\nMDXContent.isMDXComponent = true;","parent":{"__typename":"File","relativePath":"02-guides/06-project-layout.mdx"},"tableOfContents":{"items":[{"url":"#project-layout","title":"Project Layout"},{"url":"#working-with-tsconfigjson","title":"Working With tsconfig.json","items":[{"url":"#project-root","title":"Project Root"},{"url":"#source-root","title":"Source Root"},{"url":"#out-root","title":"Out Root"},{"url":"#check-only-builds","title":"Check-Only Builds"},{"url":"#typescript-language-service-plugin","title":"TypeScript Language Service Plugin"}]},{"url":"#conventions","title":"Conventions","items":[{"url":"#nexus-modules","title":"Nexus module(s)","items":[{"url":"#pattern","title":"Pattern"},{"url":"#about","title":"About"}]},{"url":"#entrypoint","title":"Entrypoint","items":[{"url":"#pattern-1","title":"Pattern"},{"url":"#about-1","title":"About"}]}]}]},"frontmatter":{"title":"Project Layout","metaTitle":null,"metaDescription":null}}},"pageContext":{"id":"00d5549e-356d-578b-9de4-f068fb557928","seoTitle":"Project Layout","seoDescription":"Project Layout"}}}