{"componentChunkName":"component---src-layouts-article-layout-tsx","path":"/getting-started/tutorial/chapter-writing-your-first-schema","result":{"data":{"site":{"siteMetadata":{"docsLocation":"https://github.com/graphql-nexus/docs/tree/master/content"}},"mdx":{"fields":{"slug":"/01-getting-started/03-tutorial/03-chapter-2-writing-your-first-schema"},"body":"function _extends() { _extends = Object.assign || function (target) { for (var i = 1; i < arguments.length; i++) { var source = arguments[i]; for (var key in source) { if (Object.prototype.hasOwnProperty.call(source, key)) { target[key] = source[key]; } } } return target; }; return _extends.apply(this, arguments); }\n\nfunction _objectWithoutProperties(source, excluded) { if (source == null) return {}; var target = _objectWithoutPropertiesLoose(source, excluded); var key, i; if (Object.getOwnPropertySymbols) { var sourceSymbolKeys = Object.getOwnPropertySymbols(source); for (i = 0; i < sourceSymbolKeys.length; i++) { key = sourceSymbolKeys[i]; if (excluded.indexOf(key) >= 0) continue; if (!Object.prototype.propertyIsEnumerable.call(source, key)) continue; target[key] = source[key]; } } return target; }\n\nfunction _objectWithoutPropertiesLoose(source, excluded) { if (source == null) return {}; var target = {}; var sourceKeys = Object.keys(source); var key, i; for (i = 0; i < sourceKeys.length; i++) { key = sourceKeys[i]; if (excluded.indexOf(key) >= 0) continue; target[key] = source[key]; } return target; }\n\n/* @jsx mdx */\nvar _frontmatter = {\n  \"title\": \"2. Writing Your First Schema\"\n};\n\nvar makeShortcode = function makeShortcode(name) {\n  return function MDXDefaultShortcode(props) {\n    console.warn(\"Component \" + name + \" was not imported, exported, or provided by MDXProvider as global scope\");\n    return mdx(\"div\", props);\n  };\n};\n\nvar layoutProps = {\n  _frontmatter: _frontmatter\n};\nvar MDXLayout = \"wrapper\";\nreturn function MDXContent(_ref) {\n  var components = _ref.components,\n      props = _objectWithoutProperties(_ref, [\"components\"]);\n\n  return mdx(MDXLayout, _extends({}, layoutProps, props, {\n    components: components,\n    mdxType: \"MDXLayout\"\n  }), mdx(\"section\", null, mdx(\"h2\", _extends({\n    parentName: \"section\"\n  }, {\n    \"id\": \"chapter-2-br-writing-your-first-schema\",\n    \"style\": {\n      \"position\": \"relative\"\n    }\n  }), mdx(\"a\", _extends({\n    parentName: \"h2\"\n  }, {\n    \"href\": \"#chapter-2-br-writing-your-first-schema\",\n    \"aria-label\": \"chapter 2 br writing your first schema permalink\",\n    \"className\": \"title-link before\"\n  }), mdx(\"svg\", _extends({\n    parentName: \"a\"\n  }, {\n    \"width\": \"17\",\n    \"height\": \"18\",\n    \"viewBox\": \"0 0 17 18\",\n    \"fill\": \"none\",\n    \"xmlns\": \"http://www.w3.org/2000/svg\"\n  }), \"\\n      \", mdx(\"path\", _extends({\n    parentName: \"svg\"\n  }, {\n    \"d\": \"M1.5 6.33337H15.5\",\n    \"stroke\": \"#CBD5E0\",\n    \"strokeWidth\": \"2\",\n    \"strokeLineCap\": \"round\",\n    \"strokeLineJoin\": \"round\"\n  })), \"\\n      \", mdx(\"path\", _extends({\n    parentName: \"svg\"\n  }, {\n    \"d\": \"M1.5 11.6666H15.5\",\n    \"stroke\": \"#CBD5E0\",\n    \"strokeWidth\": \"2\",\n    \"strokeLineCap\": \"round\",\n    \"strokeLineJoin\": \"round\"\n  })), \"\\n      \", mdx(\"path\", _extends({\n    parentName: \"svg\"\n  }, {\n    \"d\": \"M6.75 1L5 17\",\n    \"stroke\": \"#CBD5E0\",\n    \"strokeWidth\": \"2\",\n    \"strokeLineCap\": \"round\",\n    \"strokeLineJoin\": \"round\"\n  })), \"\\n      \", mdx(\"path\", _extends({\n    parentName: \"svg\"\n  }, {\n    \"d\": \"M12 1L10.25 17\",\n    \"stroke\": \"#CBD5E0\",\n    \"strokeWidth\": \"2\",\n    \"strokeLineCap\": \"round\",\n    \"strokeLineJoin\": \"round\"\n  })), \"\\n      \")), \"Chapter 2 \", mdx(\"br\", null), \" Writing Your First Schema\"), mdx(\"p\", {\n    parentName: \"section\"\n  }, \"In this chapter you're going to write your first schema. You'll learn about:\"), mdx(\"ul\", {\n    parentName: \"section\"\n  }, mdx(\"li\", {\n    parentName: \"ul\"\n  }, \"Writing GraphQL objects\"), mdx(\"li\", {\n    parentName: \"ul\"\n  }, \"Exposing GraphQL objects for query operations\"), mdx(\"li\", {\n    parentName: \"ul\"\n  }, \"GraphQL SDL file generation\"), mdx(\"li\", {\n    parentName: \"ul\"\n  }, \"Enhanced type safety & autocompletion\")), mdx(\"div\", {\n    className: \"NextIs SectionDivider\"\n  })), mdx(\"section\", null, mdx(\"h2\", _extends({\n    parentName: \"section\"\n  }, {\n    \"id\": \"what-about-that-server\",\n    \"style\": {\n      \"position\": \"relative\"\n    }\n  }), mdx(\"a\", _extends({\n    parentName: \"h2\"\n  }, {\n    \"href\": \"#what-about-that-server\",\n    \"aria-label\": \"what about that server permalink\",\n    \"className\": \"title-link before\"\n  }), mdx(\"svg\", _extends({\n    parentName: \"a\"\n  }, {\n    \"width\": \"17\",\n    \"height\": \"18\",\n    \"viewBox\": \"0 0 17 18\",\n    \"fill\": \"none\",\n    \"xmlns\": \"http://www.w3.org/2000/svg\"\n  }), \"\\n      \", mdx(\"path\", _extends({\n    parentName: \"svg\"\n  }, {\n    \"d\": \"M1.5 6.33337H15.5\",\n    \"stroke\": \"#CBD5E0\",\n    \"strokeWidth\": \"2\",\n    \"strokeLineCap\": \"round\",\n    \"strokeLineJoin\": \"round\"\n  })), \"\\n      \", mdx(\"path\", _extends({\n    parentName: \"svg\"\n  }, {\n    \"d\": \"M1.5 11.6666H15.5\",\n    \"stroke\": \"#CBD5E0\",\n    \"strokeWidth\": \"2\",\n    \"strokeLineCap\": \"round\",\n    \"strokeLineJoin\": \"round\"\n  })), \"\\n      \", mdx(\"path\", _extends({\n    parentName: \"svg\"\n  }, {\n    \"d\": \"M6.75 1L5 17\",\n    \"stroke\": \"#CBD5E0\",\n    \"strokeWidth\": \"2\",\n    \"strokeLineCap\": \"round\",\n    \"strokeLineJoin\": \"round\"\n  })), \"\\n      \", mdx(\"path\", _extends({\n    parentName: \"svg\"\n  }, {\n    \"d\": \"M12 1L10.25 17\",\n    \"stroke\": \"#CBD5E0\",\n    \"strokeWidth\": \"2\",\n    \"strokeLineCap\": \"round\",\n    \"strokeLineJoin\": \"round\"\n  })), \"\\n      \")), \"What About That Server?\"), mdx(\"p\", {\n    parentName: \"section\"\n  }, \"In the last chapter you probably noticed the minimal setup required to get up and running. In fact, you might even be confused and wondering:\"), mdx(\"p\", {\n    parentName: \"section\"\n  }, \"\\\"Hey, all I have is an empty \", mdx(\"inlineCode\", {\n    parentName: \"p\"\n  }, \"app.ts\"), \" file, how can my server even be running?\\\"\"), mdx(\"p\", {\n    parentName: \"section\"\n  }, \"Well, Nexus comes with a server out of the box. There's no need for you to start or stop the server or otherwise think about it beyond your domain logic. Nexus wants you to focus on what makes your GraphQL API unique.\"), mdx(\"p\", {\n    parentName: \"section\"\n  }, \"If your lock-in fears are tingling, know that \", mdx(\"strong\", {\n    parentName: \"p\"\n  }, \"you still have \", mdx(\"em\", {\n    parentName: \"strong\"\n  }, \"full\"), \" access\"), \" to the underlying server instance. So if you need to add custom middlewares, routes, and so on, you can. It happens that currently it is an \", mdx(\"inlineCode\", {\n    parentName: \"p\"\n  }, \"express\"), \" instance but this area of Nexus will evolve (\", mdx(\"a\", _extends({\n    parentName: \"p\"\n  }, {\n    \"href\": \"https://github.com/graphql-nexus/nexus/issues/295\"\n  }), \"#295\"), \").\"), mdx(\"div\", {\n    className: \"NextIs SectionDivider\"\n  })), mdx(\"section\", null, mdx(\"h2\", _extends({\n    parentName: \"section\"\n  }, {\n    \"id\": \"reflection\",\n    \"style\": {\n      \"position\": \"relative\"\n    }\n  }), mdx(\"a\", _extends({\n    parentName: \"h2\"\n  }, {\n    \"href\": \"#reflection\",\n    \"aria-label\": \"reflection permalink\",\n    \"className\": \"title-link before\"\n  }), mdx(\"svg\", _extends({\n    parentName: \"a\"\n  }, {\n    \"width\": \"17\",\n    \"height\": \"18\",\n    \"viewBox\": \"0 0 17 18\",\n    \"fill\": \"none\",\n    \"xmlns\": \"http://www.w3.org/2000/svg\"\n  }), \"\\n      \", mdx(\"path\", _extends({\n    parentName: \"svg\"\n  }, {\n    \"d\": \"M1.5 6.33337H15.5\",\n    \"stroke\": \"#CBD5E0\",\n    \"strokeWidth\": \"2\",\n    \"strokeLineCap\": \"round\",\n    \"strokeLineJoin\": \"round\"\n  })), \"\\n      \", mdx(\"path\", _extends({\n    parentName: \"svg\"\n  }, {\n    \"d\": \"M1.5 11.6666H15.5\",\n    \"stroke\": \"#CBD5E0\",\n    \"strokeWidth\": \"2\",\n    \"strokeLineCap\": \"round\",\n    \"strokeLineJoin\": \"round\"\n  })), \"\\n      \", mdx(\"path\", _extends({\n    parentName: \"svg\"\n  }, {\n    \"d\": \"M6.75 1L5 17\",\n    \"stroke\": \"#CBD5E0\",\n    \"strokeWidth\": \"2\",\n    \"strokeLineCap\": \"round\",\n    \"strokeLineJoin\": \"round\"\n  })), \"\\n      \", mdx(\"path\", _extends({\n    parentName: \"svg\"\n  }, {\n    \"d\": \"M12 1L10.25 17\",\n    \"stroke\": \"#CBD5E0\",\n    \"strokeWidth\": \"2\",\n    \"strokeLineCap\": \"round\",\n    \"strokeLineJoin\": \"round\"\n  })), \"\\n      \")), \"Reflection?\"), mdx(\"p\", {\n    parentName: \"section\"\n  }, \"Before we get going we need a moment to introduce an important part of the Nexus development workflow. Nexus has an unconventional concept called \\\"Reflection\\\". It refers to the fact that, when \", mdx(\"inlineCode\", {\n    parentName: \"p\"\n  }, \"nexus dev\"), \" or \", mdx(\"inlineCode\", {\n    parentName: \"p\"\n  }, \"nexus build\"), \" is running, not only is your application code being run, but \", mdx(\"strong\", {\n    parentName: \"p\"\n  }, \"information is being gathered and artifacts are being derived\"), \". Some of Nexus' uses for reflection include:\"), mdx(\"ul\", {\n    parentName: \"section\"\n  }, mdx(\"li\", {\n    parentName: \"ul\"\n  }, \"Figuring out which plugins you are using, and the settings passed\"), mdx(\"li\", {\n    parentName: \"ul\"\n  }, \"Generating TypeScript types to give your resolvers complete type safety\"), mdx(\"li\", {\n    parentName: \"ul\"\n  }, \"Generating an SDL file\")), mdx(\"p\", {\n    parentName: \"section\"\n  }, \"This partly explains why Nexus has a declarative API. It needs a way to run your app reliably at build time. Declarative APIs give Nexus a higher degree of control to do this. Declarative APIs also encode enough semantic value for Nexus to do the things it needs to.\"), mdx(\"p\", {\n    parentName: \"section\"\n  }, \"Architecturally there's a lot more to say about reflection but for now, from a user point of view, just remember the following. You should \", mdx(\"em\", {\n    parentName: \"p\"\n  }, \"always\"), \" have your \", mdx(\"inlineCode\", {\n    parentName: \"p\"\n  }, \"nexus dev\"), \" running when you're working on your project \", mdx(\"em\", {\n    parentName: \"p\"\n  }, \"even\"), \" when you're not intending to use your server (e.g. access the GraphQL Playground). If you forget to run \", mdx(\"inlineCode\", {\n    parentName: \"p\"\n  }, \"nexus dev\"), \" then you will not, for example, get the static typing experience that you expect in your resolvers.\"), mdx(\"blockquote\", {\n    parentName: \"section\"\n  }, mdx(\"p\", {\n    parentName: \"blockquote\"\n  }, \"There are plans to run Nexus Reflection as a separate process integrated into your IDE. You can learn more about and track the feature here (\", mdx(\"a\", _extends({\n    parentName: \"p\"\n  }, {\n    \"href\": \"https://github.com/graphql-nexus/nexus/issues/949\"\n  }), \"#949\"), \")\")), mdx(\"div\", {\n    className: \"NextIs SectionDivider\"\n  })), mdx(\"section\", null, mdx(\"h2\", _extends({\n    parentName: \"section\"\n  }, {\n    \"id\": \"model-the-domain\",\n    \"style\": {\n      \"position\": \"relative\"\n    }\n  }), mdx(\"a\", _extends({\n    parentName: \"h2\"\n  }, {\n    \"href\": \"#model-the-domain\",\n    \"aria-label\": \"model the domain permalink\",\n    \"className\": \"title-link before\"\n  }), mdx(\"svg\", _extends({\n    parentName: \"a\"\n  }, {\n    \"width\": \"17\",\n    \"height\": \"18\",\n    \"viewBox\": \"0 0 17 18\",\n    \"fill\": \"none\",\n    \"xmlns\": \"http://www.w3.org/2000/svg\"\n  }), \"\\n      \", mdx(\"path\", _extends({\n    parentName: \"svg\"\n  }, {\n    \"d\": \"M1.5 6.33337H15.5\",\n    \"stroke\": \"#CBD5E0\",\n    \"strokeWidth\": \"2\",\n    \"strokeLineCap\": \"round\",\n    \"strokeLineJoin\": \"round\"\n  })), \"\\n      \", mdx(\"path\", _extends({\n    parentName: \"svg\"\n  }, {\n    \"d\": \"M1.5 11.6666H15.5\",\n    \"stroke\": \"#CBD5E0\",\n    \"strokeWidth\": \"2\",\n    \"strokeLineCap\": \"round\",\n    \"strokeLineJoin\": \"round\"\n  })), \"\\n      \", mdx(\"path\", _extends({\n    parentName: \"svg\"\n  }, {\n    \"d\": \"M6.75 1L5 17\",\n    \"stroke\": \"#CBD5E0\",\n    \"strokeWidth\": \"2\",\n    \"strokeLineCap\": \"round\",\n    \"strokeLineJoin\": \"round\"\n  })), \"\\n      \", mdx(\"path\", _extends({\n    parentName: \"svg\"\n  }, {\n    \"d\": \"M12 1L10.25 17\",\n    \"stroke\": \"#CBD5E0\",\n    \"strokeWidth\": \"2\",\n    \"strokeLineCap\": \"round\",\n    \"strokeLineJoin\": \"round\"\n  })), \"\\n      \")), \"Model The Domain\"), mdx(\"p\", {\n    parentName: \"section\"\n  }, \"Let's get started with our blog schema by modeling some key entities in the domain. We'll begin with the concept of a \", mdx(\"inlineCode\", {\n    parentName: \"p\"\n  }, \"Post\"), \". A post will represent a page in your blog. When not published, we'll call it a \", mdx(\"em\", {\n    parentName: \"p\"\n  }, \"draft\"), \".\"), mdx(\"p\", {\n    parentName: \"section\"\n  }, \"Your modeling work is going to start on the API layer as opposed to the database layer. This API-first approach can be a good way to collaborate with frontend teams, getting their input in shaping the data early.\"), mdx(\"blockquote\", {\n    parentName: \"section\"\n  }, mdx(\"p\", {\n    parentName: \"blockquote\"\n  }, \"A note about terminology. We will be talking about the Post Object not Post Model. The difference is that at the API layer we have objects but at the database layer we have models. The name difference helps us talk about these different layers without confusion. It is also how GraphQL (API layer) and Prisma (database layer, discussed later) respectively refer to these things.\")), mdx(\"p\", {\n    parentName: \"section\"\n  }, \"Create a new module for your Post object at \", mdx(\"inlineCode\", {\n    parentName: \"p\"\n  }, \"api/graphql/Post.ts\"), \". We \", mdx(\"em\", {\n    parentName: \"p\"\n  }, \"could\"), \" write our whole schema within say \", mdx(\"inlineCode\", {\n    parentName: \"p\"\n  }, \"api/app.ts\"), \" or \", mdx(\"inlineCode\", {\n    parentName: \"p\"\n  }, \"api/graphql.ts\"), \", but modularizing your GraphQL type definitions can help scale your codebase. Neither approach is inheritly wrong though, so do as you see you fit. For this tutorial we'll use the modular style.\"), mdx(\"pre\", {\n    parentName: \"section\"\n  }, mdx(\"code\", _extends({\n    parentName: \"pre\"\n  }, {\n    \"className\": \"language-bash\"\n  }), \"mkdir api/graphql && touch api/graphql/Post.ts\\n\")), mdx(\"p\", {\n    parentName: \"section\"\n  }, \"To create the \", mdx(\"inlineCode\", {\n    parentName: \"p\"\n  }, \"Post\"), \" object we'll import the \", mdx(\"inlineCode\", {\n    parentName: \"p\"\n  }, \"schema\"), \" component from the \", mdx(\"inlineCode\", {\n    parentName: \"p\"\n  }, \"nexus\"), \" package. \", mdx(\"inlineCode\", {\n    parentName: \"p\"\n  }, \"schema\"), \" is where you'll find all the building blocks to craft your GraphQL types. Right now we are interested in the \", mdx(\"inlineCode\", {\n    parentName: \"p\"\n  }, \"schema.objectType\"), \" method, which, unsurprisingly, helps building \", mdx(\"a\", _extends({\n    parentName: \"p\"\n  }, {\n    \"href\": \"https://graphql.org/graphql-js/object-types/\"\n  }), \"GraphQL Object Types\"), \".\"), mdx(\"pre\", {\n    parentName: \"section\"\n  }, mdx(\"code\", _extends({\n    parentName: \"pre\"\n  }, {\n    \"className\": \"language-ts\"\n  }), \"// api/graphql/Post.ts\\n\\nimport { schema } from 'nexus'\\n\\nschema.objectType({\\n  name: 'Post',            // <- Name of your type\\n  definition(t) {\\n    t.int('id')            // <- Field named `id` of type `Int`\\n    t.string('title')      // <- Field named `title` of type `String`\\n    t.int('body')          // <- Field named `body` of type `String`\\n    t.boolean('published') // <- Field named `published` of type `Boolean`\\n  },\\n})\\n\")), mdx(\"div\", {\n    className: \"NextIs SectionDivider\"\n  })), mdx(\"section\", null, mdx(\"h2\", _extends({\n    parentName: \"section\"\n  }, {\n    \"id\": \"sdl\",\n    \"style\": {\n      \"position\": \"relative\"\n    }\n  }), mdx(\"a\", _extends({\n    parentName: \"h2\"\n  }, {\n    \"href\": \"#sdl\",\n    \"aria-label\": \"sdl permalink\",\n    \"className\": \"title-link before\"\n  }), mdx(\"svg\", _extends({\n    parentName: \"a\"\n  }, {\n    \"width\": \"17\",\n    \"height\": \"18\",\n    \"viewBox\": \"0 0 17 18\",\n    \"fill\": \"none\",\n    \"xmlns\": \"http://www.w3.org/2000/svg\"\n  }), \"\\n      \", mdx(\"path\", _extends({\n    parentName: \"svg\"\n  }, {\n    \"d\": \"M1.5 6.33337H15.5\",\n    \"stroke\": \"#CBD5E0\",\n    \"strokeWidth\": \"2\",\n    \"strokeLineCap\": \"round\",\n    \"strokeLineJoin\": \"round\"\n  })), \"\\n      \", mdx(\"path\", _extends({\n    parentName: \"svg\"\n  }, {\n    \"d\": \"M1.5 11.6666H15.5\",\n    \"stroke\": \"#CBD5E0\",\n    \"strokeWidth\": \"2\",\n    \"strokeLineCap\": \"round\",\n    \"strokeLineJoin\": \"round\"\n  })), \"\\n      \", mdx(\"path\", _extends({\n    parentName: \"svg\"\n  }, {\n    \"d\": \"M6.75 1L5 17\",\n    \"stroke\": \"#CBD5E0\",\n    \"strokeWidth\": \"2\",\n    \"strokeLineCap\": \"round\",\n    \"strokeLineJoin\": \"round\"\n  })), \"\\n      \", mdx(\"path\", _extends({\n    parentName: \"svg\"\n  }, {\n    \"d\": \"M12 1L10.25 17\",\n    \"stroke\": \"#CBD5E0\",\n    \"strokeWidth\": \"2\",\n    \"strokeLineCap\": \"round\",\n    \"strokeLineJoin\": \"round\"\n  })), \"\\n      \")), \"SDL?\"), mdx(\"p\", {\n    parentName: \"section\"\n  }, \"Once you've saved this file change to disk, your app will be restarted and the previous warning you had about an empty GraphQL schema should be gone.\"), mdx(\"p\", {\n    parentName: \"section\"\n  }, \"You may notice that there's also now a new \", mdx(\"inlineCode\", {\n    parentName: \"p\"\n  }, \"schema.graphql\"), \" file at your project root. It contains a representation of your schema in a syntax called the GraphQL Schema Definition Language (SDL for short). In dev mode Nexus generates this for you at every app restart. In it you should see the following:\"), mdx(\"pre\", {\n    parentName: \"section\"\n  }, mdx(\"code\", _extends({\n    parentName: \"pre\"\n  }, {\n    \"className\": \"language-graphql\"\n  }), \"type Post {\\n  id: Int\\n  title: String\\n  body: String\\n  published: Boolean\\n}\\n\")), mdx(\"p\", {\n    parentName: \"section\"\n  }, \"You are free to disable this file (settings discussed later) but its existence has two benefits for you to consider:\"), mdx(\"ol\", {\n    parentName: \"section\"\n  }, mdx(\"li\", {\n    parentName: \"ol\"\n  }, \"For users familiar with SDL the correspondance between the source code and it may help them learn Nexus' schema API faster.\"), mdx(\"li\", {\n    parentName: \"ol\"\n  }, \"The SDL syntax makes it an accessible way for others to evaluate incoming API changes without having to know about Nexus, or even JavaScript. Consider using the generated SDL file to improve your pull-request reviews.\")), mdx(\"p\", {\n    parentName: \"section\"\n  }, \"For the remainder of this tutorial we'll be keeping SDL to the right of Nexus code blocks.\"), mdx(\"div\", {\n    className: \"NextIs SectionDivider\"\n  })), mdx(\"section\", null, mdx(\"h2\", _extends({\n    parentName: \"section\"\n  }, {\n    \"id\": \"your-first-home-grown-query\",\n    \"style\": {\n      \"position\": \"relative\"\n    }\n  }), mdx(\"a\", _extends({\n    parentName: \"h2\"\n  }, {\n    \"href\": \"#your-first-home-grown-query\",\n    \"aria-label\": \"your first home grown query permalink\",\n    \"className\": \"title-link before\"\n  }), mdx(\"svg\", _extends({\n    parentName: \"a\"\n  }, {\n    \"width\": \"17\",\n    \"height\": \"18\",\n    \"viewBox\": \"0 0 17 18\",\n    \"fill\": \"none\",\n    \"xmlns\": \"http://www.w3.org/2000/svg\"\n  }), \"\\n      \", mdx(\"path\", _extends({\n    parentName: \"svg\"\n  }, {\n    \"d\": \"M1.5 6.33337H15.5\",\n    \"stroke\": \"#CBD5E0\",\n    \"strokeWidth\": \"2\",\n    \"strokeLineCap\": \"round\",\n    \"strokeLineJoin\": \"round\"\n  })), \"\\n      \", mdx(\"path\", _extends({\n    parentName: \"svg\"\n  }, {\n    \"d\": \"M1.5 11.6666H15.5\",\n    \"stroke\": \"#CBD5E0\",\n    \"strokeWidth\": \"2\",\n    \"strokeLineCap\": \"round\",\n    \"strokeLineJoin\": \"round\"\n  })), \"\\n      \", mdx(\"path\", _extends({\n    parentName: \"svg\"\n  }, {\n    \"d\": \"M6.75 1L5 17\",\n    \"stroke\": \"#CBD5E0\",\n    \"strokeWidth\": \"2\",\n    \"strokeLineCap\": \"round\",\n    \"strokeLineJoin\": \"round\"\n  })), \"\\n      \", mdx(\"path\", _extends({\n    parentName: \"svg\"\n  }, {\n    \"d\": \"M12 1L10.25 17\",\n    \"stroke\": \"#CBD5E0\",\n    \"strokeWidth\": \"2\",\n    \"strokeLineCap\": \"round\",\n    \"strokeLineJoin\": \"round\"\n  })), \"\\n      \")), \"Your First Home Grown Query\"), mdx(\"p\", {\n    parentName: \"section\"\n  }, \"Your \", mdx(\"inlineCode\", {\n    parentName: \"p\"\n  }, \"Post\"), \" object is in place now but there's still no way for clients to read that data. Let's change that. You'll use the special \", mdx(\"inlineCode\", {\n    parentName: \"p\"\n  }, \"Query\"), \" object to expose your Post object.\"), mdx(\"p\", {\n    parentName: \"section\"\n  }, \"We'll start by letting API clients read the drafts of your blog.\"), mdx(\"div\", {\n    className: \"TightRow\"\n  }, mdx(\"pre\", {\n    parentName: \"section\"\n  }, mdx(\"code\", _extends({\n    parentName: \"pre\"\n  }, {\n    \"className\": \"language-ts\"\n  }), \"// api/graphql/Post.ts     // 1\\n// ...\\n\\nschema.extendType({\\n  type: 'Query',            // 2\\n  definition(t) {\\n    t.field('drafts', {      // 3\\n      type: 'Post',         // 4\\n      list: true,           // 5\\n    })\\n  },\\n})\\n\")), mdx(\"pre\", {\n    parentName: \"section\"\n  }, mdx(\"code\", _extends({\n    parentName: \"pre\"\n  }, {\n    \"className\": \"language-graphql\"\n  }), \"type Query {\\n  drafts: [Post!]\\n}\\n\"))), mdx(\"ol\", {\n    parentName: \"section\"\n  }, mdx(\"li\", {\n    parentName: \"ol\"\n  }, mdx(\"p\", {\n    parentName: \"li\"\n  }, \"The Query object is a central place in your schema where many other types will appear. Like before with the modular GraphQL types decision we again can decide to be modular here. We could either create a new \", mdx(\"inlineCode\", {\n    parentName: \"p\"\n  }, \"api/graphql/Query.ts\"), \" module (not modular), or we could \", mdx(\"em\", {\n    parentName: \"p\"\n  }, \"collocate\"), \" the exposure of Post object with its definition in \", mdx(\"inlineCode\", {\n    parentName: \"p\"\n  }, \"api/graphql/Post.ts\"), \" (modular). Staying consistent with before, we'll take the modular way.\")), mdx(\"li\", {\n    parentName: \"ol\"\n  }, mdx(\"p\", {\n    parentName: \"li\"\n  }, \"To achieve colocation in Nexus we'll use \", mdx(\"inlineCode\", {\n    parentName: \"p\"\n  }, \"schema.extendType\"), \". Its API is \", mdx(\"em\", {\n    parentName: \"p\"\n  }, \"very\"), \" similar to \", mdx(\"inlineCode\", {\n    parentName: \"p\"\n  }, \"schema.objectType\"), \" with the difference that the defined fields are merged into the \", mdx(\"em\", {\n    parentName: \"p\"\n  }, \"targeted\"), \" type.\")), mdx(\"li\", {\n    parentName: \"ol\"\n  }, mdx(\"p\", {\n    parentName: \"li\"\n  }, \"The first parameter specifies the field's name, here \", mdx(\"inlineCode\", {\n    parentName: \"p\"\n  }, \"drafts\"))), mdx(\"li\", {\n    parentName: \"ol\"\n  }, mdx(\"p\", {\n    parentName: \"li\"\n  }, mdx(\"inlineCode\", {\n    parentName: \"p\"\n  }, \"type: 'Post'\"), \" specifies what the field's type should be. Here, a \", mdx(\"inlineCode\", {\n    parentName: \"p\"\n  }, \"Post\"))), mdx(\"li\", {\n    parentName: \"ol\"\n  }, mdx(\"p\", {\n    parentName: \"li\"\n  }, mdx(\"inlineCode\", {\n    parentName: \"p\"\n  }, \"list: true\"), \" augments the field's type spec, making it wrapped by a List type. Here, a \", mdx(\"inlineCode\", {\n    parentName: \"p\"\n  }, \"[Post]\"), \". Nexus also provides the following shorthand for this \\uD83D\\uDC47\"), mdx(\"pre\", {\n    parentName: \"li\"\n  }, mdx(\"code\", _extends({\n    parentName: \"pre\"\n  }, {\n    \"className\": \"language-ts\"\n  }), \"definition(t) {\\n  t.list.field('drafts', { ... })\\n}\\n\")))), mdx(\"div\", {\n    className: \"NextIs SectionDivider\"\n  }), mdx(\"p\", {\n    parentName: \"section\"\n  }, \"You'll see some feedback from your IDE that you're missing a \", mdx(\"inlineCode\", {\n    parentName: \"p\"\n  }, \"resolve\"), \" property. Go ahead and try to implement it, letting the autocompletion guide you.\"), mdx(\"blockquote\", {\n    parentName: \"section\"\n  }, mdx(\"p\", {\n    parentName: \"blockquote\"\n  }, \"You might be wondering why Nexus hasn't complained about missing resolvers in some other cases so far. The answer is a more advanced topic that we'll cover later.\")), mdx(\"pre\", {\n    parentName: \"section\"\n  }, mdx(\"code\", _extends({\n    parentName: \"pre\"\n  }, {\n    \"className\": \"language-ts\"\n  }), \"import { schema } from 'nexus'\\n\\nschema.extendType({\\n  type: 'Query',\\n  definition(t) {\\n    t.field('drafts', {\\n      type: 'Post',\\n      list: true,\\n      resolve() {\\n        return [{ id: 1, title: 'Nexus', body: '...', published: false }]\\n      },\\n    })\\n  },\\n})\\n\")), mdx(\"div\", {\n    className: \"NextIs SectionDivider\"\n  })), mdx(\"section\", null, mdx(\"h2\", _extends({\n    parentName: \"section\"\n  }, {\n    \"id\": \"try-it-out\",\n    \"style\": {\n      \"position\": \"relative\"\n    }\n  }), mdx(\"a\", _extends({\n    parentName: \"h2\"\n  }, {\n    \"href\": \"#try-it-out\",\n    \"aria-label\": \"try it out permalink\",\n    \"className\": \"title-link before\"\n  }), mdx(\"svg\", _extends({\n    parentName: \"a\"\n  }, {\n    \"width\": \"17\",\n    \"height\": \"18\",\n    \"viewBox\": \"0 0 17 18\",\n    \"fill\": \"none\",\n    \"xmlns\": \"http://www.w3.org/2000/svg\"\n  }), \"\\n      \", mdx(\"path\", _extends({\n    parentName: \"svg\"\n  }, {\n    \"d\": \"M1.5 6.33337H15.5\",\n    \"stroke\": \"#CBD5E0\",\n    \"strokeWidth\": \"2\",\n    \"strokeLineCap\": \"round\",\n    \"strokeLineJoin\": \"round\"\n  })), \"\\n      \", mdx(\"path\", _extends({\n    parentName: \"svg\"\n  }, {\n    \"d\": \"M1.5 11.6666H15.5\",\n    \"stroke\": \"#CBD5E0\",\n    \"strokeWidth\": \"2\",\n    \"strokeLineCap\": \"round\",\n    \"strokeLineJoin\": \"round\"\n  })), \"\\n      \", mdx(\"path\", _extends({\n    parentName: \"svg\"\n  }, {\n    \"d\": \"M6.75 1L5 17\",\n    \"stroke\": \"#CBD5E0\",\n    \"strokeWidth\": \"2\",\n    \"strokeLineCap\": \"round\",\n    \"strokeLineJoin\": \"round\"\n  })), \"\\n      \", mdx(\"path\", _extends({\n    parentName: \"svg\"\n  }, {\n    \"d\": \"M12 1L10.25 17\",\n    \"stroke\": \"#CBD5E0\",\n    \"strokeWidth\": \"2\",\n    \"strokeLineCap\": \"round\",\n    \"strokeLineJoin\": \"round\"\n  })), \"\\n      \")), \"Try It Out\"), mdx(\"p\", {\n    parentName: \"section\"\n  }, \"You can now open up your GraphQL playground and try the following query (left); In response, you should see something like so (right):\"), mdx(\"div\", {\n    className: \"TightRow\"\n  }, mdx(\"pre\", {\n    parentName: \"section\"\n  }, mdx(\"code\", _extends({\n    parentName: \"pre\"\n  }, {\n    \"className\": \"language-graphql\"\n  }), \"{\\n  drafts {\\n    id\\n    title\\n    body\\n    published\\n  }\\n}\\n\")), mdx(\"pre\", {\n    parentName: \"section\"\n  }, mdx(\"code\", _extends({\n    parentName: \"pre\"\n  }, {\n    \"className\": \"language-json\"\n  }), \"{\\n  \\\"data\\\": {\\n    \\\"posts\\\": [\\n      {\\n        \\\"id\\\": 1,\\n        \\\"title\\\": \\\"Nexus\\\",\\n        \\\"body\\\": \\\"...\\\",\\n        \\\"published\\\": false\\n      }\\n    ]\\n  }\\n}\\n\"))), mdx(\"div\", {\n    className: \"NextIs SectionDivider\"\n  })), mdx(\"section\", null, mdx(\"h2\", _extends({\n    parentName: \"section\"\n  }, {\n    \"id\": \"wrapping-up\",\n    \"style\": {\n      \"position\": \"relative\"\n    }\n  }), mdx(\"a\", _extends({\n    parentName: \"h2\"\n  }, {\n    \"href\": \"#wrapping-up\",\n    \"aria-label\": \"wrapping up permalink\",\n    \"className\": \"title-link before\"\n  }), mdx(\"svg\", _extends({\n    parentName: \"a\"\n  }, {\n    \"width\": \"17\",\n    \"height\": \"18\",\n    \"viewBox\": \"0 0 17 18\",\n    \"fill\": \"none\",\n    \"xmlns\": \"http://www.w3.org/2000/svg\"\n  }), \"\\n      \", mdx(\"path\", _extends({\n    parentName: \"svg\"\n  }, {\n    \"d\": \"M1.5 6.33337H15.5\",\n    \"stroke\": \"#CBD5E0\",\n    \"strokeWidth\": \"2\",\n    \"strokeLineCap\": \"round\",\n    \"strokeLineJoin\": \"round\"\n  })), \"\\n      \", mdx(\"path\", _extends({\n    parentName: \"svg\"\n  }, {\n    \"d\": \"M1.5 11.6666H15.5\",\n    \"stroke\": \"#CBD5E0\",\n    \"strokeWidth\": \"2\",\n    \"strokeLineCap\": \"round\",\n    \"strokeLineJoin\": \"round\"\n  })), \"\\n      \", mdx(\"path\", _extends({\n    parentName: \"svg\"\n  }, {\n    \"d\": \"M6.75 1L5 17\",\n    \"stroke\": \"#CBD5E0\",\n    \"strokeWidth\": \"2\",\n    \"strokeLineCap\": \"round\",\n    \"strokeLineJoin\": \"round\"\n  })), \"\\n      \", mdx(\"path\", _extends({\n    parentName: \"svg\"\n  }, {\n    \"d\": \"M12 1L10.25 17\",\n    \"stroke\": \"#CBD5E0\",\n    \"strokeWidth\": \"2\",\n    \"strokeLineCap\": \"round\",\n    \"strokeLineJoin\": \"round\"\n  })), \"\\n      \")), \"Wrapping Up\"), mdx(\"p\", {\n    parentName: \"section\"\n  }, \"Congratulations! You've successfully got your first GraphQL schema up and running with Nexus! In the next chapter we'll explore adding some write capabilities to our API.\"), mdx(\"div\", {\n    className: \"NextIs NextChapter\"\n  }), mdx(\"p\", {\n    parentName: \"section\"\n  }, mdx(\"a\", _extends({\n    parentName: \"p\"\n  }, {\n    \"href\": \"/tutorial/chapter-3-adding-mutations-to-your-api\"\n  }), \"\\u27B3\"))));\n}\n;\nMDXContent.isMDXComponent = true;","parent":{"__typename":"File","relativePath":"01-getting-started/03-tutorial/03-chapter-2-writing-your-first-schema.mdx"},"tableOfContents":{"items":[{"url":"#chapter-2-br-writing-your-first-schema","title":"Chapter 2 <br/> Writing Your First Schema"},{"url":"#what-about-that-server","title":"What About That Server?"},{"url":"#reflection","title":"Reflection?"},{"url":"#model-the-domain","title":"Model The Domain"},{"url":"#sdl","title":"SDL?"},{"url":"#your-first-home-grown-query","title":"Your First Home Grown Query"},{"url":"#try-it-out","title":"Try It Out"},{"url":"#wrapping-up","title":"Wrapping Up"}]},"frontmatter":{"title":"2. Writing Your First Schema","metaTitle":null,"metaDescription":null}}},"pageContext":{"id":"79ad2aed-8040-516c-b4ae-fe64764e4ff9","seoTitle":"2. Writing Your First Schema","seoDescription":"2. Writing Your First Schema"}}}