{"componentChunkName":"component---src-layouts-article-layout-tsx","path":"/getting-started/tutorial/chapter-setup-and-first-query","result":{"data":{"site":{"siteMetadata":{"docsLocation":"https://github.com/graphql-nexus/docs/tree/master/content"}},"mdx":{"fields":{"slug":"/01-getting-started/03-tutorial/02-chapter-1-setup-and-first-query"},"body":"function _extends() { _extends = Object.assign || function (target) { for (var i = 1; i < arguments.length; i++) { var source = arguments[i]; for (var key in source) { if (Object.prototype.hasOwnProperty.call(source, key)) { target[key] = source[key]; } } } return target; }; return _extends.apply(this, arguments); }\n\nfunction _objectWithoutProperties(source, excluded) { if (source == null) return {}; var target = _objectWithoutPropertiesLoose(source, excluded); var key, i; if (Object.getOwnPropertySymbols) { var sourceSymbolKeys = Object.getOwnPropertySymbols(source); for (i = 0; i < sourceSymbolKeys.length; i++) { key = sourceSymbolKeys[i]; if (excluded.indexOf(key) >= 0) continue; if (!Object.prototype.propertyIsEnumerable.call(source, key)) continue; target[key] = source[key]; } } return target; }\n\nfunction _objectWithoutPropertiesLoose(source, excluded) { if (source == null) return {}; var target = {}; var sourceKeys = Object.keys(source); var key, i; for (i = 0; i < sourceKeys.length; i++) { key = sourceKeys[i]; if (excluded.indexOf(key) >= 0) continue; target[key] = source[key]; } return target; }\n\n/* @jsx mdx */\nvar _frontmatter = {\n  \"title\": \"1. Setup & First Query\"\n};\n\nvar makeShortcode = function makeShortcode(name) {\n  return function MDXDefaultShortcode(props) {\n    console.warn(\"Component \" + name + \" was not imported, exported, or provided by MDXProvider as global scope\");\n    return mdx(\"div\", props);\n  };\n};\n\nvar layoutProps = {\n  _frontmatter: _frontmatter\n};\nvar MDXLayout = \"wrapper\";\nreturn function MDXContent(_ref) {\n  var components = _ref.components,\n      props = _objectWithoutProperties(_ref, [\"components\"]);\n\n  return mdx(MDXLayout, _extends({}, layoutProps, props, {\n    components: components,\n    mdxType: \"MDXLayout\"\n  }), mdx(\"section\", null, mdx(\"h2\", _extends({\n    parentName: \"section\"\n  }, {\n    \"id\": \"chapter-1-br-setup--first-query\",\n    \"style\": {\n      \"position\": \"relative\"\n    }\n  }), mdx(\"a\", _extends({\n    parentName: \"h2\"\n  }, {\n    \"href\": \"#chapter-1-br-setup--first-query\",\n    \"aria-label\": \"chapter 1 br setup  first query permalink\",\n    \"className\": \"title-link before\"\n  }), mdx(\"svg\", _extends({\n    parentName: \"a\"\n  }, {\n    \"width\": \"17\",\n    \"height\": \"18\",\n    \"viewBox\": \"0 0 17 18\",\n    \"fill\": \"none\",\n    \"xmlns\": \"http://www.w3.org/2000/svg\"\n  }), \"\\n      \", mdx(\"path\", _extends({\n    parentName: \"svg\"\n  }, {\n    \"d\": \"M1.5 6.33337H15.5\",\n    \"stroke\": \"#CBD5E0\",\n    \"strokeWidth\": \"2\",\n    \"strokeLineCap\": \"round\",\n    \"strokeLineJoin\": \"round\"\n  })), \"\\n      \", mdx(\"path\", _extends({\n    parentName: \"svg\"\n  }, {\n    \"d\": \"M1.5 11.6666H15.5\",\n    \"stroke\": \"#CBD5E0\",\n    \"strokeWidth\": \"2\",\n    \"strokeLineCap\": \"round\",\n    \"strokeLineJoin\": \"round\"\n  })), \"\\n      \", mdx(\"path\", _extends({\n    parentName: \"svg\"\n  }, {\n    \"d\": \"M6.75 1L5 17\",\n    \"stroke\": \"#CBD5E0\",\n    \"strokeWidth\": \"2\",\n    \"strokeLineCap\": \"round\",\n    \"strokeLineJoin\": \"round\"\n  })), \"\\n      \", mdx(\"path\", _extends({\n    parentName: \"svg\"\n  }, {\n    \"d\": \"M12 1L10.25 17\",\n    \"stroke\": \"#CBD5E0\",\n    \"strokeWidth\": \"2\",\n    \"strokeLineCap\": \"round\",\n    \"strokeLineJoin\": \"round\"\n  })), \"\\n      \")), \"Chapter 1 \", mdx(\"br\", null), \" Setup & First Query\"), mdx(\"p\", {\n    parentName: \"section\"\n  }, \"In this first chapter we're just going to get the bare minimum of a Nexus project setup. You'll learn about:\"), mdx(\"ul\", {\n    parentName: \"section\"\n  }, mdx(\"li\", {\n    parentName: \"ul\"\n  }, \"The \", mdx(\"inlineCode\", {\n    parentName: \"li\"\n  }, \"nexus\"), \" package\"), mdx(\"li\", {\n    parentName: \"ul\"\n  }, \"The Nexus CLI\"), mdx(\"li\", {\n    parentName: \"ul\"\n  }, \"Laying out and running a Nexus project\"), mdx(\"li\", {\n    parentName: \"ul\"\n  }, \"GraphQL Playground\"))), mdx(\"section\", null, mdx(\"h2\", _extends({\n    parentName: \"section\"\n  }, {\n    \"id\": \"cli\",\n    \"style\": {\n      \"position\": \"relative\"\n    }\n  }), mdx(\"a\", _extends({\n    parentName: \"h2\"\n  }, {\n    \"href\": \"#cli\",\n    \"aria-label\": \"cli permalink\",\n    \"className\": \"title-link before\"\n  }), mdx(\"svg\", _extends({\n    parentName: \"a\"\n  }, {\n    \"width\": \"17\",\n    \"height\": \"18\",\n    \"viewBox\": \"0 0 17 18\",\n    \"fill\": \"none\",\n    \"xmlns\": \"http://www.w3.org/2000/svg\"\n  }), \"\\n      \", mdx(\"path\", _extends({\n    parentName: \"svg\"\n  }, {\n    \"d\": \"M1.5 6.33337H15.5\",\n    \"stroke\": \"#CBD5E0\",\n    \"strokeWidth\": \"2\",\n    \"strokeLineCap\": \"round\",\n    \"strokeLineJoin\": \"round\"\n  })), \"\\n      \", mdx(\"path\", _extends({\n    parentName: \"svg\"\n  }, {\n    \"d\": \"M1.5 11.6666H15.5\",\n    \"stroke\": \"#CBD5E0\",\n    \"strokeWidth\": \"2\",\n    \"strokeLineCap\": \"round\",\n    \"strokeLineJoin\": \"round\"\n  })), \"\\n      \", mdx(\"path\", _extends({\n    parentName: \"svg\"\n  }, {\n    \"d\": \"M6.75 1L5 17\",\n    \"stroke\": \"#CBD5E0\",\n    \"strokeWidth\": \"2\",\n    \"strokeLineCap\": \"round\",\n    \"strokeLineJoin\": \"round\"\n  })), \"\\n      \", mdx(\"path\", _extends({\n    parentName: \"svg\"\n  }, {\n    \"d\": \"M12 1L10.25 17\",\n    \"stroke\": \"#CBD5E0\",\n    \"strokeWidth\": \"2\",\n    \"strokeLineCap\": \"round\",\n    \"strokeLineJoin\": \"round\"\n  })), \"\\n      \")), \"CLI\"), mdx(\"p\", {\n    parentName: \"section\"\n  }, \"Start by creating your project directory, initializing your \", mdx(\"inlineCode\", {\n    parentName: \"p\"\n  }, \"package.json\"), \", and adding the \", mdx(\"inlineCode\", {\n    parentName: \"p\"\n  }, \"nexus\"), \" dependency.\"), mdx(\"pre\", {\n    parentName: \"section\"\n  }, mdx(\"code\", _extends({\n    parentName: \"pre\"\n  }, {\n    \"className\": \"language-bash\"\n  }), \"mkdir nexus-tutorial && cd nexus-tutorial\\nnpm init -y\\nnpm add nexus\\n\")), mdx(\"p\", {\n    parentName: \"section\"\n  }, \"Nexus comes out of the box with a CLI. You'll use it often while working on your app. While you can access the CLI of your local nexus via \", mdx(\"inlineCode\", {\n    parentName: \"p\"\n  }, \"yarn\"), \" or npm scripts or \", mdx(\"inlineCode\", {\n    parentName: \"p\"\n  }, \"npx\"), \" but there's an even easier way. Install \", mdx(\"inlineCode\", {\n    parentName: \"p\"\n  }, \"nexus\"), \" globally. Then you can access the CLI from anywhere. Nexus is smart enough to delegate all invocations to the \", mdx(\"em\", {\n    parentName: \"p\"\n  }, \"local\"), \" nexus. This is the idiomatic way to work with Nexus, but you aren't forced to do this.\"), mdx(\"pre\", {\n    parentName: \"section\"\n  }, mdx(\"code\", _extends({\n    parentName: \"pre\"\n  }, {\n    \"className\": \"language-markdown\"\n  }), \"npm add --global nexus\\n\")), mdx(\"p\", {\n    parentName: \"section\"\n  }, \"There are just two CLI commands you need to know about right now:\"), mdx(\"ul\", {\n    parentName: \"section\"\n  }, mdx(\"li\", {\n    parentName: \"ul\"\n  }, mdx(\"inlineCode\", {\n    parentName: \"li\"\n  }, \"nexus dev\"), \" : This command starts a development server in watch mode. Every time you change a file, your app will be restarted.\"), mdx(\"li\", {\n    parentName: \"ul\"\n  }, mdx(\"inlineCode\", {\n    parentName: \"li\"\n  }, \"nexus build\"), \" : This command builds a \\\"production-ready\\\" server, ready to be deployed.\")), mdx(\"blockquote\", {\n    parentName: \"section\"\n  }, mdx(\"p\", {\n    parentName: \"blockquote\"\n  }, \"Another is \", mdx(\"inlineCode\", {\n    parentName: \"p\"\n  }, \"nexus create app\"), \" which will scaffold a new Nexus project for you. That is how you should \", mdx(\"em\", {\n    parentName: \"p\"\n  }, \"normally\"), \" start your Nexus projects. We're avoiding it in this tutorial so that you can learn the basics from the ground up.\")), mdx(\"p\", {\n    parentName: \"section\"\n  }, \"Despite having the global Nexus CLI, using package scripts can be a handy way of self-documenting your project's workflows. So feel free to add the following scripts to your \", mdx(\"inlineCode\", {\n    parentName: \"p\"\n  }, \"package.json\"), \". If you work with team members this can help streamline collaboration.\"), mdx(\"pre\", {\n    parentName: \"section\"\n  }, mdx(\"code\", _extends({\n    parentName: \"pre\"\n  }, {\n    \"className\": \"language-json\"\n  }), \"\\\"scripts\\\": {\\n  \\\"dev\\\": \\\"nexus dev\\\",\\n  \\\"build\\\": \\\"nexus build\\\"\\n}\\n\"))), mdx(\"section\", null, mdx(\"h2\", _extends({\n    parentName: \"section\"\n  }, {\n    \"id\": \"conventional-entrypoint\",\n    \"style\": {\n      \"position\": \"relative\"\n    }\n  }), mdx(\"a\", _extends({\n    parentName: \"h2\"\n  }, {\n    \"href\": \"#conventional-entrypoint\",\n    \"aria-label\": \"conventional entrypoint permalink\",\n    \"className\": \"title-link before\"\n  }), mdx(\"svg\", _extends({\n    parentName: \"a\"\n  }, {\n    \"width\": \"17\",\n    \"height\": \"18\",\n    \"viewBox\": \"0 0 17 18\",\n    \"fill\": \"none\",\n    \"xmlns\": \"http://www.w3.org/2000/svg\"\n  }), \"\\n      \", mdx(\"path\", _extends({\n    parentName: \"svg\"\n  }, {\n    \"d\": \"M1.5 6.33337H15.5\",\n    \"stroke\": \"#CBD5E0\",\n    \"strokeWidth\": \"2\",\n    \"strokeLineCap\": \"round\",\n    \"strokeLineJoin\": \"round\"\n  })), \"\\n      \", mdx(\"path\", _extends({\n    parentName: \"svg\"\n  }, {\n    \"d\": \"M1.5 11.6666H15.5\",\n    \"stroke\": \"#CBD5E0\",\n    \"strokeWidth\": \"2\",\n    \"strokeLineCap\": \"round\",\n    \"strokeLineJoin\": \"round\"\n  })), \"\\n      \", mdx(\"path\", _extends({\n    parentName: \"svg\"\n  }, {\n    \"d\": \"M6.75 1L5 17\",\n    \"stroke\": \"#CBD5E0\",\n    \"strokeWidth\": \"2\",\n    \"strokeLineCap\": \"round\",\n    \"strokeLineJoin\": \"round\"\n  })), \"\\n      \", mdx(\"path\", _extends({\n    parentName: \"svg\"\n  }, {\n    \"d\": \"M12 1L10.25 17\",\n    \"stroke\": \"#CBD5E0\",\n    \"strokeWidth\": \"2\",\n    \"strokeLineCap\": \"round\",\n    \"strokeLineJoin\": \"round\"\n  })), \"\\n      \")), \"Conventional Entrypoint\"), mdx(\"p\", {\n    parentName: \"section\"\n  }, \"We'll now create our first module at \", mdx(\"inlineCode\", {\n    parentName: \"p\"\n  }, \"api/app.ts\"), \":\"), mdx(\"pre\", {\n    parentName: \"section\"\n  }, mdx(\"code\", _extends({\n    parentName: \"pre\"\n  }, {\n    \"className\": \"language-bash\"\n  }), \"mkdir api && touch api/app.ts\\n\")), mdx(\"p\", {\n    parentName: \"section\"\n  }, \"The directory name \", mdx(\"inlineCode\", {\n    parentName: \"p\"\n  }, \"api\"), \" is arbitrary but the module name \", mdx(\"inlineCode\", {\n    parentName: \"p\"\n  }, \"app\"), \" has special meaning. Nexus will find \", mdx(\"inlineCode\", {\n    parentName: \"p\"\n  }, \"app.ts\"), \" wherever you put it within your project and treat it as your entrypoint. Furthermore, every module that imports \", mdx(\"inlineCode\", {\n    parentName: \"p\"\n  }, \"nexus\"), \" will be automatically included into the final build by Nexus. This makes growing and refactoring your project easy as you are freed from managing imoprt/export tedium. You might be wondering how import order is managed. The answer is that Nexus' APIs are declarative and so designed to be order independent.\")), mdx(\"section\", null, mdx(\"h2\", _extends({\n    parentName: \"section\"\n  }, {\n    \"id\": \"contextual-feedback\",\n    \"style\": {\n      \"position\": \"relative\"\n    }\n  }), mdx(\"a\", _extends({\n    parentName: \"h2\"\n  }, {\n    \"href\": \"#contextual-feedback\",\n    \"aria-label\": \"contextual feedback permalink\",\n    \"className\": \"title-link before\"\n  }), mdx(\"svg\", _extends({\n    parentName: \"a\"\n  }, {\n    \"width\": \"17\",\n    \"height\": \"18\",\n    \"viewBox\": \"0 0 17 18\",\n    \"fill\": \"none\",\n    \"xmlns\": \"http://www.w3.org/2000/svg\"\n  }), \"\\n      \", mdx(\"path\", _extends({\n    parentName: \"svg\"\n  }, {\n    \"d\": \"M1.5 6.33337H15.5\",\n    \"stroke\": \"#CBD5E0\",\n    \"strokeWidth\": \"2\",\n    \"strokeLineCap\": \"round\",\n    \"strokeLineJoin\": \"round\"\n  })), \"\\n      \", mdx(\"path\", _extends({\n    parentName: \"svg\"\n  }, {\n    \"d\": \"M1.5 11.6666H15.5\",\n    \"stroke\": \"#CBD5E0\",\n    \"strokeWidth\": \"2\",\n    \"strokeLineCap\": \"round\",\n    \"strokeLineJoin\": \"round\"\n  })), \"\\n      \", mdx(\"path\", _extends({\n    parentName: \"svg\"\n  }, {\n    \"d\": \"M6.75 1L5 17\",\n    \"stroke\": \"#CBD5E0\",\n    \"strokeWidth\": \"2\",\n    \"strokeLineCap\": \"round\",\n    \"strokeLineJoin\": \"round\"\n  })), \"\\n      \", mdx(\"path\", _extends({\n    parentName: \"svg\"\n  }, {\n    \"d\": \"M12 1L10.25 17\",\n    \"stroke\": \"#CBD5E0\",\n    \"strokeWidth\": \"2\",\n    \"strokeLineCap\": \"round\",\n    \"strokeLineJoin\": \"round\"\n  })), \"\\n      \")), \"Contextual Feedback\"), mdx(\"p\", {\n    parentName: \"section\"\n  }, \"Ok, with our entrypoint setup, let's boot up dev mode and see what happens.\"), mdx(\"pre\", {\n    parentName: \"section\"\n  }, mdx(\"code\", _extends({\n    parentName: \"pre\"\n  }, {\n    \"className\": \"language-bash\"\n  }), \"nexus dev\\n\")), mdx(\"p\", {\n    parentName: \"section\"\n  }, \"Woops? You should be seeing a warning from Nexus:\"), mdx(\"pre\", {\n    parentName: \"section\"\n  }, mdx(\"code\", _extends({\n    parentName: \"pre\"\n  }, {\n    \"className\": \"language-bash\"\n  }), \"\\u25B2 nexus:schema Your GraphQL schema is empty. [...]\\n\")), mdx(\"p\", {\n    parentName: \"section\"\n  }, \"All good, you indeed haven't added any types to your GraphQL schema yet so Nexus is right here. This is the first example of Nexus' rich development mode contextual feedback. One of the goals of Nexus is to never leave you in a confused disoriented state. If Nexus can give you in inline feedback it should. Add rich jsDoc and precise TypeScript types into the mix, and ideally you can largely avoid getting lost and \", mdx(\"em\", {\n    parentName: \"p\"\n  }, \"needing\"), \" to consult the Nexus website, community, so on.\")), mdx(\"section\", null, mdx(\"h2\", _extends({\n    parentName: \"section\"\n  }, {\n    \"id\": \"try-it-out\",\n    \"style\": {\n      \"position\": \"relative\"\n    }\n  }), mdx(\"a\", _extends({\n    parentName: \"h2\"\n  }, {\n    \"href\": \"#try-it-out\",\n    \"aria-label\": \"try it out permalink\",\n    \"className\": \"title-link before\"\n  }), mdx(\"svg\", _extends({\n    parentName: \"a\"\n  }, {\n    \"width\": \"17\",\n    \"height\": \"18\",\n    \"viewBox\": \"0 0 17 18\",\n    \"fill\": \"none\",\n    \"xmlns\": \"http://www.w3.org/2000/svg\"\n  }), \"\\n      \", mdx(\"path\", _extends({\n    parentName: \"svg\"\n  }, {\n    \"d\": \"M1.5 6.33337H15.5\",\n    \"stroke\": \"#CBD5E0\",\n    \"strokeWidth\": \"2\",\n    \"strokeLineCap\": \"round\",\n    \"strokeLineJoin\": \"round\"\n  })), \"\\n      \", mdx(\"path\", _extends({\n    parentName: \"svg\"\n  }, {\n    \"d\": \"M1.5 11.6666H15.5\",\n    \"stroke\": \"#CBD5E0\",\n    \"strokeWidth\": \"2\",\n    \"strokeLineCap\": \"round\",\n    \"strokeLineJoin\": \"round\"\n  })), \"\\n      \", mdx(\"path\", _extends({\n    parentName: \"svg\"\n  }, {\n    \"d\": \"M6.75 1L5 17\",\n    \"stroke\": \"#CBD5E0\",\n    \"strokeWidth\": \"2\",\n    \"strokeLineCap\": \"round\",\n    \"strokeLineJoin\": \"round\"\n  })), \"\\n      \", mdx(\"path\", _extends({\n    parentName: \"svg\"\n  }, {\n    \"d\": \"M12 1L10.25 17\",\n    \"stroke\": \"#CBD5E0\",\n    \"strokeWidth\": \"2\",\n    \"strokeLineCap\": \"round\",\n    \"strokeLineJoin\": \"round\"\n  })), \"\\n      \")), \"Try It Out\"), mdx(\"p\", {\n    parentName: \"section\"\n  }, \"Aside from the warning, you should also see a message indicating that your server is running, and where.\"), mdx(\"pre\", {\n    parentName: \"section\"\n  }, mdx(\"code\", _extends({\n    parentName: \"pre\"\n  }, {\n    \"className\": \"language-bash\"\n  }), \"\\u25CF nexus:server listening  --  url: 'http://localhost:4000/'\\n\")), mdx(\"p\", {\n    parentName: \"section\"\n  }, \"Open it up, what do you see? It should be an instance of \", mdx(\"a\", _extends({\n    parentName: \"p\"\n  }, {\n    \"href\": \"https://github.com/prisma-labs/graphql-playground\"\n  }), \"GraphQL Playground\"), \".\"), mdx(\"p\", {\n    parentName: \"section\"\n  }, mdx(\"img\", _extends({\n    parentName: \"p\"\n  }, {\n    \"src\": \"https://user-images.githubusercontent.com/284476/83534302-ae1b7d00-a4be-11ea-9a13-2665bf152e2a.png\",\n    \"alt\": \"image\"\n  }))), mdx(\"p\", {\n    parentName: \"section\"\n  }, \"This is a graphical user inteface for interacting with GraphQL APIs. If you prefer you can run a \", mdx(\"a\", _extends({\n    parentName: \"p\"\n  }, {\n    \"href\": \"https://www.electronjs.org/apps/graphql-playground\"\n  }), \"standalone\"), \" version as an app on your machine, or another GraphQL GUI entirely. Nexus ships with one out of the box for your convenience.\"), mdx(\"p\", {\n    parentName: \"section\"\n  }, \"Take a look at the right-hand side SCHEAM tab. There you'll see a default schema that Nexus has prvoided for you. This, along with the warning you say before, will go away once you begin your own schema.\")), mdx(\"section\", null, mdx(\"h2\", _extends({\n    parentName: \"section\"\n  }, {\n    \"id\": \"wrapping-up\",\n    \"style\": {\n      \"position\": \"relative\"\n    }\n  }), mdx(\"a\", _extends({\n    parentName: \"h2\"\n  }, {\n    \"href\": \"#wrapping-up\",\n    \"aria-label\": \"wrapping up permalink\",\n    \"className\": \"title-link before\"\n  }), mdx(\"svg\", _extends({\n    parentName: \"a\"\n  }, {\n    \"width\": \"17\",\n    \"height\": \"18\",\n    \"viewBox\": \"0 0 17 18\",\n    \"fill\": \"none\",\n    \"xmlns\": \"http://www.w3.org/2000/svg\"\n  }), \"\\n      \", mdx(\"path\", _extends({\n    parentName: \"svg\"\n  }, {\n    \"d\": \"M1.5 6.33337H15.5\",\n    \"stroke\": \"#CBD5E0\",\n    \"strokeWidth\": \"2\",\n    \"strokeLineCap\": \"round\",\n    \"strokeLineJoin\": \"round\"\n  })), \"\\n      \", mdx(\"path\", _extends({\n    parentName: \"svg\"\n  }, {\n    \"d\": \"M1.5 11.6666H15.5\",\n    \"stroke\": \"#CBD5E0\",\n    \"strokeWidth\": \"2\",\n    \"strokeLineCap\": \"round\",\n    \"strokeLineJoin\": \"round\"\n  })), \"\\n      \", mdx(\"path\", _extends({\n    parentName: \"svg\"\n  }, {\n    \"d\": \"M6.75 1L5 17\",\n    \"stroke\": \"#CBD5E0\",\n    \"strokeWidth\": \"2\",\n    \"strokeLineCap\": \"round\",\n    \"strokeLineJoin\": \"round\"\n  })), \"\\n      \", mdx(\"path\", _extends({\n    parentName: \"svg\"\n  }, {\n    \"d\": \"M12 1L10.25 17\",\n    \"stroke\": \"#CBD5E0\",\n    \"strokeWidth\": \"2\",\n    \"strokeLineCap\": \"round\",\n    \"strokeLineJoin\": \"round\"\n  })), \"\\n      \")), \"Wrapping Up\"), mdx(\"p\", {\n    parentName: \"section\"\n  }, \"That's it! In the next chapter you'll begin working on your app's schema.\"), mdx(\"div\", {\n    className: \"NextIs NextChapter\"\n  }), mdx(\"p\", {\n    parentName: \"section\"\n  }, mdx(\"a\", _extends({\n    parentName: \"p\"\n  }, {\n    \"href\": \"/tutorial/chapter-2-writing-your-first-schema\"\n  }), \"\\u27B3\"))));\n}\n;\nMDXContent.isMDXComponent = true;","parent":{"__typename":"File","relativePath":"01-getting-started/03-tutorial/02-chapter-1-setup-and-first-query.mdx"},"tableOfContents":{"items":[{"url":"#chapter-1-br-setup--first-query","title":"Chapter 1 <br/> Setup & First Query"},{"url":"#cli","title":"CLI"},{"url":"#conventional-entrypoint","title":"Conventional Entrypoint"},{"url":"#contextual-feedback","title":"Contextual Feedback"},{"url":"#try-it-out","title":"Try It Out"},{"url":"#wrapping-up","title":"Wrapping Up"}]},"frontmatter":{"title":"1. Setup & First Query","metaTitle":null,"metaDescription":null}}},"pageContext":{"id":"6986adb0-7563-511f-85a9-b7073e489823","seoTitle":"1. Setup & First Query","seoDescription":"1. Setup & First Query"}}}