{"componentChunkName":"component---src-layouts-article-layout-tsx","path":"/api/nexus/settings","result":{"data":{"site":{"siteMetadata":{"docsLocation":"https://github.com/graphql-nexus/docs/tree/master/content"}},"mdx":{"fields":{"slug":"/04-api/01-nexus/04-settings"},"body":"function _extends() { _extends = Object.assign || function (target) { for (var i = 1; i < arguments.length; i++) { var source = arguments[i]; for (var key in source) { if (Object.prototype.hasOwnProperty.call(source, key)) { target[key] = source[key]; } } } return target; }; return _extends.apply(this, arguments); }\n\nfunction _objectWithoutProperties(source, excluded) { if (source == null) return {}; var target = _objectWithoutPropertiesLoose(source, excluded); var key, i; if (Object.getOwnPropertySymbols) { var sourceSymbolKeys = Object.getOwnPropertySymbols(source); for (i = 0; i < sourceSymbolKeys.length; i++) { key = sourceSymbolKeys[i]; if (excluded.indexOf(key) >= 0) continue; if (!Object.prototype.propertyIsEnumerable.call(source, key)) continue; target[key] = source[key]; } } return target; }\n\nfunction _objectWithoutPropertiesLoose(source, excluded) { if (source == null) return {}; var target = {}; var sourceKeys = Object.keys(source); var key, i; for (i = 0; i < sourceKeys.length; i++) { key = sourceKeys[i]; if (excluded.indexOf(key) >= 0) continue; target[key] = source[key]; } return target; }\n\n/* @jsx mdx */\nvar _frontmatter = {\n  \"title\": \"`settings`\"\n};\n\nvar makeShortcode = function makeShortcode(name) {\n  return function MDXDefaultShortcode(props) {\n    console.warn(\"Component \" + name + \" was not imported, exported, or provided by MDXProvider as global scope\");\n    return mdx(\"div\", props);\n  };\n};\n\nvar layoutProps = {\n  _frontmatter: _frontmatter\n};\nvar MDXLayout = \"wrapper\";\nreturn function MDXContent(_ref) {\n  var components = _ref.components,\n      props = _objectWithoutProperties(_ref, [\"components\"]);\n\n  return mdx(MDXLayout, _extends({}, layoutProps, props, {\n    components: components,\n    mdxType: \"MDXLayout\"\n  }), mdx(\"section\", null, mdx(\"h2\", _extends({\n    parentName: \"section\"\n  }, {\n    \"id\": \"import--settings-\",\n    \"style\": {\n      \"position\": \"relative\"\n    }\n  }), mdx(\"a\", _extends({\n    parentName: \"h2\"\n  }, {\n    \"href\": \"#import--settings-\",\n    \"aria-label\": \"import  settings  permalink\",\n    \"className\": \"title-link before\"\n  }), mdx(\"svg\", _extends({\n    parentName: \"a\"\n  }, {\n    \"width\": \"17\",\n    \"height\": \"18\",\n    \"viewBox\": \"0 0 17 18\",\n    \"fill\": \"none\",\n    \"xmlns\": \"http://www.w3.org/2000/svg\"\n  }), \"\\n      \", mdx(\"path\", _extends({\n    parentName: \"svg\"\n  }, {\n    \"d\": \"M1.5 6.33337H15.5\",\n    \"stroke\": \"#CBD5E0\",\n    \"strokeWidth\": \"2\",\n    \"strokeLineCap\": \"round\",\n    \"strokeLineJoin\": \"round\"\n  })), \"\\n      \", mdx(\"path\", _extends({\n    parentName: \"svg\"\n  }, {\n    \"d\": \"M1.5 11.6666H15.5\",\n    \"stroke\": \"#CBD5E0\",\n    \"strokeWidth\": \"2\",\n    \"strokeLineCap\": \"round\",\n    \"strokeLineJoin\": \"round\"\n  })), \"\\n      \", mdx(\"path\", _extends({\n    parentName: \"svg\"\n  }, {\n    \"d\": \"M6.75 1L5 17\",\n    \"stroke\": \"#CBD5E0\",\n    \"strokeWidth\": \"2\",\n    \"strokeLineCap\": \"round\",\n    \"strokeLineJoin\": \"round\"\n  })), \"\\n      \", mdx(\"path\", _extends({\n    parentName: \"svg\"\n  }, {\n    \"d\": \"M12 1L10.25 17\",\n    \"stroke\": \"#CBD5E0\",\n    \"strokeWidth\": \"2\",\n    \"strokeLineCap\": \"round\",\n    \"strokeLineJoin\": \"round\"\n  })), \"\\n      \")), mdx(\"inlineCode\", {\n    parentName: \"h2\"\n  }, \"import { settings }\")), mdx(\"p\", {\n    parentName: \"section\"\n  }, mdx(\"a\", _extends({\n    parentName: \"p\"\n  }, {\n    \"href\": \"https://github.com/graphql-nexus/nexus/labels/scope%2Fsettings\"\n  }), \"issues\"), \" - \", mdx(\"a\", _extends({\n    parentName: \"p\"\n  }, {\n    \"href\": \"https://github.com/graphql-nexus/nexus/issues?q=is%3Aopen+label%3Ascope%2Fsettings+label%3Atype%2Ffeat\"\n  }), mdx(\"inlineCode\", {\n    parentName: \"a\"\n  }, \"feature\")), \" \", mdx(\"a\", _extends({\n    parentName: \"p\"\n  }, {\n    \"href\": \"https://github.com/graphql-nexus/nexus/issues?utf8=%E2%9C%93&q=is%3Aopen+label%3Ascope%2Fsettings+label%3Atype%2Fbug+\"\n  }), mdx(\"inlineCode\", {\n    parentName: \"a\"\n  }, \"bug\"))), mdx(\"p\", {\n    parentName: \"section\"\n  }, \"Use the settings to centrally configure various aspects of the various components.\")), mdx(\"section\", null, mdx(\"h2\", _extends({\n    parentName: \"section\"\n  }, {\n    \"id\": \"change\",\n    \"style\": {\n      \"position\": \"relative\"\n    }\n  }), mdx(\"a\", _extends({\n    parentName: \"h2\"\n  }, {\n    \"href\": \"#change\",\n    \"aria-label\": \"change permalink\",\n    \"className\": \"title-link before\"\n  }), mdx(\"svg\", _extends({\n    parentName: \"a\"\n  }, {\n    \"width\": \"17\",\n    \"height\": \"18\",\n    \"viewBox\": \"0 0 17 18\",\n    \"fill\": \"none\",\n    \"xmlns\": \"http://www.w3.org/2000/svg\"\n  }), \"\\n      \", mdx(\"path\", _extends({\n    parentName: \"svg\"\n  }, {\n    \"d\": \"M1.5 6.33337H15.5\",\n    \"stroke\": \"#CBD5E0\",\n    \"strokeWidth\": \"2\",\n    \"strokeLineCap\": \"round\",\n    \"strokeLineJoin\": \"round\"\n  })), \"\\n      \", mdx(\"path\", _extends({\n    parentName: \"svg\"\n  }, {\n    \"d\": \"M1.5 11.6666H15.5\",\n    \"stroke\": \"#CBD5E0\",\n    \"strokeWidth\": \"2\",\n    \"strokeLineCap\": \"round\",\n    \"strokeLineJoin\": \"round\"\n  })), \"\\n      \", mdx(\"path\", _extends({\n    parentName: \"svg\"\n  }, {\n    \"d\": \"M6.75 1L5 17\",\n    \"stroke\": \"#CBD5E0\",\n    \"strokeWidth\": \"2\",\n    \"strokeLineCap\": \"round\",\n    \"strokeLineJoin\": \"round\"\n  })), \"\\n      \", mdx(\"path\", _extends({\n    parentName: \"svg\"\n  }, {\n    \"d\": \"M12 1L10.25 17\",\n    \"stroke\": \"#CBD5E0\",\n    \"strokeWidth\": \"2\",\n    \"strokeLineCap\": \"round\",\n    \"strokeLineJoin\": \"round\"\n  })), \"\\n      \")), mdx(\"inlineCode\", {\n    parentName: \"h2\"\n  }, \"change\")), mdx(\"pre\", {\n    parentName: \"section\"\n  }, mdx(\"code\", _extends({\n    parentName: \"pre\"\n  }, {\n    \"className\": \"language-ts\"\n  }), \"(settingsInput: {\\n  server?: {\\n    port?: number\\n    host?: string\\n    path?: string\\n    playground?: boolean | { path?: string }\\n  }\\n  schema?: {\\n    nullable?: {\\n      outputs?: boolean\\n      intputs?: boolean\\n    }\\n    connections?: Record<string, ConnectionConfig>\\n    generateGraphQLSDLFile?: false | string\\n    rootTypingsGlobPattern?: string\\n  }\\n  logger?: {\\n    filter?: \\n      | string\\n      | {\\n          level?: Level\\n          pattern?: string\\n        }\\n    pretty?:\\n      | boolean\\n      | {\\n          enabled: boolean\\n          timeDiff: boolean\\n          color: boolean\\n          levelLabel: boolean\\n        }\\n  }\\n}) => Settings\\n\")), mdx(\"p\", {\n    parentName: \"section\"\n  }, \"Change your app's current settings. This is an additive API meaning it can be called multiple times, each time merging with the previous settings.\"), mdx(\"section\", {\n    parentName: \"section\"\n  }, mdx(\"h4\", _extends({\n    parentName: \"section\"\n  }, {\n    \"id\": \"serverplayground\",\n    \"style\": {\n      \"position\": \"relative\"\n    }\n  }), mdx(\"a\", _extends({\n    parentName: \"h4\"\n  }, {\n    \"href\": \"#serverplayground\",\n    \"aria-label\": \"serverplayground permalink\",\n    \"className\": \"title-link before\"\n  }), mdx(\"svg\", _extends({\n    parentName: \"a\"\n  }, {\n    \"width\": \"17\",\n    \"height\": \"18\",\n    \"viewBox\": \"0 0 17 18\",\n    \"fill\": \"none\",\n    \"xmlns\": \"http://www.w3.org/2000/svg\"\n  }), \"\\n      \", mdx(\"path\", _extends({\n    parentName: \"svg\"\n  }, {\n    \"d\": \"M1.5 6.33337H15.5\",\n    \"stroke\": \"#CBD5E0\",\n    \"strokeWidth\": \"2\",\n    \"strokeLineCap\": \"round\",\n    \"strokeLineJoin\": \"round\"\n  })), \"\\n      \", mdx(\"path\", _extends({\n    parentName: \"svg\"\n  }, {\n    \"d\": \"M1.5 11.6666H15.5\",\n    \"stroke\": \"#CBD5E0\",\n    \"strokeWidth\": \"2\",\n    \"strokeLineCap\": \"round\",\n    \"strokeLineJoin\": \"round\"\n  })), \"\\n      \", mdx(\"path\", _extends({\n    parentName: \"svg\"\n  }, {\n    \"d\": \"M6.75 1L5 17\",\n    \"stroke\": \"#CBD5E0\",\n    \"strokeWidth\": \"2\",\n    \"strokeLineCap\": \"round\",\n    \"strokeLineJoin\": \"round\"\n  })), \"\\n      \", mdx(\"path\", _extends({\n    parentName: \"svg\"\n  }, {\n    \"d\": \"M12 1L10.25 17\",\n    \"stroke\": \"#CBD5E0\",\n    \"strokeWidth\": \"2\",\n    \"strokeLineCap\": \"round\",\n    \"strokeLineJoin\": \"round\"\n  })), \"\\n      \")), mdx(\"inlineCode\", {\n    parentName: \"h4\"\n  }, \"server.playground\")), mdx(\"pre\", {\n    parentName: \"section\"\n  }, mdx(\"code\", _extends({\n    parentName: \"pre\"\n  }, {}), \"boolean\\n\")), mdx(\"p\", {\n    parentName: \"section\"\n  }, \"Should the app expose a \", mdx(\"a\", _extends({\n    parentName: \"p\"\n  }, {\n    \"href\": \"https://github.com/prisma-labs/graphql-playground\"\n  }), \"GraphQL Playground\"), \" to clients?\"), mdx(\"p\", {\n    parentName: \"section\"\n  }, mdx(\"em\", {\n    parentName: \"p\"\n  }, \"Default\")), mdx(\"p\", {\n    parentName: \"section\"\n  }, mdx(\"inlineCode\", {\n    parentName: \"p\"\n  }, \"true\"), \" in dev, \", mdx(\"inlineCode\", {\n    parentName: \"p\"\n  }, \"false\"), \" otherwise.\")), mdx(\"section\", {\n    parentName: \"section\"\n  }, mdx(\"h4\", _extends({\n    parentName: \"section\"\n  }, {\n    \"id\": \"serverport\",\n    \"style\": {\n      \"position\": \"relative\"\n    }\n  }), mdx(\"a\", _extends({\n    parentName: \"h4\"\n  }, {\n    \"href\": \"#serverport\",\n    \"aria-label\": \"serverport permalink\",\n    \"className\": \"title-link before\"\n  }), mdx(\"svg\", _extends({\n    parentName: \"a\"\n  }, {\n    \"width\": \"17\",\n    \"height\": \"18\",\n    \"viewBox\": \"0 0 17 18\",\n    \"fill\": \"none\",\n    \"xmlns\": \"http://www.w3.org/2000/svg\"\n  }), \"\\n      \", mdx(\"path\", _extends({\n    parentName: \"svg\"\n  }, {\n    \"d\": \"M1.5 6.33337H15.5\",\n    \"stroke\": \"#CBD5E0\",\n    \"strokeWidth\": \"2\",\n    \"strokeLineCap\": \"round\",\n    \"strokeLineJoin\": \"round\"\n  })), \"\\n      \", mdx(\"path\", _extends({\n    parentName: \"svg\"\n  }, {\n    \"d\": \"M1.5 11.6666H15.5\",\n    \"stroke\": \"#CBD5E0\",\n    \"strokeWidth\": \"2\",\n    \"strokeLineCap\": \"round\",\n    \"strokeLineJoin\": \"round\"\n  })), \"\\n      \", mdx(\"path\", _extends({\n    parentName: \"svg\"\n  }, {\n    \"d\": \"M6.75 1L5 17\",\n    \"stroke\": \"#CBD5E0\",\n    \"strokeWidth\": \"2\",\n    \"strokeLineCap\": \"round\",\n    \"strokeLineJoin\": \"round\"\n  })), \"\\n      \", mdx(\"path\", _extends({\n    parentName: \"svg\"\n  }, {\n    \"d\": \"M12 1L10.25 17\",\n    \"stroke\": \"#CBD5E0\",\n    \"strokeWidth\": \"2\",\n    \"strokeLineCap\": \"round\",\n    \"strokeLineJoin\": \"round\"\n  })), \"\\n      \")), mdx(\"inlineCode\", {\n    parentName: \"h4\"\n  }, \"server.port\")), mdx(\"pre\", {\n    parentName: \"section\"\n  }, mdx(\"code\", _extends({\n    parentName: \"pre\"\n  }, {}), \"number\\n\")), mdx(\"p\", {\n    parentName: \"section\"\n  }, \"The port the server should listen on.\"), mdx(\"p\", {\n    parentName: \"section\"\n  }, mdx(\"em\", {\n    parentName: \"p\"\n  }, \"Default\")), mdx(\"ul\", {\n    parentName: \"section\"\n  }, mdx(\"li\", {\n    parentName: \"ul\"\n  }, \"Is \", mdx(\"inlineCode\", {\n    parentName: \"li\"\n  }, \"NEXUS_PORT\"), \" environment variable set? Then that.\"), mdx(\"li\", {\n    parentName: \"ul\"\n  }, \"Is \", mdx(\"inlineCode\", {\n    parentName: \"li\"\n  }, \"PORT\"), \" environment variable set? Then that.\"), mdx(\"li\", {\n    parentName: \"ul\"\n  }, \"Is \", mdx(\"inlineCode\", {\n    parentName: \"li\"\n  }, \"NODE_ENV\"), \" environment variable \", mdx(\"inlineCode\", {\n    parentName: \"li\"\n  }, \"production\"), \"? Then \", mdx(\"inlineCode\", {\n    parentName: \"li\"\n  }, \"80\")), mdx(\"li\", {\n    parentName: \"ul\"\n  }, \"Else \", mdx(\"inlineCode\", {\n    parentName: \"li\"\n  }, \"4000\")))), mdx(\"section\", {\n    parentName: \"section\"\n  }, mdx(\"h4\", _extends({\n    parentName: \"section\"\n  }, {\n    \"id\": \"serverhost\",\n    \"style\": {\n      \"position\": \"relative\"\n    }\n  }), mdx(\"a\", _extends({\n    parentName: \"h4\"\n  }, {\n    \"href\": \"#serverhost\",\n    \"aria-label\": \"serverhost permalink\",\n    \"className\": \"title-link before\"\n  }), mdx(\"svg\", _extends({\n    parentName: \"a\"\n  }, {\n    \"width\": \"17\",\n    \"height\": \"18\",\n    \"viewBox\": \"0 0 17 18\",\n    \"fill\": \"none\",\n    \"xmlns\": \"http://www.w3.org/2000/svg\"\n  }), \"\\n      \", mdx(\"path\", _extends({\n    parentName: \"svg\"\n  }, {\n    \"d\": \"M1.5 6.33337H15.5\",\n    \"stroke\": \"#CBD5E0\",\n    \"strokeWidth\": \"2\",\n    \"strokeLineCap\": \"round\",\n    \"strokeLineJoin\": \"round\"\n  })), \"\\n      \", mdx(\"path\", _extends({\n    parentName: \"svg\"\n  }, {\n    \"d\": \"M1.5 11.6666H15.5\",\n    \"stroke\": \"#CBD5E0\",\n    \"strokeWidth\": \"2\",\n    \"strokeLineCap\": \"round\",\n    \"strokeLineJoin\": \"round\"\n  })), \"\\n      \", mdx(\"path\", _extends({\n    parentName: \"svg\"\n  }, {\n    \"d\": \"M6.75 1L5 17\",\n    \"stroke\": \"#CBD5E0\",\n    \"strokeWidth\": \"2\",\n    \"strokeLineCap\": \"round\",\n    \"strokeLineJoin\": \"round\"\n  })), \"\\n      \", mdx(\"path\", _extends({\n    parentName: \"svg\"\n  }, {\n    \"d\": \"M12 1L10.25 17\",\n    \"stroke\": \"#CBD5E0\",\n    \"strokeWidth\": \"2\",\n    \"strokeLineCap\": \"round\",\n    \"strokeLineJoin\": \"round\"\n  })), \"\\n      \")), mdx(\"inlineCode\", {\n    parentName: \"h4\"\n  }, \"server.host\")), mdx(\"pre\", {\n    parentName: \"section\"\n  }, mdx(\"code\", _extends({\n    parentName: \"pre\"\n  }, {}), \"string\\n\")), mdx(\"p\", {\n    parentName: \"section\"\n  }, \"The host the server should listen on.\"), mdx(\"p\", {\n    parentName: \"section\"\n  }, mdx(\"em\", {\n    parentName: \"p\"\n  }, \"Default\")), mdx(\"ul\", {\n    parentName: \"section\"\n  }, mdx(\"li\", {\n    parentName: \"ul\"\n  }, \"Is \", mdx(\"inlineCode\", {\n    parentName: \"li\"\n  }, \"HOST\"), \" environment variable set? Then that.\"), mdx(\"li\", {\n    parentName: \"ul\"\n  }, \"Else the \", mdx(\"a\", _extends({\n    parentName: \"li\"\n  }, {\n    \"href\": \"https://nodejs.org/api/net.html#net_server_listen_port_host_backlog_callback\"\n  }), \"Node HTTP server listen default\"), \" which is \", mdx(\"inlineCode\", {\n    parentName: \"li\"\n  }, \"'::'\"), \" if IPv6 is present otherwise \", mdx(\"inlineCode\", {\n    parentName: \"li\"\n  }, \"'0.0.0.0'\"), \" for IPv4.\"))), mdx(\"section\", {\n    parentName: \"section\"\n  }, mdx(\"h4\", _extends({\n    parentName: \"section\"\n  }, {\n    \"id\": \"serverpath\",\n    \"style\": {\n      \"position\": \"relative\"\n    }\n  }), mdx(\"a\", _extends({\n    parentName: \"h4\"\n  }, {\n    \"href\": \"#serverpath\",\n    \"aria-label\": \"serverpath permalink\",\n    \"className\": \"title-link before\"\n  }), mdx(\"svg\", _extends({\n    parentName: \"a\"\n  }, {\n    \"width\": \"17\",\n    \"height\": \"18\",\n    \"viewBox\": \"0 0 17 18\",\n    \"fill\": \"none\",\n    \"xmlns\": \"http://www.w3.org/2000/svg\"\n  }), \"\\n      \", mdx(\"path\", _extends({\n    parentName: \"svg\"\n  }, {\n    \"d\": \"M1.5 6.33337H15.5\",\n    \"stroke\": \"#CBD5E0\",\n    \"strokeWidth\": \"2\",\n    \"strokeLineCap\": \"round\",\n    \"strokeLineJoin\": \"round\"\n  })), \"\\n      \", mdx(\"path\", _extends({\n    parentName: \"svg\"\n  }, {\n    \"d\": \"M1.5 11.6666H15.5\",\n    \"stroke\": \"#CBD5E0\",\n    \"strokeWidth\": \"2\",\n    \"strokeLineCap\": \"round\",\n    \"strokeLineJoin\": \"round\"\n  })), \"\\n      \", mdx(\"path\", _extends({\n    parentName: \"svg\"\n  }, {\n    \"d\": \"M6.75 1L5 17\",\n    \"stroke\": \"#CBD5E0\",\n    \"strokeWidth\": \"2\",\n    \"strokeLineCap\": \"round\",\n    \"strokeLineJoin\": \"round\"\n  })), \"\\n      \", mdx(\"path\", _extends({\n    parentName: \"svg\"\n  }, {\n    \"d\": \"M12 1L10.25 17\",\n    \"stroke\": \"#CBD5E0\",\n    \"strokeWidth\": \"2\",\n    \"strokeLineCap\": \"round\",\n    \"strokeLineJoin\": \"round\"\n  })), \"\\n      \")), mdx(\"inlineCode\", {\n    parentName: \"h4\"\n  }, \"server.path\")), mdx(\"pre\", {\n    parentName: \"section\"\n  }, mdx(\"code\", _extends({\n    parentName: \"pre\"\n  }, {}), \"string\\n\")), mdx(\"p\", {\n    parentName: \"section\"\n  }, \"The path on which the GraphQL API should be served.\"), mdx(\"p\", {\n    parentName: \"section\"\n  }, mdx(\"em\", {\n    parentName: \"p\"\n  }, \"Default\")), mdx(\"p\", {\n    parentName: \"section\"\n  }, mdx(\"inlineCode\", {\n    parentName: \"p\"\n  }, \"/graphql\"))), mdx(\"section\", {\n    parentName: \"section\"\n  }, mdx(\"h4\", _extends({\n    parentName: \"section\"\n  }, {\n    \"id\": \"schemanullableinputs\",\n    \"style\": {\n      \"position\": \"relative\"\n    }\n  }), mdx(\"a\", _extends({\n    parentName: \"h4\"\n  }, {\n    \"href\": \"#schemanullableinputs\",\n    \"aria-label\": \"schemanullableinputs permalink\",\n    \"className\": \"title-link before\"\n  }), mdx(\"svg\", _extends({\n    parentName: \"a\"\n  }, {\n    \"width\": \"17\",\n    \"height\": \"18\",\n    \"viewBox\": \"0 0 17 18\",\n    \"fill\": \"none\",\n    \"xmlns\": \"http://www.w3.org/2000/svg\"\n  }), \"\\n      \", mdx(\"path\", _extends({\n    parentName: \"svg\"\n  }, {\n    \"d\": \"M1.5 6.33337H15.5\",\n    \"stroke\": \"#CBD5E0\",\n    \"strokeWidth\": \"2\",\n    \"strokeLineCap\": \"round\",\n    \"strokeLineJoin\": \"round\"\n  })), \"\\n      \", mdx(\"path\", _extends({\n    parentName: \"svg\"\n  }, {\n    \"d\": \"M1.5 11.6666H15.5\",\n    \"stroke\": \"#CBD5E0\",\n    \"strokeWidth\": \"2\",\n    \"strokeLineCap\": \"round\",\n    \"strokeLineJoin\": \"round\"\n  })), \"\\n      \", mdx(\"path\", _extends({\n    parentName: \"svg\"\n  }, {\n    \"d\": \"M6.75 1L5 17\",\n    \"stroke\": \"#CBD5E0\",\n    \"strokeWidth\": \"2\",\n    \"strokeLineCap\": \"round\",\n    \"strokeLineJoin\": \"round\"\n  })), \"\\n      \", mdx(\"path\", _extends({\n    parentName: \"svg\"\n  }, {\n    \"d\": \"M12 1L10.25 17\",\n    \"stroke\": \"#CBD5E0\",\n    \"strokeWidth\": \"2\",\n    \"strokeLineCap\": \"round\",\n    \"strokeLineJoin\": \"round\"\n  })), \"\\n      \")), mdx(\"inlineCode\", {\n    parentName: \"h4\"\n  }, \"schema.nullable.inputs\")), mdx(\"pre\", {\n    parentName: \"section\"\n  }, mdx(\"code\", _extends({\n    parentName: \"pre\"\n  }, {}), \"boolean\\n\")), mdx(\"p\", {\n    parentName: \"section\"\n  }, \"Should passing arguments be optional for clients by default?\"), mdx(\"p\", {\n    parentName: \"section\"\n  }, mdx(\"em\", {\n    parentName: \"p\"\n  }, \"Default\")), mdx(\"p\", {\n    parentName: \"section\"\n  }, mdx(\"inlineCode\", {\n    parentName: \"p\"\n  }, \"true\"))), mdx(\"section\", {\n    parentName: \"section\"\n  }, mdx(\"h4\", _extends({\n    parentName: \"section\"\n  }, {\n    \"id\": \"schemanullableoutputs\",\n    \"style\": {\n      \"position\": \"relative\"\n    }\n  }), mdx(\"a\", _extends({\n    parentName: \"h4\"\n  }, {\n    \"href\": \"#schemanullableoutputs\",\n    \"aria-label\": \"schemanullableoutputs permalink\",\n    \"className\": \"title-link before\"\n  }), mdx(\"svg\", _extends({\n    parentName: \"a\"\n  }, {\n    \"width\": \"17\",\n    \"height\": \"18\",\n    \"viewBox\": \"0 0 17 18\",\n    \"fill\": \"none\",\n    \"xmlns\": \"http://www.w3.org/2000/svg\"\n  }), \"\\n      \", mdx(\"path\", _extends({\n    parentName: \"svg\"\n  }, {\n    \"d\": \"M1.5 6.33337H15.5\",\n    \"stroke\": \"#CBD5E0\",\n    \"strokeWidth\": \"2\",\n    \"strokeLineCap\": \"round\",\n    \"strokeLineJoin\": \"round\"\n  })), \"\\n      \", mdx(\"path\", _extends({\n    parentName: \"svg\"\n  }, {\n    \"d\": \"M1.5 11.6666H15.5\",\n    \"stroke\": \"#CBD5E0\",\n    \"strokeWidth\": \"2\",\n    \"strokeLineCap\": \"round\",\n    \"strokeLineJoin\": \"round\"\n  })), \"\\n      \", mdx(\"path\", _extends({\n    parentName: \"svg\"\n  }, {\n    \"d\": \"M6.75 1L5 17\",\n    \"stroke\": \"#CBD5E0\",\n    \"strokeWidth\": \"2\",\n    \"strokeLineCap\": \"round\",\n    \"strokeLineJoin\": \"round\"\n  })), \"\\n      \", mdx(\"path\", _extends({\n    parentName: \"svg\"\n  }, {\n    \"d\": \"M12 1L10.25 17\",\n    \"stroke\": \"#CBD5E0\",\n    \"strokeWidth\": \"2\",\n    \"strokeLineCap\": \"round\",\n    \"strokeLineJoin\": \"round\"\n  })), \"\\n      \")), mdx(\"inlineCode\", {\n    parentName: \"h4\"\n  }, \"schema.nullable.outputs\")), mdx(\"pre\", {\n    parentName: \"section\"\n  }, mdx(\"code\", _extends({\n    parentName: \"pre\"\n  }, {}), \"boolean\\n\")), mdx(\"p\", {\n    parentName: \"section\"\n  }, \"Should the data requested by clients \", mdx(\"em\", {\n    parentName: \"p\"\n  }, \"not\"), \" be guaranteed to be returned by default?\"), mdx(\"p\", {\n    parentName: \"section\"\n  }, mdx(\"em\", {\n    parentName: \"p\"\n  }, \"Default\")), mdx(\"p\", {\n    parentName: \"section\"\n  }, mdx(\"inlineCode\", {\n    parentName: \"p\"\n  }, \"true\"))), mdx(\"section\", {\n    parentName: \"section\"\n  }, mdx(\"h4\", _extends({\n    parentName: \"section\"\n  }, {\n    \"id\": \"schemagenerategraphqlsdlfile\",\n    \"style\": {\n      \"position\": \"relative\"\n    }\n  }), mdx(\"a\", _extends({\n    parentName: \"h4\"\n  }, {\n    \"href\": \"#schemagenerategraphqlsdlfile\",\n    \"aria-label\": \"schemagenerategraphqlsdlfile permalink\",\n    \"className\": \"title-link before\"\n  }), mdx(\"svg\", _extends({\n    parentName: \"a\"\n  }, {\n    \"width\": \"17\",\n    \"height\": \"18\",\n    \"viewBox\": \"0 0 17 18\",\n    \"fill\": \"none\",\n    \"xmlns\": \"http://www.w3.org/2000/svg\"\n  }), \"\\n      \", mdx(\"path\", _extends({\n    parentName: \"svg\"\n  }, {\n    \"d\": \"M1.5 6.33337H15.5\",\n    \"stroke\": \"#CBD5E0\",\n    \"strokeWidth\": \"2\",\n    \"strokeLineCap\": \"round\",\n    \"strokeLineJoin\": \"round\"\n  })), \"\\n      \", mdx(\"path\", _extends({\n    parentName: \"svg\"\n  }, {\n    \"d\": \"M1.5 11.6666H15.5\",\n    \"stroke\": \"#CBD5E0\",\n    \"strokeWidth\": \"2\",\n    \"strokeLineCap\": \"round\",\n    \"strokeLineJoin\": \"round\"\n  })), \"\\n      \", mdx(\"path\", _extends({\n    parentName: \"svg\"\n  }, {\n    \"d\": \"M6.75 1L5 17\",\n    \"stroke\": \"#CBD5E0\",\n    \"strokeWidth\": \"2\",\n    \"strokeLineCap\": \"round\",\n    \"strokeLineJoin\": \"round\"\n  })), \"\\n      \", mdx(\"path\", _extends({\n    parentName: \"svg\"\n  }, {\n    \"d\": \"M12 1L10.25 17\",\n    \"stroke\": \"#CBD5E0\",\n    \"strokeWidth\": \"2\",\n    \"strokeLineCap\": \"round\",\n    \"strokeLineJoin\": \"round\"\n  })), \"\\n      \")), mdx(\"inlineCode\", {\n    parentName: \"h4\"\n  }, \"schema.generateGraphQLSDLFile\")), mdx(\"pre\", {\n    parentName: \"section\"\n  }, mdx(\"code\", _extends({\n    parentName: \"pre\"\n  }, {}), \"boolean\\n\")), mdx(\"p\", {\n    parentName: \"section\"\n  }, \"Should a \", mdx(\"a\", _extends({\n    parentName: \"p\"\n  }, {\n    \"href\": \"https://www.prisma.io/blog/graphql-sdl-schema-definition-language-6755bcb9ce51\"\n  }), \"GraphQL SDL file\"), \" be generated when the app is built and to where?\"), mdx(\"p\", {\n    parentName: \"section\"\n  }, \"A relative path is interpreted as being relative to the project directory. Intermediary folders are created automatically if they do not exist already.\"), mdx(\"p\", {\n    parentName: \"section\"\n  }, mdx(\"em\", {\n    parentName: \"p\"\n  }, \"Default\")), mdx(\"p\", {\n    parentName: \"section\"\n  }, mdx(\"inlineCode\", {\n    parentName: \"p\"\n  }, \"false\"))), mdx(\"section\", {\n    parentName: \"section\"\n  }, mdx(\"h4\", _extends({\n    parentName: \"section\"\n  }, {\n    \"id\": \"schemaroottypingsglobpattern\",\n    \"style\": {\n      \"position\": \"relative\"\n    }\n  }), mdx(\"a\", _extends({\n    parentName: \"h4\"\n  }, {\n    \"href\": \"#schemaroottypingsglobpattern\",\n    \"aria-label\": \"schemaroottypingsglobpattern permalink\",\n    \"className\": \"title-link before\"\n  }), mdx(\"svg\", _extends({\n    parentName: \"a\"\n  }, {\n    \"width\": \"17\",\n    \"height\": \"18\",\n    \"viewBox\": \"0 0 17 18\",\n    \"fill\": \"none\",\n    \"xmlns\": \"http://www.w3.org/2000/svg\"\n  }), \"\\n      \", mdx(\"path\", _extends({\n    parentName: \"svg\"\n  }, {\n    \"d\": \"M1.5 6.33337H15.5\",\n    \"stroke\": \"#CBD5E0\",\n    \"strokeWidth\": \"2\",\n    \"strokeLineCap\": \"round\",\n    \"strokeLineJoin\": \"round\"\n  })), \"\\n      \", mdx(\"path\", _extends({\n    parentName: \"svg\"\n  }, {\n    \"d\": \"M1.5 11.6666H15.5\",\n    \"stroke\": \"#CBD5E0\",\n    \"strokeWidth\": \"2\",\n    \"strokeLineCap\": \"round\",\n    \"strokeLineJoin\": \"round\"\n  })), \"\\n      \", mdx(\"path\", _extends({\n    parentName: \"svg\"\n  }, {\n    \"d\": \"M6.75 1L5 17\",\n    \"stroke\": \"#CBD5E0\",\n    \"strokeWidth\": \"2\",\n    \"strokeLineCap\": \"round\",\n    \"strokeLineJoin\": \"round\"\n  })), \"\\n      \", mdx(\"path\", _extends({\n    parentName: \"svg\"\n  }, {\n    \"d\": \"M12 1L10.25 17\",\n    \"stroke\": \"#CBD5E0\",\n    \"strokeWidth\": \"2\",\n    \"strokeLineCap\": \"round\",\n    \"strokeLineJoin\": \"round\"\n  })), \"\\n      \")), mdx(\"inlineCode\", {\n    parentName: \"h4\"\n  }, \"schema.rootTypingsGlobPattern\")), mdx(\"pre\", {\n    parentName: \"section\"\n  }, mdx(\"code\", _extends({\n    parentName: \"pre\"\n  }, {}), \"string\\n\")), mdx(\"p\", {\n    parentName: \"section\"\n  }, \"A glob pattern which will be used to find the files from which to extract the backing types used in the \", mdx(\"inlineCode\", {\n    parentName: \"p\"\n  }, \"rootTyping\"), \" option of \", mdx(\"inlineCode\", {\n    parentName: \"p\"\n  }, \"schema.(objectType|interfaceType|unionType|enumType)\")), mdx(\"p\", {\n    parentName: \"section\"\n  }, mdx(\"em\", {\n    parentName: \"p\"\n  }, \"Default\")), mdx(\"p\", {\n    parentName: \"section\"\n  }, \"The default glob pattern used id \", mdx(\"inlineCode\", {\n    parentName: \"p\"\n  }, \"./**/*.ts\"))), mdx(\"section\", {\n    parentName: \"section\"\n  }, mdx(\"h4\", _extends({\n    parentName: \"section\"\n  }, {\n    \"id\": \"schemaconnections\",\n    \"style\": {\n      \"position\": \"relative\"\n    }\n  }), mdx(\"a\", _extends({\n    parentName: \"h4\"\n  }, {\n    \"href\": \"#schemaconnections\",\n    \"aria-label\": \"schemaconnections permalink\",\n    \"className\": \"title-link before\"\n  }), mdx(\"svg\", _extends({\n    parentName: \"a\"\n  }, {\n    \"width\": \"17\",\n    \"height\": \"18\",\n    \"viewBox\": \"0 0 17 18\",\n    \"fill\": \"none\",\n    \"xmlns\": \"http://www.w3.org/2000/svg\"\n  }), \"\\n      \", mdx(\"path\", _extends({\n    parentName: \"svg\"\n  }, {\n    \"d\": \"M1.5 6.33337H15.5\",\n    \"stroke\": \"#CBD5E0\",\n    \"strokeWidth\": \"2\",\n    \"strokeLineCap\": \"round\",\n    \"strokeLineJoin\": \"round\"\n  })), \"\\n      \", mdx(\"path\", _extends({\n    parentName: \"svg\"\n  }, {\n    \"d\": \"M1.5 11.6666H15.5\",\n    \"stroke\": \"#CBD5E0\",\n    \"strokeWidth\": \"2\",\n    \"strokeLineCap\": \"round\",\n    \"strokeLineJoin\": \"round\"\n  })), \"\\n      \", mdx(\"path\", _extends({\n    parentName: \"svg\"\n  }, {\n    \"d\": \"M6.75 1L5 17\",\n    \"stroke\": \"#CBD5E0\",\n    \"strokeWidth\": \"2\",\n    \"strokeLineCap\": \"round\",\n    \"strokeLineJoin\": \"round\"\n  })), \"\\n      \", mdx(\"path\", _extends({\n    parentName: \"svg\"\n  }, {\n    \"d\": \"M12 1L10.25 17\",\n    \"stroke\": \"#CBD5E0\",\n    \"strokeWidth\": \"2\",\n    \"strokeLineCap\": \"round\",\n    \"strokeLineJoin\": \"round\"\n  })), \"\\n      \")), mdx(\"inlineCode\", {\n    parentName: \"h4\"\n  }, \"schema.connections\")), mdx(\"pre\", {\n    parentName: \"section\"\n  }, mdx(\"code\", _extends({\n    parentName: \"pre\"\n  }, {\n    \"className\": \"language-ts\"\n  }), \"Record<string, ConnectionConfig>\\n\")), mdx(\"p\", {\n    parentName: \"section\"\n  }, \"todo\"), mdx(\"section\", {\n    parentName: \"section\"\n  }, mdx(\"h6\", _extends({\n    parentName: \"section\"\n  }, {\n    \"id\": \"example-of-adding-a-specialized-kind-of-connection-field-builder-docsify-ignore\",\n    \"style\": {\n      \"position\": \"relative\"\n    }\n  }), mdx(\"a\", _extends({\n    parentName: \"h6\"\n  }, {\n    \"href\": \"#example-of-adding-a-specialized-kind-of-connection-field-builder-docsify-ignore\",\n    \"aria-label\": \"example of adding a specialized kind of connection field builder docsify ignore permalink\",\n    \"className\": \"title-link before\"\n  }), mdx(\"svg\", _extends({\n    parentName: \"a\"\n  }, {\n    \"width\": \"17\",\n    \"height\": \"18\",\n    \"viewBox\": \"0 0 17 18\",\n    \"fill\": \"none\",\n    \"xmlns\": \"http://www.w3.org/2000/svg\"\n  }), \"\\n      \", mdx(\"path\", _extends({\n    parentName: \"svg\"\n  }, {\n    \"d\": \"M1.5 6.33337H15.5\",\n    \"stroke\": \"#CBD5E0\",\n    \"strokeWidth\": \"2\",\n    \"strokeLineCap\": \"round\",\n    \"strokeLineJoin\": \"round\"\n  })), \"\\n      \", mdx(\"path\", _extends({\n    parentName: \"svg\"\n  }, {\n    \"d\": \"M1.5 11.6666H15.5\",\n    \"stroke\": \"#CBD5E0\",\n    \"strokeWidth\": \"2\",\n    \"strokeLineCap\": \"round\",\n    \"strokeLineJoin\": \"round\"\n  })), \"\\n      \", mdx(\"path\", _extends({\n    parentName: \"svg\"\n  }, {\n    \"d\": \"M6.75 1L5 17\",\n    \"stroke\": \"#CBD5E0\",\n    \"strokeWidth\": \"2\",\n    \"strokeLineCap\": \"round\",\n    \"strokeLineJoin\": \"round\"\n  })), \"\\n      \", mdx(\"path\", _extends({\n    parentName: \"svg\"\n  }, {\n    \"d\": \"M12 1L10.25 17\",\n    \"stroke\": \"#CBD5E0\",\n    \"strokeWidth\": \"2\",\n    \"strokeLineCap\": \"round\",\n    \"strokeLineJoin\": \"round\"\n  })), \"\\n      \")), \"Example of adding a specialized kind of connection field builder {docsify-ignore}\"), mdx(\"pre\", {\n    parentName: \"section\"\n  }, mdx(\"code\", _extends({\n    parentName: \"pre\"\n  }, {\n    \"className\": \"language-ts\"\n  }), \"import { settings } from 'nexus'\\n\\nsettings.change({\\n  schema: {\\n    connections: {\\n      analyticsConnection: {\\n        typePrefix: 'Analytics',\\n        extendConnection: {\\n          totalCount: { type: 'Int' },\\n          avgDuration: { type: 'Int' },\\n        },\\n      },\\n    },\\n  },\\n})\\n\"))), mdx(\"section\", {\n    parentName: \"section\"\n  }, mdx(\"h6\", _extends({\n    parentName: \"section\"\n  }, {\n    \"id\": \"example-of-including-a-nodes-field-like-github-api-globally-docsify-ignore\",\n    \"style\": {\n      \"position\": \"relative\"\n    }\n  }), mdx(\"a\", _extends({\n    parentName: \"h6\"\n  }, {\n    \"href\": \"#example-of-including-a-nodes-field-like-github-api-globally-docsify-ignore\",\n    \"aria-label\": \"example of including a nodes field like github api globally docsify ignore permalink\",\n    \"className\": \"title-link before\"\n  }), mdx(\"svg\", _extends({\n    parentName: \"a\"\n  }, {\n    \"width\": \"17\",\n    \"height\": \"18\",\n    \"viewBox\": \"0 0 17 18\",\n    \"fill\": \"none\",\n    \"xmlns\": \"http://www.w3.org/2000/svg\"\n  }), \"\\n      \", mdx(\"path\", _extends({\n    parentName: \"svg\"\n  }, {\n    \"d\": \"M1.5 6.33337H15.5\",\n    \"stroke\": \"#CBD5E0\",\n    \"strokeWidth\": \"2\",\n    \"strokeLineCap\": \"round\",\n    \"strokeLineJoin\": \"round\"\n  })), \"\\n      \", mdx(\"path\", _extends({\n    parentName: \"svg\"\n  }, {\n    \"d\": \"M1.5 11.6666H15.5\",\n    \"stroke\": \"#CBD5E0\",\n    \"strokeWidth\": \"2\",\n    \"strokeLineCap\": \"round\",\n    \"strokeLineJoin\": \"round\"\n  })), \"\\n      \", mdx(\"path\", _extends({\n    parentName: \"svg\"\n  }, {\n    \"d\": \"M6.75 1L5 17\",\n    \"stroke\": \"#CBD5E0\",\n    \"strokeWidth\": \"2\",\n    \"strokeLineCap\": \"round\",\n    \"strokeLineJoin\": \"round\"\n  })), \"\\n      \", mdx(\"path\", _extends({\n    parentName: \"svg\"\n  }, {\n    \"d\": \"M12 1L10.25 17\",\n    \"stroke\": \"#CBD5E0\",\n    \"strokeWidth\": \"2\",\n    \"strokeLineCap\": \"round\",\n    \"strokeLineJoin\": \"round\"\n  })), \"\\n      \")), \"Example of including a \", mdx(\"inlineCode\", {\n    parentName: \"h6\"\n  }, \"nodes\"), \" field like GitHub API globally {docsify-ignore}\"), mdx(\"p\", {\n    parentName: \"section\"\n  }, \"If you want to include a \", mdx(\"inlineCode\", {\n    parentName: \"p\"\n  }, \"nodes\"), \" field, which includes the nodes of the connection flattened into an array similar to how GitHub does in their \", mdx(\"a\", _extends({\n    parentName: \"p\"\n  }, {\n    \"href\": \"https://developer.github.com/v4/\"\n  }), \"GraphQL API\"), \", set schema setting \", mdx(\"inlineCode\", {\n    parentName: \"p\"\n  }, \"includeNodesField\"), \" to \", mdx(\"inlineCode\", {\n    parentName: \"p\"\n  }, \"true\"), \".\"), mdx(\"pre\", {\n    parentName: \"section\"\n  }, mdx(\"code\", _extends({\n    parentName: \"pre\"\n  }, {\n    \"className\": \"language-ts\"\n  }), \"import { settings } from 'nexus'\\n\\nsettings.change({\\n  schema: {\\n    connections: {\\n      default: {\\n        includeNodesField: true,\\n      },\\n    },\\n  },\\n})\\n\")), mdx(\"pre\", {\n    parentName: \"section\"\n  }, mdx(\"code\", _extends({\n    parentName: \"pre\"\n  }, {\n    \"className\": \"language-graphql\"\n  }), \"query IncludeNodesFieldExample {\\n  users(first: 10) {\\n    nodes {\\n      id\\n    }\\n    pageInfo {\\n      endCursor\\n      hasNextPage\\n    }\\n  }\\n}\\n\")))), mdx(\"section\", {\n    parentName: \"section\"\n  }, mdx(\"h4\", _extends({\n    parentName: \"section\"\n  }, {\n    \"id\": \"loggerfilter\",\n    \"style\": {\n      \"position\": \"relative\"\n    }\n  }), mdx(\"a\", _extends({\n    parentName: \"h4\"\n  }, {\n    \"href\": \"#loggerfilter\",\n    \"aria-label\": \"loggerfilter permalink\",\n    \"className\": \"title-link before\"\n  }), mdx(\"svg\", _extends({\n    parentName: \"a\"\n  }, {\n    \"width\": \"17\",\n    \"height\": \"18\",\n    \"viewBox\": \"0 0 17 18\",\n    \"fill\": \"none\",\n    \"xmlns\": \"http://www.w3.org/2000/svg\"\n  }), \"\\n      \", mdx(\"path\", _extends({\n    parentName: \"svg\"\n  }, {\n    \"d\": \"M1.5 6.33337H15.5\",\n    \"stroke\": \"#CBD5E0\",\n    \"strokeWidth\": \"2\",\n    \"strokeLineCap\": \"round\",\n    \"strokeLineJoin\": \"round\"\n  })), \"\\n      \", mdx(\"path\", _extends({\n    parentName: \"svg\"\n  }, {\n    \"d\": \"M1.5 11.6666H15.5\",\n    \"stroke\": \"#CBD5E0\",\n    \"strokeWidth\": \"2\",\n    \"strokeLineCap\": \"round\",\n    \"strokeLineJoin\": \"round\"\n  })), \"\\n      \", mdx(\"path\", _extends({\n    parentName: \"svg\"\n  }, {\n    \"d\": \"M6.75 1L5 17\",\n    \"stroke\": \"#CBD5E0\",\n    \"strokeWidth\": \"2\",\n    \"strokeLineCap\": \"round\",\n    \"strokeLineJoin\": \"round\"\n  })), \"\\n      \", mdx(\"path\", _extends({\n    parentName: \"svg\"\n  }, {\n    \"d\": \"M12 1L10.25 17\",\n    \"stroke\": \"#CBD5E0\",\n    \"strokeWidth\": \"2\",\n    \"strokeLineCap\": \"round\",\n    \"strokeLineJoin\": \"round\"\n  })), \"\\n      \")), mdx(\"inlineCode\", {\n    parentName: \"h4\"\n  }, \"logger.filter\")), mdx(\"pre\", {\n    parentName: \"section\"\n  }, mdx(\"code\", _extends({\n    parentName: \"pre\"\n  }, {}), \"string | { level?: Level, pattern?: string }\\n\")), mdx(\"p\", {\n    parentName: \"section\"\n  }, mdx(\"inlineCode\", {\n    parentName: \"p\"\n  }, \"string\"), \" form is shorthand for \", mdx(\"inlineCode\", {\n    parentName: \"p\"\n  }, \"logger.filter.pattern\"), \". See below for object form.\")), mdx(\"section\", {\n    parentName: \"section\"\n  }, mdx(\"h4\", _extends({\n    parentName: \"section\"\n  }, {\n    \"id\": \"loggerfilterlevel\",\n    \"style\": {\n      \"position\": \"relative\"\n    }\n  }), mdx(\"a\", _extends({\n    parentName: \"h4\"\n  }, {\n    \"href\": \"#loggerfilterlevel\",\n    \"aria-label\": \"loggerfilterlevel permalink\",\n    \"className\": \"title-link before\"\n  }), mdx(\"svg\", _extends({\n    parentName: \"a\"\n  }, {\n    \"width\": \"17\",\n    \"height\": \"18\",\n    \"viewBox\": \"0 0 17 18\",\n    \"fill\": \"none\",\n    \"xmlns\": \"http://www.w3.org/2000/svg\"\n  }), \"\\n      \", mdx(\"path\", _extends({\n    parentName: \"svg\"\n  }, {\n    \"d\": \"M1.5 6.33337H15.5\",\n    \"stroke\": \"#CBD5E0\",\n    \"strokeWidth\": \"2\",\n    \"strokeLineCap\": \"round\",\n    \"strokeLineJoin\": \"round\"\n  })), \"\\n      \", mdx(\"path\", _extends({\n    parentName: \"svg\"\n  }, {\n    \"d\": \"M1.5 11.6666H15.5\",\n    \"stroke\": \"#CBD5E0\",\n    \"strokeWidth\": \"2\",\n    \"strokeLineCap\": \"round\",\n    \"strokeLineJoin\": \"round\"\n  })), \"\\n      \", mdx(\"path\", _extends({\n    parentName: \"svg\"\n  }, {\n    \"d\": \"M6.75 1L5 17\",\n    \"stroke\": \"#CBD5E0\",\n    \"strokeWidth\": \"2\",\n    \"strokeLineCap\": \"round\",\n    \"strokeLineJoin\": \"round\"\n  })), \"\\n      \", mdx(\"path\", _extends({\n    parentName: \"svg\"\n  }, {\n    \"d\": \"M12 1L10.25 17\",\n    \"stroke\": \"#CBD5E0\",\n    \"strokeWidth\": \"2\",\n    \"strokeLineCap\": \"round\",\n    \"strokeLineJoin\": \"round\"\n  })), \"\\n      \")), mdx(\"inlineCode\", {\n    parentName: \"h4\"\n  }, \"logger.filter.level\")), mdx(\"p\", {\n    parentName: \"section\"\n  }, \"Set the defualt filter level. This setting is used whenever a filter pattern does not specify the level. For example filter patterns like \", mdx(\"inlineCode\", {\n    parentName: \"p\"\n  }, \"*\"), \" \", mdx(\"inlineCode\", {\n    parentName: \"p\"\n  }, \"app\"), \" and \", mdx(\"inlineCode\", {\n    parentName: \"p\"\n  }, \"app:*\"), \" would use this setting but filter patterns like \", mdx(\"inlineCode\", {\n    parentName: \"p\"\n  }, \"*@*\"), \" \", mdx(\"inlineCode\", {\n    parentName: \"p\"\n  }, \"app@info+\"), \" \", mdx(\"inlineCode\", {\n    parentName: \"p\"\n  }, \"app:router@trace\"), \" would not.\"), mdx(\"p\", {\n    parentName: \"section\"\n  }, \"When a log falls below the set level then it is not sent to the logger output (typically stdout).\"), mdx(\"p\", {\n    parentName: \"section\"\n  }, mdx(\"em\", {\n    parentName: \"p\"\n  }, \"Default\")), mdx(\"p\", {\n    parentName: \"section\"\n  }, \"First found in the following order\"), mdx(\"ol\", {\n    parentName: \"section\"\n  }, mdx(\"li\", {\n    parentName: \"ol\"\n  }, mdx(\"inlineCode\", {\n    parentName: \"li\"\n  }, \"LOG_LEVEL\"), \" envar\"), mdx(\"li\", {\n    parentName: \"ol\"\n  }, mdx(\"inlineCode\", {\n    parentName: \"li\"\n  }, \"'info'\"), \" if \", mdx(\"inlineCode\", {\n    parentName: \"li\"\n  }, \"NODE_ENV=production\")), mdx(\"li\", {\n    parentName: \"ol\"\n  }, mdx(\"inlineCode\", {\n    parentName: \"li\"\n  }, \"'debug'\")))), mdx(\"section\", {\n    parentName: \"section\"\n  }, mdx(\"h4\", _extends({\n    parentName: \"section\"\n  }, {\n    \"id\": \"loggerfilterpattern\",\n    \"style\": {\n      \"position\": \"relative\"\n    }\n  }), mdx(\"a\", _extends({\n    parentName: \"h4\"\n  }, {\n    \"href\": \"#loggerfilterpattern\",\n    \"aria-label\": \"loggerfilterpattern permalink\",\n    \"className\": \"title-link before\"\n  }), mdx(\"svg\", _extends({\n    parentName: \"a\"\n  }, {\n    \"width\": \"17\",\n    \"height\": \"18\",\n    \"viewBox\": \"0 0 17 18\",\n    \"fill\": \"none\",\n    \"xmlns\": \"http://www.w3.org/2000/svg\"\n  }), \"\\n      \", mdx(\"path\", _extends({\n    parentName: \"svg\"\n  }, {\n    \"d\": \"M1.5 6.33337H15.5\",\n    \"stroke\": \"#CBD5E0\",\n    \"strokeWidth\": \"2\",\n    \"strokeLineCap\": \"round\",\n    \"strokeLineJoin\": \"round\"\n  })), \"\\n      \", mdx(\"path\", _extends({\n    parentName: \"svg\"\n  }, {\n    \"d\": \"M1.5 11.6666H15.5\",\n    \"stroke\": \"#CBD5E0\",\n    \"strokeWidth\": \"2\",\n    \"strokeLineCap\": \"round\",\n    \"strokeLineJoin\": \"round\"\n  })), \"\\n      \", mdx(\"path\", _extends({\n    parentName: \"svg\"\n  }, {\n    \"d\": \"M6.75 1L5 17\",\n    \"stroke\": \"#CBD5E0\",\n    \"strokeWidth\": \"2\",\n    \"strokeLineCap\": \"round\",\n    \"strokeLineJoin\": \"round\"\n  })), \"\\n      \", mdx(\"path\", _extends({\n    parentName: \"svg\"\n  }, {\n    \"d\": \"M12 1L10.25 17\",\n    \"stroke\": \"#CBD5E0\",\n    \"strokeWidth\": \"2\",\n    \"strokeLineCap\": \"round\",\n    \"strokeLineJoin\": \"round\"\n  })), \"\\n      \")), mdx(\"inlineCode\", {\n    parentName: \"h4\"\n  }, \"logger.filter.pattern\")), mdx(\"pre\", {\n    parentName: \"section\"\n  }, mdx(\"code\", _extends({\n    parentName: \"pre\"\n  }, {}), \"string\\n\")), mdx(\"p\", {\n    parentName: \"section\"\n  }, \"Filter logs by path and/or level.\"), mdx(\"p\", {\n    parentName: \"section\"\n  }, mdx(\"em\", {\n    parentName: \"p\"\n  }, \"Default\")), mdx(\"p\", {\n    parentName: \"section\"\n  }, mdx(\"inlineCode\", {\n    parentName: \"p\"\n  }, \"'app:*, nexus:*@info+, *@warn+'\")), mdx(\"section\", {\n    parentName: \"section\"\n  }, mdx(\"h5\", _extends({\n    parentName: \"section\"\n  }, {\n    \"id\": \"examples\",\n    \"style\": {\n      \"position\": \"relative\"\n    }\n  }), mdx(\"a\", _extends({\n    parentName: \"h5\"\n  }, {\n    \"href\": \"#examples\",\n    \"aria-label\": \"examples permalink\",\n    \"className\": \"title-link before\"\n  }), mdx(\"svg\", _extends({\n    parentName: \"a\"\n  }, {\n    \"width\": \"17\",\n    \"height\": \"18\",\n    \"viewBox\": \"0 0 17 18\",\n    \"fill\": \"none\",\n    \"xmlns\": \"http://www.w3.org/2000/svg\"\n  }), \"\\n      \", mdx(\"path\", _extends({\n    parentName: \"svg\"\n  }, {\n    \"d\": \"M1.5 6.33337H15.5\",\n    \"stroke\": \"#CBD5E0\",\n    \"strokeWidth\": \"2\",\n    \"strokeLineCap\": \"round\",\n    \"strokeLineJoin\": \"round\"\n  })), \"\\n      \", mdx(\"path\", _extends({\n    parentName: \"svg\"\n  }, {\n    \"d\": \"M1.5 11.6666H15.5\",\n    \"stroke\": \"#CBD5E0\",\n    \"strokeWidth\": \"2\",\n    \"strokeLineCap\": \"round\",\n    \"strokeLineJoin\": \"round\"\n  })), \"\\n      \", mdx(\"path\", _extends({\n    parentName: \"svg\"\n  }, {\n    \"d\": \"M6.75 1L5 17\",\n    \"stroke\": \"#CBD5E0\",\n    \"strokeWidth\": \"2\",\n    \"strokeLineCap\": \"round\",\n    \"strokeLineJoin\": \"round\"\n  })), \"\\n      \", mdx(\"path\", _extends({\n    parentName: \"svg\"\n  }, {\n    \"d\": \"M12 1L10.25 17\",\n    \"stroke\": \"#CBD5E0\",\n    \"strokeWidth\": \"2\",\n    \"strokeLineCap\": \"round\",\n    \"strokeLineJoin\": \"round\"\n  })), \"\\n      \")), \"Examples\"), mdx(\"pre\", {\n    parentName: \"section\"\n  }, mdx(\"code\", _extends({\n    parentName: \"pre\"\n  }, {}), \"    All logs at...\\n\\n    Path\\n    app         app path at default level\\n    app:router  app:router path at default level\\n\\n    List\\n    app,nexus   app and nexus paths at default level\\n\\n    Path Wildcard\\n    *           any path at default level\\n    app:*       app path plus descendants at defualt level\\n    app::*      app path descendants at defualt level\\n\\n    Negation\\n    !app      any path at any level _except_ those at app path at default level\\n    !*        no path (meaning, nothing will be logged)\\n\\n    Removal\\n    *,!app      any path at default level _except_ logs at app path at default level\\n    *,!*@2-     any path _except_ those at debug level or lower\\n    app,!app@4  app path at defualt level _except_ those at warn level\\n\\n    Levels\\n    *@info      all paths at info level\\n    *@error-    all paths at error level or lower\\n    *@debug+    all paths at debug level or higher\\n    *@3         all paths at info level\\n    *@4-        all paths at error level or lower\\n    *@2+        all paths at debug level or higher\\n    app:*@2-    app path plus descendants at debug level or lower\\n    app::*@2+   app path descendants at debug level or higher\\n\\n    Level Wildcard\\n    app@*       app path at all levels\\n    *@*         all paths at all levels\\n\\n    Explicit Root\\n    .           root path at defualt level\\n    .@info      root path at info level\\n    .:app       Same as \\\"app\\\"\\n    .:*         Same as \\\"*\\\"\\n\")))), mdx(\"section\", {\n    parentName: \"section\"\n  }, mdx(\"h4\", _extends({\n    parentName: \"section\"\n  }, {\n    \"id\": \"loggerpretty\",\n    \"style\": {\n      \"position\": \"relative\"\n    }\n  }), mdx(\"a\", _extends({\n    parentName: \"h4\"\n  }, {\n    \"href\": \"#loggerpretty\",\n    \"aria-label\": \"loggerpretty permalink\",\n    \"className\": \"title-link before\"\n  }), mdx(\"svg\", _extends({\n    parentName: \"a\"\n  }, {\n    \"width\": \"17\",\n    \"height\": \"18\",\n    \"viewBox\": \"0 0 17 18\",\n    \"fill\": \"none\",\n    \"xmlns\": \"http://www.w3.org/2000/svg\"\n  }), \"\\n      \", mdx(\"path\", _extends({\n    parentName: \"svg\"\n  }, {\n    \"d\": \"M1.5 6.33337H15.5\",\n    \"stroke\": \"#CBD5E0\",\n    \"strokeWidth\": \"2\",\n    \"strokeLineCap\": \"round\",\n    \"strokeLineJoin\": \"round\"\n  })), \"\\n      \", mdx(\"path\", _extends({\n    parentName: \"svg\"\n  }, {\n    \"d\": \"M1.5 11.6666H15.5\",\n    \"stroke\": \"#CBD5E0\",\n    \"strokeWidth\": \"2\",\n    \"strokeLineCap\": \"round\",\n    \"strokeLineJoin\": \"round\"\n  })), \"\\n      \", mdx(\"path\", _extends({\n    parentName: \"svg\"\n  }, {\n    \"d\": \"M6.75 1L5 17\",\n    \"stroke\": \"#CBD5E0\",\n    \"strokeWidth\": \"2\",\n    \"strokeLineCap\": \"round\",\n    \"strokeLineJoin\": \"round\"\n  })), \"\\n      \", mdx(\"path\", _extends({\n    parentName: \"svg\"\n  }, {\n    \"d\": \"M12 1L10.25 17\",\n    \"stroke\": \"#CBD5E0\",\n    \"strokeWidth\": \"2\",\n    \"strokeLineCap\": \"round\",\n    \"strokeLineJoin\": \"round\"\n  })), \"\\n      \")), mdx(\"inlineCode\", {\n    parentName: \"h4\"\n  }, \"logger.pretty\")), mdx(\"p\", {\n    parentName: \"section\"\n  }, \"Shorthand for \", mdx(\"inlineCode\", {\n    parentName: \"p\"\n  }, \"logger.pretty.enabled\"), \".\")), mdx(\"section\", {\n    parentName: \"section\"\n  }, mdx(\"h4\", _extends({\n    parentName: \"section\"\n  }, {\n    \"id\": \"loggerprettyenabled\",\n    \"style\": {\n      \"position\": \"relative\"\n    }\n  }), mdx(\"a\", _extends({\n    parentName: \"h4\"\n  }, {\n    \"href\": \"#loggerprettyenabled\",\n    \"aria-label\": \"loggerprettyenabled permalink\",\n    \"className\": \"title-link before\"\n  }), mdx(\"svg\", _extends({\n    parentName: \"a\"\n  }, {\n    \"width\": \"17\",\n    \"height\": \"18\",\n    \"viewBox\": \"0 0 17 18\",\n    \"fill\": \"none\",\n    \"xmlns\": \"http://www.w3.org/2000/svg\"\n  }), \"\\n      \", mdx(\"path\", _extends({\n    parentName: \"svg\"\n  }, {\n    \"d\": \"M1.5 6.33337H15.5\",\n    \"stroke\": \"#CBD5E0\",\n    \"strokeWidth\": \"2\",\n    \"strokeLineCap\": \"round\",\n    \"strokeLineJoin\": \"round\"\n  })), \"\\n      \", mdx(\"path\", _extends({\n    parentName: \"svg\"\n  }, {\n    \"d\": \"M1.5 11.6666H15.5\",\n    \"stroke\": \"#CBD5E0\",\n    \"strokeWidth\": \"2\",\n    \"strokeLineCap\": \"round\",\n    \"strokeLineJoin\": \"round\"\n  })), \"\\n      \", mdx(\"path\", _extends({\n    parentName: \"svg\"\n  }, {\n    \"d\": \"M6.75 1L5 17\",\n    \"stroke\": \"#CBD5E0\",\n    \"strokeWidth\": \"2\",\n    \"strokeLineCap\": \"round\",\n    \"strokeLineJoin\": \"round\"\n  })), \"\\n      \", mdx(\"path\", _extends({\n    parentName: \"svg\"\n  }, {\n    \"d\": \"M12 1L10.25 17\",\n    \"stroke\": \"#CBD5E0\",\n    \"strokeWidth\": \"2\",\n    \"strokeLineCap\": \"round\",\n    \"strokeLineJoin\": \"round\"\n  })), \"\\n      \")), mdx(\"inlineCode\", {\n    parentName: \"h4\"\n  }, \"logger.pretty.enabled\")), mdx(\"p\", {\n    parentName: \"section\"\n  }, \"Should logs be logged with rich formatting etc. (\", mdx(\"inlineCode\", {\n    parentName: \"p\"\n  }, \"true\"), \"), or as JSON (\", mdx(\"inlineCode\", {\n    parentName: \"p\"\n  }, \"false\"), \")?\"), mdx(\"p\", {\n    parentName: \"section\"\n  }, mdx(\"em\", {\n    parentName: \"p\"\n  }, \"Default\")), mdx(\"ul\", {\n    parentName: \"section\"\n  }, mdx(\"li\", {\n    parentName: \"ul\"\n  }, \"Is \", mdx(\"inlineCode\", {\n    parentName: \"li\"\n  }, \"LOG_PRETTY\"), \" environment variable \", mdx(\"inlineCode\", {\n    parentName: \"li\"\n  }, \"true\"), \"? Then \", mdx(\"inlineCode\", {\n    parentName: \"li\"\n  }, \"true\"), \".\"), mdx(\"li\", {\n    parentName: \"ul\"\n  }, \"Is \", mdx(\"inlineCode\", {\n    parentName: \"li\"\n  }, \"LOG_PRETTY\"), \" environment variable \", mdx(\"inlineCode\", {\n    parentName: \"li\"\n  }, \"false\"), \"? Then \", mdx(\"inlineCode\", {\n    parentName: \"li\"\n  }, \"false\"), \".\"), mdx(\"li\", {\n    parentName: \"ul\"\n  }, \"Is process.stdout attached to a TTY? Then \", mdx(\"inlineCode\", {\n    parentName: \"li\"\n  }, \"true\"))), mdx(\"section\", {\n    parentName: \"section\"\n  }, mdx(\"h6\", _extends({\n    parentName: \"section\"\n  }, {\n    \"id\": \"example-of-what-it-looks-like\",\n    \"style\": {\n      \"position\": \"relative\"\n    }\n  }), mdx(\"a\", _extends({\n    parentName: \"h6\"\n  }, {\n    \"href\": \"#example-of-what-it-looks-like\",\n    \"aria-label\": \"example of what it looks like permalink\",\n    \"className\": \"title-link before\"\n  }), mdx(\"svg\", _extends({\n    parentName: \"a\"\n  }, {\n    \"width\": \"17\",\n    \"height\": \"18\",\n    \"viewBox\": \"0 0 17 18\",\n    \"fill\": \"none\",\n    \"xmlns\": \"http://www.w3.org/2000/svg\"\n  }), \"\\n      \", mdx(\"path\", _extends({\n    parentName: \"svg\"\n  }, {\n    \"d\": \"M1.5 6.33337H15.5\",\n    \"stroke\": \"#CBD5E0\",\n    \"strokeWidth\": \"2\",\n    \"strokeLineCap\": \"round\",\n    \"strokeLineJoin\": \"round\"\n  })), \"\\n      \", mdx(\"path\", _extends({\n    parentName: \"svg\"\n  }, {\n    \"d\": \"M1.5 11.6666H15.5\",\n    \"stroke\": \"#CBD5E0\",\n    \"strokeWidth\": \"2\",\n    \"strokeLineCap\": \"round\",\n    \"strokeLineJoin\": \"round\"\n  })), \"\\n      \", mdx(\"path\", _extends({\n    parentName: \"svg\"\n  }, {\n    \"d\": \"M6.75 1L5 17\",\n    \"stroke\": \"#CBD5E0\",\n    \"strokeWidth\": \"2\",\n    \"strokeLineCap\": \"round\",\n    \"strokeLineJoin\": \"round\"\n  })), \"\\n      \", mdx(\"path\", _extends({\n    parentName: \"svg\"\n  }, {\n    \"d\": \"M12 1L10.25 17\",\n    \"stroke\": \"#CBD5E0\",\n    \"strokeWidth\": \"2\",\n    \"strokeLineCap\": \"round\",\n    \"strokeLineJoin\": \"round\"\n  })), \"\\n      \")), \"Example of what it looks like\"), mdx(\"pre\", {\n    parentName: \"section\"\n  }, mdx(\"code\", _extends({\n    parentName: \"pre\"\n  }, {}), \"LOG_DEMO=true nexus dev\\n\")), mdx(\"pre\", {\n    parentName: \"section\"\n  }, mdx(\"code\", _extends({\n    parentName: \"pre\"\n  }, {}), \"-----------\\nLOGGER DEMO\\n-----------\\n  4 \\u2715 root:foo  --  lib: /see/\\n  0 \\u25A0 root:foo\\n      | har  { mar: 'tek' }\\n      | jar  [\\n      |        1, 2, 3, 4, 4, 5, 6,\\n      |        6, 7, 9, 1, 2, 4, 5,\\n      |        6, 7, 3, 6, 5, 4\\n      |      ]\\n      | kio  [Object: null prototype] [foo] {}\\n  1 \\u25B2 root:foo  --  bleep: [ 1, '2', true ]\\n  0 \\u25CF root:foo\\n  1 \\u25CB root:foo\\n      | results  [\\n      |            { userId: 1, id: 1, title: 'delectus aut autem', completed: false },\\n      |            { userId: 1, id: 2, title: 'quis ut nam facilis et officia qui', completed: false },\\n      |            { userId: 1, id: 3, title: 'fugiat veniam minus', completed: false },\\n      |            { userId: 1, id: 4, title: 'et porro tempora', completed: true },\\n      |            {\\n      |              userId: 1,\\n      |              id: 5,\\n      |              title: 'laboriosam mollitia et enim quasi adipisci quia provident illum',\\n      |              completed: false\\n      |            }\\n      |          ]\\n      | tri      'wiz'\\n      | on       false\\n  0 \\u25CB root:foo  --  foo: 'bar'\\n  0 \\u2014 root:foo  --  a: 1  b: 2  c: 'three'\\n-----------\\n\")))), mdx(\"section\", {\n    parentName: \"section\"\n  }, mdx(\"h4\", _extends({\n    parentName: \"section\"\n  }, {\n    \"id\": \"loggerprettycolor\",\n    \"style\": {\n      \"position\": \"relative\"\n    }\n  }), mdx(\"a\", _extends({\n    parentName: \"h4\"\n  }, {\n    \"href\": \"#loggerprettycolor\",\n    \"aria-label\": \"loggerprettycolor permalink\",\n    \"className\": \"title-link before\"\n  }), mdx(\"svg\", _extends({\n    parentName: \"a\"\n  }, {\n    \"width\": \"17\",\n    \"height\": \"18\",\n    \"viewBox\": \"0 0 17 18\",\n    \"fill\": \"none\",\n    \"xmlns\": \"http://www.w3.org/2000/svg\"\n  }), \"\\n      \", mdx(\"path\", _extends({\n    parentName: \"svg\"\n  }, {\n    \"d\": \"M1.5 6.33337H15.5\",\n    \"stroke\": \"#CBD5E0\",\n    \"strokeWidth\": \"2\",\n    \"strokeLineCap\": \"round\",\n    \"strokeLineJoin\": \"round\"\n  })), \"\\n      \", mdx(\"path\", _extends({\n    parentName: \"svg\"\n  }, {\n    \"d\": \"M1.5 11.6666H15.5\",\n    \"stroke\": \"#CBD5E0\",\n    \"strokeWidth\": \"2\",\n    \"strokeLineCap\": \"round\",\n    \"strokeLineJoin\": \"round\"\n  })), \"\\n      \", mdx(\"path\", _extends({\n    parentName: \"svg\"\n  }, {\n    \"d\": \"M6.75 1L5 17\",\n    \"stroke\": \"#CBD5E0\",\n    \"strokeWidth\": \"2\",\n    \"strokeLineCap\": \"round\",\n    \"strokeLineJoin\": \"round\"\n  })), \"\\n      \", mdx(\"path\", _extends({\n    parentName: \"svg\"\n  }, {\n    \"d\": \"M12 1L10.25 17\",\n    \"stroke\": \"#CBD5E0\",\n    \"strokeWidth\": \"2\",\n    \"strokeLineCap\": \"round\",\n    \"strokeLineJoin\": \"round\"\n  })), \"\\n      \")), mdx(\"inlineCode\", {\n    parentName: \"h4\"\n  }, \"logger.pretty.color\")), mdx(\"p\", {\n    parentName: \"section\"\n  }, \"Should logs have color?\"), mdx(\"p\", {\n    parentName: \"section\"\n  }, mdx(\"em\", {\n    parentName: \"p\"\n  }, \"Default\")), mdx(\"p\", {\n    parentName: \"section\"\n  }, mdx(\"inlineCode\", {\n    parentName: \"p\"\n  }, \"true\"))), mdx(\"section\", {\n    parentName: \"section\"\n  }, mdx(\"h4\", _extends({\n    parentName: \"section\"\n  }, {\n    \"id\": \"loggerprettytimediff\",\n    \"style\": {\n      \"position\": \"relative\"\n    }\n  }), mdx(\"a\", _extends({\n    parentName: \"h4\"\n  }, {\n    \"href\": \"#loggerprettytimediff\",\n    \"aria-label\": \"loggerprettytimediff permalink\",\n    \"className\": \"title-link before\"\n  }), mdx(\"svg\", _extends({\n    parentName: \"a\"\n  }, {\n    \"width\": \"17\",\n    \"height\": \"18\",\n    \"viewBox\": \"0 0 17 18\",\n    \"fill\": \"none\",\n    \"xmlns\": \"http://www.w3.org/2000/svg\"\n  }), \"\\n      \", mdx(\"path\", _extends({\n    parentName: \"svg\"\n  }, {\n    \"d\": \"M1.5 6.33337H15.5\",\n    \"stroke\": \"#CBD5E0\",\n    \"strokeWidth\": \"2\",\n    \"strokeLineCap\": \"round\",\n    \"strokeLineJoin\": \"round\"\n  })), \"\\n      \", mdx(\"path\", _extends({\n    parentName: \"svg\"\n  }, {\n    \"d\": \"M1.5 11.6666H15.5\",\n    \"stroke\": \"#CBD5E0\",\n    \"strokeWidth\": \"2\",\n    \"strokeLineCap\": \"round\",\n    \"strokeLineJoin\": \"round\"\n  })), \"\\n      \", mdx(\"path\", _extends({\n    parentName: \"svg\"\n  }, {\n    \"d\": \"M6.75 1L5 17\",\n    \"stroke\": \"#CBD5E0\",\n    \"strokeWidth\": \"2\",\n    \"strokeLineCap\": \"round\",\n    \"strokeLineJoin\": \"round\"\n  })), \"\\n      \", mdx(\"path\", _extends({\n    parentName: \"svg\"\n  }, {\n    \"d\": \"M12 1L10.25 17\",\n    \"stroke\": \"#CBD5E0\",\n    \"strokeWidth\": \"2\",\n    \"strokeLineCap\": \"round\",\n    \"strokeLineJoin\": \"round\"\n  })), \"\\n      \")), mdx(\"inlineCode\", {\n    parentName: \"h4\"\n  }, \"logger.pretty.timeDiff\")), mdx(\"p\", {\n    parentName: \"section\"\n  }, \"Should a time delta between each log be shown in the gutter?\"), mdx(\"p\", {\n    parentName: \"section\"\n  }, mdx(\"em\", {\n    parentName: \"p\"\n  }, \"Default\")), mdx(\"p\", {\n    parentName: \"section\"\n  }, mdx(\"inlineCode\", {\n    parentName: \"p\"\n  }, \"true\"))), mdx(\"section\", {\n    parentName: \"section\"\n  }, mdx(\"h4\", _extends({\n    parentName: \"section\"\n  }, {\n    \"id\": \"loggerprettylevellabel\",\n    \"style\": {\n      \"position\": \"relative\"\n    }\n  }), mdx(\"a\", _extends({\n    parentName: \"h4\"\n  }, {\n    \"href\": \"#loggerprettylevellabel\",\n    \"aria-label\": \"loggerprettylevellabel permalink\",\n    \"className\": \"title-link before\"\n  }), mdx(\"svg\", _extends({\n    parentName: \"a\"\n  }, {\n    \"width\": \"17\",\n    \"height\": \"18\",\n    \"viewBox\": \"0 0 17 18\",\n    \"fill\": \"none\",\n    \"xmlns\": \"http://www.w3.org/2000/svg\"\n  }), \"\\n      \", mdx(\"path\", _extends({\n    parentName: \"svg\"\n  }, {\n    \"d\": \"M1.5 6.33337H15.5\",\n    \"stroke\": \"#CBD5E0\",\n    \"strokeWidth\": \"2\",\n    \"strokeLineCap\": \"round\",\n    \"strokeLineJoin\": \"round\"\n  })), \"\\n      \", mdx(\"path\", _extends({\n    parentName: \"svg\"\n  }, {\n    \"d\": \"M1.5 11.6666H15.5\",\n    \"stroke\": \"#CBD5E0\",\n    \"strokeWidth\": \"2\",\n    \"strokeLineCap\": \"round\",\n    \"strokeLineJoin\": \"round\"\n  })), \"\\n      \", mdx(\"path\", _extends({\n    parentName: \"svg\"\n  }, {\n    \"d\": \"M6.75 1L5 17\",\n    \"stroke\": \"#CBD5E0\",\n    \"strokeWidth\": \"2\",\n    \"strokeLineCap\": \"round\",\n    \"strokeLineJoin\": \"round\"\n  })), \"\\n      \", mdx(\"path\", _extends({\n    parentName: \"svg\"\n  }, {\n    \"d\": \"M12 1L10.25 17\",\n    \"stroke\": \"#CBD5E0\",\n    \"strokeWidth\": \"2\",\n    \"strokeLineCap\": \"round\",\n    \"strokeLineJoin\": \"round\"\n  })), \"\\n      \")), mdx(\"inlineCode\", {\n    parentName: \"h4\"\n  }, \"logger.pretty.levelLabel\")), mdx(\"p\", {\n    parentName: \"section\"\n  }, \"Should the label of the level be shown in the gutter?\"), mdx(\"p\", {\n    parentName: \"section\"\n  }, mdx(\"em\", {\n    parentName: \"p\"\n  }, \"Default\")), mdx(\"p\", {\n    parentName: \"section\"\n  }, mdx(\"inlineCode\", {\n    parentName: \"p\"\n  }, \"false\")), mdx(\"section\", {\n    parentName: \"section\"\n  }, mdx(\"h5\", _extends({\n    parentName: \"section\"\n  }, {\n    \"id\": \"example\",\n    \"style\": {\n      \"position\": \"relative\"\n    }\n  }), mdx(\"a\", _extends({\n    parentName: \"h5\"\n  }, {\n    \"href\": \"#example\",\n    \"aria-label\": \"example permalink\",\n    \"className\": \"title-link before\"\n  }), mdx(\"svg\", _extends({\n    parentName: \"a\"\n  }, {\n    \"width\": \"17\",\n    \"height\": \"18\",\n    \"viewBox\": \"0 0 17 18\",\n    \"fill\": \"none\",\n    \"xmlns\": \"http://www.w3.org/2000/svg\"\n  }), \"\\n      \", mdx(\"path\", _extends({\n    parentName: \"svg\"\n  }, {\n    \"d\": \"M1.5 6.33337H15.5\",\n    \"stroke\": \"#CBD5E0\",\n    \"strokeWidth\": \"2\",\n    \"strokeLineCap\": \"round\",\n    \"strokeLineJoin\": \"round\"\n  })), \"\\n      \", mdx(\"path\", _extends({\n    parentName: \"svg\"\n  }, {\n    \"d\": \"M1.5 11.6666H15.5\",\n    \"stroke\": \"#CBD5E0\",\n    \"strokeWidth\": \"2\",\n    \"strokeLineCap\": \"round\",\n    \"strokeLineJoin\": \"round\"\n  })), \"\\n      \", mdx(\"path\", _extends({\n    parentName: \"svg\"\n  }, {\n    \"d\": \"M6.75 1L5 17\",\n    \"stroke\": \"#CBD5E0\",\n    \"strokeWidth\": \"2\",\n    \"strokeLineCap\": \"round\",\n    \"strokeLineJoin\": \"round\"\n  })), \"\\n      \", mdx(\"path\", _extends({\n    parentName: \"svg\"\n  }, {\n    \"d\": \"M12 1L10.25 17\",\n    \"stroke\": \"#CBD5E0\",\n    \"strokeWidth\": \"2\",\n    \"strokeLineCap\": \"round\",\n    \"strokeLineJoin\": \"round\"\n  })), \"\\n      \")), \"Example\"), mdx(\"pre\", {\n    parentName: \"section\"\n  }, mdx(\"code\", _extends({\n    parentName: \"pre\"\n  }, {\n    \"className\": \"language-ts\"\n  }), \"import { settings } from 'nexus'\\n\\nsettings.change({\\n  server: {\\n    port: 9876,\\n  },\\n})\\n\"))))), mdx(\"section\", null, mdx(\"h2\", _extends({\n    parentName: \"section\"\n  }, {\n    \"id\": \"current\",\n    \"style\": {\n      \"position\": \"relative\"\n    }\n  }), mdx(\"a\", _extends({\n    parentName: \"h2\"\n  }, {\n    \"href\": \"#current\",\n    \"aria-label\": \"current permalink\",\n    \"className\": \"title-link before\"\n  }), mdx(\"svg\", _extends({\n    parentName: \"a\"\n  }, {\n    \"width\": \"17\",\n    \"height\": \"18\",\n    \"viewBox\": \"0 0 17 18\",\n    \"fill\": \"none\",\n    \"xmlns\": \"http://www.w3.org/2000/svg\"\n  }), \"\\n      \", mdx(\"path\", _extends({\n    parentName: \"svg\"\n  }, {\n    \"d\": \"M1.5 6.33337H15.5\",\n    \"stroke\": \"#CBD5E0\",\n    \"strokeWidth\": \"2\",\n    \"strokeLineCap\": \"round\",\n    \"strokeLineJoin\": \"round\"\n  })), \"\\n      \", mdx(\"path\", _extends({\n    parentName: \"svg\"\n  }, {\n    \"d\": \"M1.5 11.6666H15.5\",\n    \"stroke\": \"#CBD5E0\",\n    \"strokeWidth\": \"2\",\n    \"strokeLineCap\": \"round\",\n    \"strokeLineJoin\": \"round\"\n  })), \"\\n      \", mdx(\"path\", _extends({\n    parentName: \"svg\"\n  }, {\n    \"d\": \"M6.75 1L5 17\",\n    \"stroke\": \"#CBD5E0\",\n    \"strokeWidth\": \"2\",\n    \"strokeLineCap\": \"round\",\n    \"strokeLineJoin\": \"round\"\n  })), \"\\n      \", mdx(\"path\", _extends({\n    parentName: \"svg\"\n  }, {\n    \"d\": \"M12 1L10.25 17\",\n    \"stroke\": \"#CBD5E0\",\n    \"strokeWidth\": \"2\",\n    \"strokeLineCap\": \"round\",\n    \"strokeLineJoin\": \"round\"\n  })), \"\\n      \")), mdx(\"inlineCode\", {\n    parentName: \"h2\"\n  }, \"current\")), mdx(\"section\", {\n    parentName: \"section\"\n  }, mdx(\"h5\", _extends({\n    parentName: \"section\"\n  }, {\n    \"id\": \"type\",\n    \"style\": {\n      \"position\": \"relative\"\n    }\n  }), mdx(\"a\", _extends({\n    parentName: \"h5\"\n  }, {\n    \"href\": \"#type\",\n    \"aria-label\": \"type permalink\",\n    \"className\": \"title-link before\"\n  }), mdx(\"svg\", _extends({\n    parentName: \"a\"\n  }, {\n    \"width\": \"17\",\n    \"height\": \"18\",\n    \"viewBox\": \"0 0 17 18\",\n    \"fill\": \"none\",\n    \"xmlns\": \"http://www.w3.org/2000/svg\"\n  }), \"\\n      \", mdx(\"path\", _extends({\n    parentName: \"svg\"\n  }, {\n    \"d\": \"M1.5 6.33337H15.5\",\n    \"stroke\": \"#CBD5E0\",\n    \"strokeWidth\": \"2\",\n    \"strokeLineCap\": \"round\",\n    \"strokeLineJoin\": \"round\"\n  })), \"\\n      \", mdx(\"path\", _extends({\n    parentName: \"svg\"\n  }, {\n    \"d\": \"M1.5 11.6666H15.5\",\n    \"stroke\": \"#CBD5E0\",\n    \"strokeWidth\": \"2\",\n    \"strokeLineCap\": \"round\",\n    \"strokeLineJoin\": \"round\"\n  })), \"\\n      \", mdx(\"path\", _extends({\n    parentName: \"svg\"\n  }, {\n    \"d\": \"M6.75 1L5 17\",\n    \"stroke\": \"#CBD5E0\",\n    \"strokeWidth\": \"2\",\n    \"strokeLineCap\": \"round\",\n    \"strokeLineJoin\": \"round\"\n  })), \"\\n      \", mdx(\"path\", _extends({\n    parentName: \"svg\"\n  }, {\n    \"d\": \"M12 1L10.25 17\",\n    \"stroke\": \"#CBD5E0\",\n    \"strokeWidth\": \"2\",\n    \"strokeLineCap\": \"round\",\n    \"strokeLineJoin\": \"round\"\n  })), \"\\n      \")), \"Type\"), mdx(\"pre\", {\n    parentName: \"section\"\n  }, mdx(\"code\", _extends({\n    parentName: \"pre\"\n  }, {\n    \"className\": \"language-ts\"\n  }), \"SettingsData\\n\")), mdx(\"p\", {\n    parentName: \"section\"\n  }, \"A reference to the current settings object.\"))), mdx(\"section\", null, mdx(\"h2\", _extends({\n    parentName: \"section\"\n  }, {\n    \"id\": \"original\",\n    \"style\": {\n      \"position\": \"relative\"\n    }\n  }), mdx(\"a\", _extends({\n    parentName: \"h2\"\n  }, {\n    \"href\": \"#original\",\n    \"aria-label\": \"original permalink\",\n    \"className\": \"title-link before\"\n  }), mdx(\"svg\", _extends({\n    parentName: \"a\"\n  }, {\n    \"width\": \"17\",\n    \"height\": \"18\",\n    \"viewBox\": \"0 0 17 18\",\n    \"fill\": \"none\",\n    \"xmlns\": \"http://www.w3.org/2000/svg\"\n  }), \"\\n      \", mdx(\"path\", _extends({\n    parentName: \"svg\"\n  }, {\n    \"d\": \"M1.5 6.33337H15.5\",\n    \"stroke\": \"#CBD5E0\",\n    \"strokeWidth\": \"2\",\n    \"strokeLineCap\": \"round\",\n    \"strokeLineJoin\": \"round\"\n  })), \"\\n      \", mdx(\"path\", _extends({\n    parentName: \"svg\"\n  }, {\n    \"d\": \"M1.5 11.6666H15.5\",\n    \"stroke\": \"#CBD5E0\",\n    \"strokeWidth\": \"2\",\n    \"strokeLineCap\": \"round\",\n    \"strokeLineJoin\": \"round\"\n  })), \"\\n      \", mdx(\"path\", _extends({\n    parentName: \"svg\"\n  }, {\n    \"d\": \"M6.75 1L5 17\",\n    \"stroke\": \"#CBD5E0\",\n    \"strokeWidth\": \"2\",\n    \"strokeLineCap\": \"round\",\n    \"strokeLineJoin\": \"round\"\n  })), \"\\n      \", mdx(\"path\", _extends({\n    parentName: \"svg\"\n  }, {\n    \"d\": \"M12 1L10.25 17\",\n    \"stroke\": \"#CBD5E0\",\n    \"strokeWidth\": \"2\",\n    \"strokeLineCap\": \"round\",\n    \"strokeLineJoin\": \"round\"\n  })), \"\\n      \")), mdx(\"inlineCode\", {\n    parentName: \"h2\"\n  }, \"original\")), mdx(\"pre\", {\n    parentName: \"section\"\n  }, mdx(\"code\", _extends({\n    parentName: \"pre\"\n  }, {\n    \"className\": \"language-ts\"\n  }), \"SettingsData\\n\")), mdx(\"p\", {\n    parentName: \"section\"\n  }, \"A reference to the original settings object.\")), mdx(\"section\", null, mdx(\"h2\", _extends({\n    parentName: \"section\"\n  }, {\n    \"id\": \"type-glossary\",\n    \"style\": {\n      \"position\": \"relative\"\n    }\n  }), mdx(\"a\", _extends({\n    parentName: \"h2\"\n  }, {\n    \"href\": \"#type-glossary\",\n    \"aria-label\": \"type glossary permalink\",\n    \"className\": \"title-link before\"\n  }), mdx(\"svg\", _extends({\n    parentName: \"a\"\n  }, {\n    \"width\": \"17\",\n    \"height\": \"18\",\n    \"viewBox\": \"0 0 17 18\",\n    \"fill\": \"none\",\n    \"xmlns\": \"http://www.w3.org/2000/svg\"\n  }), \"\\n      \", mdx(\"path\", _extends({\n    parentName: \"svg\"\n  }, {\n    \"d\": \"M1.5 6.33337H15.5\",\n    \"stroke\": \"#CBD5E0\",\n    \"strokeWidth\": \"2\",\n    \"strokeLineCap\": \"round\",\n    \"strokeLineJoin\": \"round\"\n  })), \"\\n      \", mdx(\"path\", _extends({\n    parentName: \"svg\"\n  }, {\n    \"d\": \"M1.5 11.6666H15.5\",\n    \"stroke\": \"#CBD5E0\",\n    \"strokeWidth\": \"2\",\n    \"strokeLineCap\": \"round\",\n    \"strokeLineJoin\": \"round\"\n  })), \"\\n      \", mdx(\"path\", _extends({\n    parentName: \"svg\"\n  }, {\n    \"d\": \"M6.75 1L5 17\",\n    \"stroke\": \"#CBD5E0\",\n    \"strokeWidth\": \"2\",\n    \"strokeLineCap\": \"round\",\n    \"strokeLineJoin\": \"round\"\n  })), \"\\n      \", mdx(\"path\", _extends({\n    parentName: \"svg\"\n  }, {\n    \"d\": \"M12 1L10.25 17\",\n    \"stroke\": \"#CBD5E0\",\n    \"strokeWidth\": \"2\",\n    \"strokeLineCap\": \"round\",\n    \"strokeLineJoin\": \"round\"\n  })), \"\\n      \")), \"Type Glossary\"), mdx(\"section\", {\n    parentName: \"section\"\n  }, mdx(\"h4\", _extends({\n    parentName: \"section\"\n  }, {\n    \"id\": \"level\",\n    \"style\": {\n      \"position\": \"relative\"\n    }\n  }), mdx(\"a\", _extends({\n    parentName: \"h4\"\n  }, {\n    \"href\": \"#level\",\n    \"aria-label\": \"level permalink\",\n    \"className\": \"title-link before\"\n  }), mdx(\"svg\", _extends({\n    parentName: \"a\"\n  }, {\n    \"width\": \"17\",\n    \"height\": \"18\",\n    \"viewBox\": \"0 0 17 18\",\n    \"fill\": \"none\",\n    \"xmlns\": \"http://www.w3.org/2000/svg\"\n  }), \"\\n      \", mdx(\"path\", _extends({\n    parentName: \"svg\"\n  }, {\n    \"d\": \"M1.5 6.33337H15.5\",\n    \"stroke\": \"#CBD5E0\",\n    \"strokeWidth\": \"2\",\n    \"strokeLineCap\": \"round\",\n    \"strokeLineJoin\": \"round\"\n  })), \"\\n      \", mdx(\"path\", _extends({\n    parentName: \"svg\"\n  }, {\n    \"d\": \"M1.5 11.6666H15.5\",\n    \"stroke\": \"#CBD5E0\",\n    \"strokeWidth\": \"2\",\n    \"strokeLineCap\": \"round\",\n    \"strokeLineJoin\": \"round\"\n  })), \"\\n      \", mdx(\"path\", _extends({\n    parentName: \"svg\"\n  }, {\n    \"d\": \"M6.75 1L5 17\",\n    \"stroke\": \"#CBD5E0\",\n    \"strokeWidth\": \"2\",\n    \"strokeLineCap\": \"round\",\n    \"strokeLineJoin\": \"round\"\n  })), \"\\n      \", mdx(\"path\", _extends({\n    parentName: \"svg\"\n  }, {\n    \"d\": \"M12 1L10.25 17\",\n    \"stroke\": \"#CBD5E0\",\n    \"strokeWidth\": \"2\",\n    \"strokeLineCap\": \"round\",\n    \"strokeLineJoin\": \"round\"\n  })), \"\\n      \")), \"Level\"), mdx(\"pre\", {\n    parentName: \"section\"\n  }, mdx(\"code\", _extends({\n    parentName: \"pre\"\n  }, {}), \"'trace' | 'debug' | 'info' | 'warn' | 'critical' | 'fatal'\\n\"))), mdx(\"section\", {\n    parentName: \"section\"\n  }, mdx(\"h4\", _extends({\n    parentName: \"section\"\n  }, {\n    \"id\": \"settingsdata\",\n    \"style\": {\n      \"position\": \"relative\"\n    }\n  }), mdx(\"a\", _extends({\n    parentName: \"h4\"\n  }, {\n    \"href\": \"#settingsdata\",\n    \"aria-label\": \"settingsdata permalink\",\n    \"className\": \"title-link before\"\n  }), mdx(\"svg\", _extends({\n    parentName: \"a\"\n  }, {\n    \"width\": \"17\",\n    \"height\": \"18\",\n    \"viewBox\": \"0 0 17 18\",\n    \"fill\": \"none\",\n    \"xmlns\": \"http://www.w3.org/2000/svg\"\n  }), \"\\n      \", mdx(\"path\", _extends({\n    parentName: \"svg\"\n  }, {\n    \"d\": \"M1.5 6.33337H15.5\",\n    \"stroke\": \"#CBD5E0\",\n    \"strokeWidth\": \"2\",\n    \"strokeLineCap\": \"round\",\n    \"strokeLineJoin\": \"round\"\n  })), \"\\n      \", mdx(\"path\", _extends({\n    parentName: \"svg\"\n  }, {\n    \"d\": \"M1.5 11.6666H15.5\",\n    \"stroke\": \"#CBD5E0\",\n    \"strokeWidth\": \"2\",\n    \"strokeLineCap\": \"round\",\n    \"strokeLineJoin\": \"round\"\n  })), \"\\n      \", mdx(\"path\", _extends({\n    parentName: \"svg\"\n  }, {\n    \"d\": \"M6.75 1L5 17\",\n    \"stroke\": \"#CBD5E0\",\n    \"strokeWidth\": \"2\",\n    \"strokeLineCap\": \"round\",\n    \"strokeLineJoin\": \"round\"\n  })), \"\\n      \", mdx(\"path\", _extends({\n    parentName: \"svg\"\n  }, {\n    \"d\": \"M12 1L10.25 17\",\n    \"stroke\": \"#CBD5E0\",\n    \"strokeWidth\": \"2\",\n    \"strokeLineCap\": \"round\",\n    \"strokeLineJoin\": \"round\"\n  })), \"\\n      \")), \"SettingsData\"), mdx(\"p\", {\n    parentName: \"section\"\n  }, \"todo\"))));\n}\n;\nMDXContent.isMDXComponent = true;","parent":{"__typename":"File","relativePath":"04-api/01-nexus/04-settings.mdx"},"tableOfContents":{"items":[{"url":"#import--settings-","title":"import { settings }"},{"url":"#change","title":"change","items":[{"items":[{"url":"#serverplayground","title":"server.playground"},{"url":"#serverport","title":"server.port"},{"url":"#serverhost","title":"server.host"},{"url":"#serverpath","title":"server.path"},{"url":"#schemanullableinputs","title":"schema.nullable.inputs"},{"url":"#schemanullableoutputs","title":"schema.nullable.outputs"},{"url":"#schemagenerategraphqlsdlfile","title":"schema.generateGraphQLSDLFile"},{"url":"#schemaroottypingsglobpattern","title":"schema.rootTypingsGlobPattern"},{"url":"#schemaconnections","title":"schema.connections","items":[{"items":[{"url":"#example-of-adding-a-specialized-kind-of-connection-field-builder-docsify-ignore","title":"Example of adding a specialized kind of connection field builder {docsify-ignore}"},{"url":"#example-of-including-a-nodes-field-like-github-api-globally-docsify-ignore","title":"Example of including a nodes field like GitHub API globally {docsify-ignore}"}]}]},{"url":"#loggerfilter","title":"logger.filter"},{"url":"#loggerfilterlevel","title":"logger.filter.level"},{"url":"#loggerfilterpattern","title":"logger.filter.pattern","items":[{"url":"#examples","title":"Examples"}]},{"url":"#loggerpretty","title":"logger.pretty"},{"url":"#loggerprettyenabled","title":"logger.pretty.enabled","items":[{"items":[{"url":"#example-of-what-it-looks-like","title":"Example of what it looks like"}]}]},{"url":"#loggerprettycolor","title":"logger.pretty.color"},{"url":"#loggerprettytimediff","title":"logger.pretty.timeDiff"},{"url":"#loggerprettylevellabel","title":"logger.pretty.levelLabel","items":[{"url":"#example","title":"Example"}]}]}]},{"url":"#current","title":"current","items":[{"items":[{"items":[{"url":"#type","title":"Type"}]}]}]},{"url":"#original","title":"original"},{"url":"#type-glossary","title":"Type Glossary","items":[{"items":[{"url":"#level","title":"Level"},{"url":"#settingsdata","title":"SettingsData"}]}]}]},"frontmatter":{"title":"`settings`","metaTitle":null,"metaDescription":null}}},"pageContext":{"id":"4c56f225-46f9-5a17-b758-d14ea04f62f9","seoTitle":"`settings`","seoDescription":"`settings`"}}}